RESET MASTER;
# Connection default
CREATE TABLE t1 (a INT, b VARCHAR(100), PRIMARY KEY (a,b)) ENGINE=innodb;
SHOW MASTER STATUS;
File	Position	Binlog_Do_DB	Binlog_Ignore_DB	Executed_Gtid_Set
master-bin.000001	266			
SHOW STATUS LIKE 'binlog_snapshot_%';
Variable_name	Value
Binlog_snapshot_file	master-bin.000001
Binlog_snapshot_position	266
BEGIN;
INSERT INTO t1 VALUES (0, "");
# Connection con1
BEGIN;
INSERT INTO t1 VALUES (1, "");
# Connection con2
CREATE TABLE t2 (a INT PRIMARY KEY) ENGINE=myisam;
BEGIN;
INSERT INTO t1 VALUES (2, "first");
INSERT INTO t2 VALUES (2);
INSERT INTO t1 VALUES (2, "second");
# Connection default
COMMIT;
SET TRANSACTION ISOLATION LEVEL REPEATABLE READ;
START TRANSACTION WITH CONSISTENT SNAPSHOT;
# Connection con3
BEGIN;
INSERT INTO t1 VALUES (3, "");
INSERT INTO t2 VALUES (3);
# Connection con4
BEGIN;
INSERT INTO t1 VALUES (4, "");
COMMIT;
# Connection default
SELECT * FROM t1 ORDER BY a,b;
a	b
0	
SHOW STATUS LIKE 'binlog_snapshot_%';
Variable_name	Value
Binlog_snapshot_file	master-bin.000001
Binlog_snapshot_position	860
SHOW MASTER STATUS;
File	Position	Binlog_Do_DB	Binlog_Ignore_DB	Executed_Gtid_Set
master-bin.000001	1331			
SELECT * FROM t2 ORDER BY a;
a
2
3
# Connection con1
COMMIT;
# Connection con2
COMMIT;
# Connection con3
COMMIT;
FLUSH LOGS;
# Connection default
SELECT * FROM t1 ORDER BY a,b;
a	b
0	
SHOW STATUS LIKE 'binlog_snapshot_%';
Variable_name	Value
Binlog_snapshot_file	master-bin.000001
Binlog_snapshot_position	860
SHOW MASTER STATUS;
File	Position	Binlog_Do_DB	Binlog_Ignore_DB	Executed_Gtid_Set
master-bin.000002	120			
COMMIT;
SHOW STATUS LIKE 'binlog_snapshot_%';
Variable_name	Value
Binlog_snapshot_file	master-bin.000002
Binlog_snapshot_position	120
SHOW MASTER STATUS;
File	Position	Binlog_Do_DB	Binlog_Ignore_DB	Executed_Gtid_Set
master-bin.000002	120			
# Test START TRANSACTION WITH CONSISTENT SNAPSHOT FROM SESSION
DELETE FROM t1;
START TRANSACTION WITH CONSISTENT SNAPSHOT;
SHOW STATUS LIKE 'binlog_snapshot_%';
Variable_name	Value
Binlog_snapshot_file	master-bin.000002
Binlog_snapshot_position	318
SHOW MASTER STATUS;
File	Position	Binlog_Do_DB	Binlog_Ignore_DB	Executed_Gtid_Set
master-bin.000002	318			
INSERT INTO t1 VALUES (1, "first");
SELECT * FROM t1;
a	b
1	first
# Connection con3
INSERT INTO t1 VALUES (3, "third");
SELECT * FROM t1;
a	b
3	third
SHOW STATUS LIKE 'binlog_snapshot_%';
Variable_name	Value
Binlog_snapshot_file	master-bin.000002
Binlog_snapshot_position	536
SHOW MASTER STATUS;
File	Position	Binlog_Do_DB	Binlog_Ignore_DB	Executed_Gtid_Set
master-bin.000002	536			
# Connection con2
SELECT * FROM t1;
a	b
3	third
SHOW STATUS LIKE 'binlog_snapshot_%';
Variable_name	Value
Binlog_snapshot_file	master-bin.000002
Binlog_snapshot_position	536
SHOW MASTER STATUS;
File	Position	Binlog_Do_DB	Binlog_Ignore_DB	Executed_Gtid_Set
master-bin.000002	536			
START TRANSACTION WITH CONSISTENT SNAPSHOT FROM SESSION $donor_id;
SELECT * FROM t1;
a	b
1	first
SHOW STATUS LIKE 'binlog_snapshot_%';
Variable_name	Value
Binlog_snapshot_file	master-bin.000002
Binlog_snapshot_position	318
SHOW MASTER STATUS;
File	Position	Binlog_Do_DB	Binlog_Ignore_DB	Executed_Gtid_Set
master-bin.000002	536			
# Connection con3
FLUSH LOGS;
SHOW STATUS LIKE 'binlog_snapshot_%';
Variable_name	Value
Binlog_snapshot_file	master-bin.000003
Binlog_snapshot_position	120
SHOW MASTER STATUS;
File	Position	Binlog_Do_DB	Binlog_Ignore_DB	Executed_Gtid_Set
master-bin.000003	120			
# Connection con2
SHOW STATUS LIKE 'binlog_snapshot_%';
Variable_name	Value
Binlog_snapshot_file	master-bin.000002
Binlog_snapshot_position	318
SHOW MASTER STATUS;
File	Position	Binlog_Do_DB	Binlog_Ignore_DB	Executed_Gtid_Set
master-bin.000003	120			
COMMIT;
# Connection default
SHOW STATUS LIKE 'binlog_snapshot_%';
Variable_name	Value
Binlog_snapshot_file	master-bin.000002
Binlog_snapshot_position	318
SHOW MASTER STATUS;
File	Position	Binlog_Do_DB	Binlog_Ignore_DB	Executed_Gtid_Set
master-bin.000003	120			
COMMIT;
SHOW BINLOG EVENTS;
Log_name	Pos	Event_type	Server_id	End_log_pos	Info
master-bin.000001	4	Format_desc	1	120	Server ver: #, Binlog ver: #
master-bin.000001	120	Query	1	266	use `test`; CREATE TABLE t1 (a INT, b VARCHAR(100), PRIMARY KEY (a,b)) ENGINE=innodb
master-bin.000001	266	Query	1	389	use `test`; CREATE TABLE t2 (a INT PRIMARY KEY) ENGINE=myisam
master-bin.000001	389	Query	1	468	BEGIN
master-bin.000001	468	Query	1	567	use `test`; INSERT INTO t2 VALUES (2)
master-bin.000001	567	Query	1	647	COMMIT
master-bin.000001	647	Query	1	726	BEGIN
master-bin.000001	726	Query	1	829	use `test`; INSERT INTO t1 VALUES (0, "")
master-bin.000001	829	Xid	1	860	COMMIT /* XID */
master-bin.000001	860	Query	1	939	BEGIN
master-bin.000001	939	Query	1	1038	use `test`; INSERT INTO t2 VALUES (3)
master-bin.000001	1038	Query	1	1118	COMMIT
master-bin.000001	1118	Query	1	1197	BEGIN
master-bin.000001	1197	Query	1	1300	use `test`; INSERT INTO t1 VALUES (4, "")
master-bin.000001	1300	Xid	1	1331	COMMIT /* XID */
master-bin.000001	1331	Query	1	1410	BEGIN
master-bin.000001	1410	Query	1	1513	use `test`; INSERT INTO t1 VALUES (1, "")
master-bin.000001	1513	Xid	1	1544	COMMIT /* XID */
master-bin.000001	1544	Query	1	1623	BEGIN
master-bin.000001	1623	Query	1	1731	use `test`; INSERT INTO t1 VALUES (2, "first")
master-bin.000001	1731	Query	1	1840	use `test`; INSERT INTO t1 VALUES (2, "second")
master-bin.000001	1840	Xid	1	1871	COMMIT /* XID */
master-bin.000001	1871	Query	1	1950	BEGIN
master-bin.000001	1950	Query	1	2053	use `test`; INSERT INTO t1 VALUES (3, "")
master-bin.000001	2053	Xid	1	2084	COMMIT /* XID */
master-bin.000001	2084	Rotate	1	2132	master-bin.000002;pos=4
DROP TABLE t1,t2;
