CALL mtr.add_suppression("Statement is unsafe because it accesses a non-transactional table after");
RESET MASTER;
# Connection default
CREATE TABLE t1 (a INT, b VARCHAR(100), PRIMARY KEY (a,b)) ENGINE=innodb;
SHOW MASTER STATUS;
File	Position	Binlog_Do_DB	Binlog_Ignore_DB	Executed_Gtid_Set
binlog.000001	388			
SHOW STATUS LIKE 'binlog_snapshot_%';
Variable_name	Value
Binlog_snapshot_file	binlog.000001
Binlog_snapshot_position	388
BEGIN;
INSERT INTO t1 VALUES (0, "");
# Connection con1
BEGIN;
INSERT INTO t1 VALUES (1, "");
# Connection con2
CREATE TABLE t2 (a INT PRIMARY KEY) ENGINE=myisam;
BEGIN;
INSERT INTO t1 VALUES (2, "first");
INSERT INTO t2 VALUES (2);
Warnings:
Note	1592	Unsafe statement written to the binary log using statement format since BINLOG_FORMAT = STATEMENT. Statement is unsafe because it accesses a non-transactional table after accessing a transactional table within the same transaction.
INSERT INTO t1 VALUES (2, "second");
# Connection default
COMMIT;
SET TRANSACTION ISOLATION LEVEL REPEATABLE READ;
START TRANSACTION WITH CONSISTENT SNAPSHOT;
# Connection con3
BEGIN;
INSERT INTO t1 VALUES (3, "");
INSERT INTO t2 VALUES (3);
Warnings:
Note	1592	Unsafe statement written to the binary log using statement format since BINLOG_FORMAT = STATEMENT. Statement is unsafe because it accesses a non-transactional table after accessing a transactional table within the same transaction.
# Connection con4
BEGIN;
INSERT INTO t1 VALUES (4, "");
COMMIT;
# Connection default
SELECT * FROM t1 ORDER BY a,b;
a	b
0	
SHOW STATUS LIKE 'binlog_snapshot_%';
Variable_name	Value
Binlog_snapshot_file	binlog.000001
Binlog_snapshot_position	887
SHOW MASTER STATUS;
File	Position	Binlog_Do_DB	Binlog_Ignore_DB	Executed_Gtid_Set
binlog.000001	1185			
SELECT * FROM t2 ORDER BY a;
a
2
3
# Connection con1
COMMIT;
# Connection con2
COMMIT;
# Connection con3
COMMIT;
FLUSH LOGS;
# Connection default
SELECT * FROM t1 ORDER BY a,b;
a	b
0	
SHOW STATUS LIKE 'binlog_snapshot_%';
Variable_name	Value
Binlog_snapshot_file	binlog.000001
Binlog_snapshot_position	887
SHOW MASTER STATUS;
File	Position	Binlog_Do_DB	Binlog_Ignore_DB	Executed_Gtid_Set
binlog.000002	155			
COMMIT;
SHOW STATUS LIKE 'binlog_snapshot_%';
Variable_name	Value
Binlog_snapshot_file	binlog.000002
Binlog_snapshot_position	155
SHOW MASTER STATUS;
File	Position	Binlog_Do_DB	Binlog_Ignore_DB	Executed_Gtid_Set
binlog.000002	155			
# Test START TRANSACTION WITH CONSISTENT SNAPSHOT FROM SESSION
DELETE FROM t1;
START TRANSACTION WITH CONSISTENT SNAPSHOT;
SHOW STATUS LIKE 'binlog_snapshot_%';
Variable_name	Value
Binlog_snapshot_file	binlog.000002
Binlog_snapshot_position	438
SHOW MASTER STATUS;
File	Position	Binlog_Do_DB	Binlog_Ignore_DB	Executed_Gtid_Set
binlog.000002	438			
INSERT INTO t1 VALUES (1, "first");
SELECT * FROM t1;
a	b
1	first
# Connection con3
INSERT INTO t1 VALUES (3, "third");
SELECT * FROM t1;
a	b
3	third
SHOW STATUS LIKE 'binlog_snapshot_%';
Variable_name	Value
Binlog_snapshot_file	binlog.000002
Binlog_snapshot_position	741
SHOW MASTER STATUS;
File	Position	Binlog_Do_DB	Binlog_Ignore_DB	Executed_Gtid_Set
binlog.000002	741			
# Connection con2
SELECT * FROM t1;
a	b
3	third
SHOW STATUS LIKE 'binlog_snapshot_%';
Variable_name	Value
Binlog_snapshot_file	binlog.000002
Binlog_snapshot_position	741
SHOW MASTER STATUS;
File	Position	Binlog_Do_DB	Binlog_Ignore_DB	Executed_Gtid_Set
binlog.000002	741			
START TRANSACTION WITH CONSISTENT SNAPSHOT FROM SESSION $donor_id;
SELECT * FROM t1;
a	b
1	first
SHOW STATUS LIKE 'binlog_snapshot_%';
Variable_name	Value
Binlog_snapshot_file	binlog.000002
Binlog_snapshot_position	438
SHOW MASTER STATUS;
File	Position	Binlog_Do_DB	Binlog_Ignore_DB	Executed_Gtid_Set
binlog.000002	741			
# Connection con3
FLUSH LOGS;
SHOW STATUS LIKE 'binlog_snapshot_%';
Variable_name	Value
Binlog_snapshot_file	binlog.000003
Binlog_snapshot_position	155
SHOW MASTER STATUS;
File	Position	Binlog_Do_DB	Binlog_Ignore_DB	Executed_Gtid_Set
binlog.000003	155			
# Connection con2
SHOW STATUS LIKE 'binlog_snapshot_%';
Variable_name	Value
Binlog_snapshot_file	binlog.000002
Binlog_snapshot_position	438
SHOW MASTER STATUS;
File	Position	Binlog_Do_DB	Binlog_Ignore_DB	Executed_Gtid_Set
binlog.000003	155			
COMMIT;
# Connection default
SHOW STATUS LIKE 'binlog_snapshot_%';
Variable_name	Value
Binlog_snapshot_file	binlog.000002
Binlog_snapshot_position	438
SHOW MASTER STATUS;
File	Position	Binlog_Do_DB	Binlog_Ignore_DB	Executed_Gtid_Set
binlog.000003	155			
COMMIT;
SHOW BINLOG EVENTS;
Log_name	Pos	Event_type	Server_id	End_log_pos	Info
binlog.000001	4	Format_desc	1	124	Server ver: #, Binlog ver: #
binlog.000001	124	Previous_gtids	1	155	
binlog.000001	155	Anonymous_Gtid	1	228	SET @@SESSION.GTID_NEXT= 'ANONYMOUS'
binlog.000001	228	Query	1	388	use `test`; CREATE TABLE t1 (a INT, b VARCHAR(100), PRIMARY KEY (a,b)) ENGINE=innodb /* XID */
binlog.000001	388	Anonymous_Gtid	1	461	SET @@SESSION.GTID_NEXT= 'ANONYMOUS'
binlog.000001	461	Query	1	589	use `test`; CREATE TABLE t2 (a INT PRIMARY KEY) ENGINE=myisam
binlog.000001	589	Anonymous_Gtid	1	664	SET @@SESSION.GTID_NEXT= 'ANONYMOUS'
binlog.000001	664	Query	1	748	BEGIN
binlog.000001	748	Query	1	856	use `test`; INSERT INTO t1 VALUES (0, "")
binlog.000001	856	Xid	1	887	COMMIT /* XID */
binlog.000001	887	Anonymous_Gtid	1	962	SET @@SESSION.GTID_NEXT= 'ANONYMOUS'
binlog.000001	962	Query	1	1046	BEGIN
binlog.000001	1046	Query	1	1154	use `test`; INSERT INTO t1 VALUES (4, "")
binlog.000001	1154	Xid	1	1185	COMMIT /* XID */
binlog.000001	1185	Anonymous_Gtid	1	1260	SET @@SESSION.GTID_NEXT= 'ANONYMOUS'
binlog.000001	1260	Query	1	1344	BEGIN
binlog.000001	1344	Query	1	1452	use `test`; INSERT INTO t1 VALUES (1, "")
binlog.000001	1452	Xid	1	1483	COMMIT /* XID */
binlog.000001	1483	Anonymous_Gtid	1	1558	SET @@SESSION.GTID_NEXT= 'ANONYMOUS'
binlog.000001	1558	Query	1	1642	BEGIN
binlog.000001	1642	Query	1	1755	use `test`; INSERT INTO t1 VALUES (2, "first")
binlog.000001	1755	Query	1	1859	use `test`; INSERT INTO t2 VALUES (2)
binlog.000001	1859	Query	1	1973	use `test`; INSERT INTO t1 VALUES (2, "second")
binlog.000001	1973	Xid	1	2004	COMMIT /* XID */
binlog.000001	2004	Anonymous_Gtid	1	2079	SET @@SESSION.GTID_NEXT= 'ANONYMOUS'
binlog.000001	2079	Query	1	2163	BEGIN
binlog.000001	2163	Query	1	2271	use `test`; INSERT INTO t1 VALUES (3, "")
binlog.000001	2271	Query	1	2375	use `test`; INSERT INTO t2 VALUES (3)
binlog.000001	2375	Xid	1	2406	COMMIT /* XID */
binlog.000001	2406	Rotate	1	2450	binlog.000002;pos=4
DROP TABLE t1,t2;
