RESET BINARY LOGS AND GTIDS;
# Connection default
CREATE TABLE t1 (a INT, b VARCHAR(100), PRIMARY KEY (a,b)) ENGINE=innodb;
SHOW BINARY LOG STATUS;
File	Position	Binlog_Do_DB	Binlog_Ignore_DB	Executed_Gtid_Set
binlog.000001	395			
SHOW STATUS LIKE 'binlog_snapshot_%';
Variable_name	Value
Binlog_snapshot_file	binlog.000001
Binlog_snapshot_position	395
Binlog_snapshot_gtid_executed	not-in-consistent-snapshot
BEGIN;
INSERT INTO t1 VALUES (0, "");
# Connection con1
BEGIN;
INSERT INTO t1 VALUES (1, "");
# Connection con2
CREATE TABLE t2 (a INT PRIMARY KEY) ENGINE=myisam;
BEGIN;
INSERT INTO t1 VALUES (2, "first");
INSERT INTO t2 VALUES (2);
INSERT INTO t1 VALUES (2, "second");
# Connection default
COMMIT;
SET TRANSACTION ISOLATION LEVEL REPEATABLE READ;
START TRANSACTION WITH CONSISTENT SNAPSHOT;
# Connection con3
BEGIN;
INSERT INTO t1 VALUES (3, "");
INSERT INTO t2 VALUES (3);
# Connection con4
BEGIN;
INSERT INTO t1 VALUES (4, "");
COMMIT;
# Connection default
SELECT * FROM t1 ORDER BY a,b;
a	b
0	
SHOW STATUS LIKE 'binlog_snapshot_%';
Variable_name	Value
Binlog_snapshot_file	binlog.000001
Binlog_snapshot_position	1201
Binlog_snapshot_gtid_executed	
SHOW BINARY LOG STATUS;
File	Position	Binlog_Do_DB	Binlog_Ignore_DB	Executed_Gtid_Set
binlog.000001	1802			
SELECT * FROM t2 ORDER BY a;
a
2
3
# Connection con1
COMMIT;
# Connection con2
COMMIT;
# Connection con3
COMMIT;
FLUSH LOGS;
# Connection default
SELECT * FROM t1 ORDER BY a,b;
a	b
0	
SHOW STATUS LIKE 'binlog_snapshot_%';
Variable_name	Value
Binlog_snapshot_file	binlog.000001
Binlog_snapshot_position	1201
Binlog_snapshot_gtid_executed	
SHOW BINARY LOG STATUS;
File	Position	Binlog_Do_DB	Binlog_Ignore_DB	Executed_Gtid_Set
binlog.000002	158			
COMMIT;
SHOW STATUS LIKE 'binlog_snapshot_%';
Variable_name	Value
Binlog_snapshot_file	binlog.000002
Binlog_snapshot_position	158
Binlog_snapshot_gtid_executed	not-in-consistent-snapshot
SHOW BINARY LOG STATUS;
File	Position	Binlog_Do_DB	Binlog_Ignore_DB	Executed_Gtid_Set
binlog.000002	158			
# Test START TRANSACTION WITH CONSISTENT SNAPSHOT FROM SESSION
DELETE FROM t1;
START TRANSACTION WITH CONSISTENT SNAPSHOT;
SHOW STATUS LIKE 'binlog_snapshot_%';
Variable_name	Value
Binlog_snapshot_file	binlog.000002
Binlog_snapshot_position	487
Binlog_snapshot_gtid_executed	
SHOW BINARY LOG STATUS;
File	Position	Binlog_Do_DB	Binlog_Ignore_DB	Executed_Gtid_Set
binlog.000002	487			
INSERT INTO t1 VALUES (1, "first");
SELECT * FROM t1;
a	b
1	first
# Connection con3
INSERT INTO t1 VALUES (3, "third");
SELECT * FROM t1;
a	b
3	third
SHOW STATUS LIKE 'binlog_snapshot_%';
Variable_name	Value
Binlog_snapshot_file	binlog.000002
Binlog_snapshot_position	775
Binlog_snapshot_gtid_executed	not-in-consistent-snapshot
SHOW BINARY LOG STATUS;
File	Position	Binlog_Do_DB	Binlog_Ignore_DB	Executed_Gtid_Set
binlog.000002	775			
# Connection con2
SELECT * FROM t1;
a	b
3	third
SHOW STATUS LIKE 'binlog_snapshot_%';
Variable_name	Value
Binlog_snapshot_file	binlog.000002
Binlog_snapshot_position	775
Binlog_snapshot_gtid_executed	not-in-consistent-snapshot
SHOW BINARY LOG STATUS;
File	Position	Binlog_Do_DB	Binlog_Ignore_DB	Executed_Gtid_Set
binlog.000002	775			
START TRANSACTION WITH CONSISTENT SNAPSHOT FROM SESSION $donor_id;
SELECT * FROM t1;
a	b
1	first
SHOW STATUS LIKE 'binlog_snapshot_%';
Variable_name	Value
Binlog_snapshot_file	binlog.000002
Binlog_snapshot_position	487
Binlog_snapshot_gtid_executed	
SHOW BINARY LOG STATUS;
File	Position	Binlog_Do_DB	Binlog_Ignore_DB	Executed_Gtid_Set
binlog.000002	775			
# Connection con3
FLUSH LOGS;
SHOW STATUS LIKE 'binlog_snapshot_%';
Variable_name	Value
Binlog_snapshot_file	binlog.000003
Binlog_snapshot_position	158
Binlog_snapshot_gtid_executed	not-in-consistent-snapshot
SHOW BINARY LOG STATUS;
File	Position	Binlog_Do_DB	Binlog_Ignore_DB	Executed_Gtid_Set
binlog.000003	158			
# Connection con2
SHOW STATUS LIKE 'binlog_snapshot_%';
Variable_name	Value
Binlog_snapshot_file	binlog.000002
Binlog_snapshot_position	487
Binlog_snapshot_gtid_executed	
SHOW BINARY LOG STATUS;
File	Position	Binlog_Do_DB	Binlog_Ignore_DB	Executed_Gtid_Set
binlog.000003	158			
COMMIT;
# Connection default
SHOW STATUS LIKE 'binlog_snapshot_%';
Variable_name	Value
Binlog_snapshot_file	binlog.000002
Binlog_snapshot_position	487
Binlog_snapshot_gtid_executed	
SHOW BINARY LOG STATUS;
File	Position	Binlog_Do_DB	Binlog_Ignore_DB	Executed_Gtid_Set
binlog.000003	158			
COMMIT;
SHOW BINLOG EVENTS;
Log_name	Pos	Event_type	Server_id	End_log_pos	Info
binlog.000001	4	Format_desc	1	127	Server ver: #, Binlog ver: #
binlog.000001	127	Previous_gtids	1	158	
binlog.000001	158	Anonymous_Gtid	1	235	SET @@SESSION.GTID_NEXT= 'ANONYMOUS'
binlog.000001	235	Query	1	395	use `test`; CREATE TABLE t1 (a INT, b VARCHAR(100), PRIMARY KEY (a,b)) ENGINE=innodb /* XID */
binlog.000001	395	Anonymous_Gtid	1	472	SET @@SESSION.GTID_NEXT= 'ANONYMOUS'
binlog.000001	472	Query	1	600	use `test`; CREATE TABLE t2 (a INT PRIMARY KEY) ENGINE=myisam
binlog.000001	600	Anonymous_Gtid	1	679	SET @@SESSION.GTID_NEXT= 'ANONYMOUS'
binlog.000001	679	Query	1	754	BEGIN
binlog.000001	754	Table_map	1	802	table_id: # (test.t2)
binlog.000001	802	Write_rows	1	842	table_id: # flags: STMT_END_F
binlog.000001	842	Query	1	918	COMMIT
binlog.000001	918	Anonymous_Gtid	1	997	SET @@SESSION.GTID_NEXT= 'ANONYMOUS'
binlog.000001	997	Query	1	1072	BEGIN
binlog.000001	1072	Table_map	1	1128	table_id: # (test.t1)
binlog.000001	1128	Write_rows	1	1170	table_id: # flags: STMT_END_F
binlog.000001	1170	Xid	1	1201	COMMIT /* XID */
binlog.000001	1201	Anonymous_Gtid	1	1280	SET @@SESSION.GTID_NEXT= 'ANONYMOUS'
binlog.000001	1280	Query	1	1355	BEGIN
binlog.000001	1355	Table_map	1	1403	table_id: # (test.t2)
binlog.000001	1403	Write_rows	1	1443	table_id: # flags: STMT_END_F
binlog.000001	1443	Query	1	1519	COMMIT
binlog.000001	1519	Anonymous_Gtid	1	1598	SET @@SESSION.GTID_NEXT= 'ANONYMOUS'
binlog.000001	1598	Query	1	1673	BEGIN
binlog.000001	1673	Table_map	1	1729	table_id: # (test.t1)
binlog.000001	1729	Write_rows	1	1771	table_id: # flags: STMT_END_F
binlog.000001	1771	Xid	1	1802	COMMIT /* XID */
binlog.000001	1802	Anonymous_Gtid	1	1881	SET @@SESSION.GTID_NEXT= 'ANONYMOUS'
binlog.000001	1881	Query	1	1956	BEGIN
binlog.000001	1956	Table_map	1	2012	table_id: # (test.t1)
binlog.000001	2012	Write_rows	1	2054	table_id: # flags: STMT_END_F
binlog.000001	2054	Xid	1	2085	COMMIT /* XID */
binlog.000001	2085	Anonymous_Gtid	1	2164	SET @@SESSION.GTID_NEXT= 'ANONYMOUS'
binlog.000001	2164	Query	1	2239	BEGIN
binlog.000001	2239	Table_map	1	2295	table_id: # (test.t1)
binlog.000001	2295	Write_rows	1	2342	table_id: # flags: STMT_END_F
binlog.000001	2342	Table_map	1	2398	table_id: # (test.t1)
binlog.000001	2398	Write_rows	1	2446	table_id: # flags: STMT_END_F
binlog.000001	2446	Xid	1	2477	COMMIT /* XID */
binlog.000001	2477	Anonymous_Gtid	1	2556	SET @@SESSION.GTID_NEXT= 'ANONYMOUS'
binlog.000001	2556	Query	1	2631	BEGIN
binlog.000001	2631	Table_map	1	2687	table_id: # (test.t1)
binlog.000001	2687	Write_rows	1	2729	table_id: # flags: STMT_END_F
binlog.000001	2729	Xid	1	2760	COMMIT /* XID */
binlog.000001	2760	Rotate	1	2804	binlog.000002;pos=4
DROP TABLE t1,t2;
