CALL mtr.add_suppression("Statement is unsafe because it accesses a non-transactional table after");
RESET BINARY LOGS AND GTIDS;
# Connection default
CREATE TABLE t1 (a INT, b VARCHAR(100), PRIMARY KEY (a,b)) ENGINE=innodb;
SHOW BINARY LOG STATUS;
File	Position	Binlog_Do_DB	Binlog_Ignore_DB	Executed_Gtid_Set
binlog.000001	392			
SHOW STATUS LIKE 'binlog_snapshot_%';
Variable_name	Value
Binlog_snapshot_file	binlog.000001
Binlog_snapshot_position	392
BEGIN;
INSERT INTO t1 VALUES (0, "");
# Connection con1
BEGIN;
INSERT INTO t1 VALUES (1, "");
# Connection con2
CREATE TABLE t2 (a INT PRIMARY KEY) ENGINE=myisam;
BEGIN;
INSERT INTO t1 VALUES (2, "first");
INSERT INTO t2 VALUES (2);
Warnings:
Note	1592	Unsafe statement written to the binary log using statement format since BINLOG_FORMAT = STATEMENT. Statement is unsafe because it accesses a non-transactional table after accessing a transactional table within the same transaction.
INSERT INTO t1 VALUES (2, "second");
# Connection default
COMMIT;
SET TRANSACTION ISOLATION LEVEL REPEATABLE READ;
START TRANSACTION WITH CONSISTENT SNAPSHOT;
# Connection con3
BEGIN;
INSERT INTO t1 VALUES (3, "");
INSERT INTO t2 VALUES (3);
Warnings:
Note	1592	Unsafe statement written to the binary log using statement format since BINLOG_FORMAT = STATEMENT. Statement is unsafe because it accesses a non-transactional table after accessing a transactional table within the same transaction.
# Connection con4
BEGIN;
INSERT INTO t1 VALUES (4, "");
COMMIT;
# Connection default
SELECT * FROM t1 ORDER BY a,b;
a	b
0	
SHOW STATUS LIKE 'binlog_snapshot_%';
Variable_name	Value
Binlog_snapshot_file	binlog.000001
Binlog_snapshot_position	895
SHOW BINARY LOG STATUS;
File	Position	Binlog_Do_DB	Binlog_Ignore_DB	Executed_Gtid_Set
binlog.000001	1193			
SELECT * FROM t2 ORDER BY a;
a
2
3
# Connection con1
COMMIT;
# Connection con2
COMMIT;
# Connection con3
COMMIT;
FLUSH LOGS;
# Connection default
SELECT * FROM t1 ORDER BY a,b;
a	b
0	
SHOW STATUS LIKE 'binlog_snapshot_%';
Variable_name	Value
Binlog_snapshot_file	binlog.000001
Binlog_snapshot_position	895
SHOW BINARY LOG STATUS;
File	Position	Binlog_Do_DB	Binlog_Ignore_DB	Executed_Gtid_Set
binlog.000002	155			
COMMIT;
SHOW STATUS LIKE 'binlog_snapshot_%';
Variable_name	Value
Binlog_snapshot_file	binlog.000002
Binlog_snapshot_position	155
SHOW BINARY LOG STATUS;
File	Position	Binlog_Do_DB	Binlog_Ignore_DB	Executed_Gtid_Set
binlog.000002	155			
# Test START TRANSACTION WITH CONSISTENT SNAPSHOT FROM SESSION
DELETE FROM t1;
START TRANSACTION WITH CONSISTENT SNAPSHOT;
SHOW STATUS LIKE 'binlog_snapshot_%';
Variable_name	Value
Binlog_snapshot_file	binlog.000002
Binlog_snapshot_position	438
SHOW BINARY LOG STATUS;
File	Position	Binlog_Do_DB	Binlog_Ignore_DB	Executed_Gtid_Set
binlog.000002	438			
INSERT INTO t1 VALUES (1, "first");
SELECT * FROM t1;
a	b
1	first
# Connection con3
INSERT INTO t1 VALUES (3, "third");
SELECT * FROM t1;
a	b
3	third
SHOW STATUS LIKE 'binlog_snapshot_%';
Variable_name	Value
Binlog_snapshot_file	binlog.000002
Binlog_snapshot_position	741
SHOW BINARY LOG STATUS;
File	Position	Binlog_Do_DB	Binlog_Ignore_DB	Executed_Gtid_Set
binlog.000002	741			
# Connection con2
SELECT * FROM t1;
a	b
3	third
SHOW STATUS LIKE 'binlog_snapshot_%';
Variable_name	Value
Binlog_snapshot_file	binlog.000002
Binlog_snapshot_position	741
SHOW BINARY LOG STATUS;
File	Position	Binlog_Do_DB	Binlog_Ignore_DB	Executed_Gtid_Set
binlog.000002	741			
START TRANSACTION WITH CONSISTENT SNAPSHOT FROM SESSION $donor_id;
SELECT * FROM t1;
a	b
1	first
SHOW STATUS LIKE 'binlog_snapshot_%';
Variable_name	Value
Binlog_snapshot_file	binlog.000002
Binlog_snapshot_position	438
SHOW BINARY LOG STATUS;
File	Position	Binlog_Do_DB	Binlog_Ignore_DB	Executed_Gtid_Set
binlog.000002	741			
# Connection con3
FLUSH LOGS;
SHOW STATUS LIKE 'binlog_snapshot_%';
Variable_name	Value
Binlog_snapshot_file	binlog.000003
Binlog_snapshot_position	155
SHOW BINARY LOG STATUS;
File	Position	Binlog_Do_DB	Binlog_Ignore_DB	Executed_Gtid_Set
binlog.000003	155			
# Connection con2
SHOW STATUS LIKE 'binlog_snapshot_%';
Variable_name	Value
Binlog_snapshot_file	binlog.000002
Binlog_snapshot_position	438
SHOW BINARY LOG STATUS;
File	Position	Binlog_Do_DB	Binlog_Ignore_DB	Executed_Gtid_Set
binlog.000003	155			
COMMIT;
# Connection default
SHOW STATUS LIKE 'binlog_snapshot_%';
Variable_name	Value
Binlog_snapshot_file	binlog.000002
Binlog_snapshot_position	438
SHOW BINARY LOG STATUS;
File	Position	Binlog_Do_DB	Binlog_Ignore_DB	Executed_Gtid_Set
binlog.000003	155			
COMMIT;
SHOW BINLOG EVENTS;
Log_name	Pos	Event_type	Server_id	End_log_pos	Info
binlog.000001	4	Format_desc	1	124	Server ver: #, Binlog ver: #
binlog.000001	124	Previous_gtids	1	155	
binlog.000001	155	Anonymous_Gtid	1	232	SET @@SESSION.GTID_NEXT= 'ANONYMOUS'
binlog.000001	232	Query	1	392	use `test`; CREATE TABLE t1 (a INT, b VARCHAR(100), PRIMARY KEY (a,b)) ENGINE=innodb /* XID */
binlog.000001	392	Anonymous_Gtid	1	469	SET @@SESSION.GTID_NEXT= 'ANONYMOUS'
binlog.000001	469	Query	1	597	use `test`; CREATE TABLE t2 (a INT PRIMARY KEY) ENGINE=myisam
binlog.000001	597	Anonymous_Gtid	1	676	SET @@SESSION.GTID_NEXT= 'ANONYMOUS'
binlog.000001	676	Query	1	758	BEGIN
binlog.000001	758	Query	1	864	use `test`; INSERT INTO t1 VALUES (0, "")
binlog.000001	864	Xid	1	895	COMMIT /* XID */
binlog.000001	895	Anonymous_Gtid	1	974	SET @@SESSION.GTID_NEXT= 'ANONYMOUS'
binlog.000001	974	Query	1	1056	BEGIN
binlog.000001	1056	Query	1	1162	use `test`; INSERT INTO t1 VALUES (4, "")
binlog.000001	1162	Xid	1	1193	COMMIT /* XID */
binlog.000001	1193	Anonymous_Gtid	1	1272	SET @@SESSION.GTID_NEXT= 'ANONYMOUS'
binlog.000001	1272	Query	1	1354	BEGIN
binlog.000001	1354	Query	1	1460	use `test`; INSERT INTO t1 VALUES (1, "")
binlog.000001	1460	Xid	1	1491	COMMIT /* XID */
binlog.000001	1491	Anonymous_Gtid	1	1570	SET @@SESSION.GTID_NEXT= 'ANONYMOUS'
binlog.000001	1570	Query	1	1652	BEGIN
binlog.000001	1652	Query	1	1763	use `test`; INSERT INTO t1 VALUES (2, "first")
binlog.000001	1763	Query	1	1865	use `test`; INSERT INTO t2 VALUES (2)
binlog.000001	1865	Query	1	1977	use `test`; INSERT INTO t1 VALUES (2, "second")
binlog.000001	1977	Xid	1	2008	COMMIT /* XID */
binlog.000001	2008	Anonymous_Gtid	1	2087	SET @@SESSION.GTID_NEXT= 'ANONYMOUS'
binlog.000001	2087	Query	1	2169	BEGIN
binlog.000001	2169	Query	1	2275	use `test`; INSERT INTO t1 VALUES (3, "")
binlog.000001	2275	Query	1	2377	use `test`; INSERT INTO t2 VALUES (3)
binlog.000001	2377	Xid	1	2408	COMMIT /* XID */
binlog.000001	2408	Rotate	1	2452	binlog.000002;pos=4
DROP TABLE t1,t2;
