RESET MASTER;
# Connection default
CREATE TABLE t1 (a INT, b VARCHAR(100), PRIMARY KEY (a,b)) ENGINE=innodb;
SHOW MASTER STATUS;
File	Position	Binlog_Do_DB	Binlog_Ignore_DB	Executed_Gtid_Set
binlog.000001	394			
SHOW STATUS LIKE 'binlog_snapshot_%';
Variable_name	Value
Binlog_snapshot_file	binlog.000001
Binlog_snapshot_position	394
Binlog_snapshot_gtid_executed	not-in-consistent-snapshot
BEGIN;
INSERT INTO t1 VALUES (0, "");
# Connection con1
BEGIN;
INSERT INTO t1 VALUES (1, "");
# Connection con2
CREATE TABLE t2 (a INT PRIMARY KEY) ENGINE=myisam;
BEGIN;
INSERT INTO t1 VALUES (2, "first");
INSERT INTO t2 VALUES (2);
INSERT INTO t1 VALUES (2, "second");
# Connection default
COMMIT;
SET TRANSACTION ISOLATION LEVEL REPEATABLE READ;
START TRANSACTION WITH CONSISTENT SNAPSHOT;
# Connection con3
BEGIN;
INSERT INTO t1 VALUES (3, "");
INSERT INTO t2 VALUES (3);
# Connection con4
BEGIN;
INSERT INTO t1 VALUES (4, "");
COMMIT;
# Connection default
SELECT * FROM t1 ORDER BY a,b;
a	b
0	
SHOW STATUS LIKE 'binlog_snapshot_%';
Variable_name	Value
Binlog_snapshot_file	binlog.000001
Binlog_snapshot_position	1200
Binlog_snapshot_gtid_executed	
SHOW MASTER STATUS;
File	Position	Binlog_Do_DB	Binlog_Ignore_DB	Executed_Gtid_Set
binlog.000001	1801			
SELECT * FROM t2 ORDER BY a;
a
2
3
# Connection con1
COMMIT;
# Connection con2
COMMIT;
# Connection con3
COMMIT;
FLUSH LOGS;
# Connection default
SELECT * FROM t1 ORDER BY a,b;
a	b
0	
SHOW STATUS LIKE 'binlog_snapshot_%';
Variable_name	Value
Binlog_snapshot_file	binlog.000001
Binlog_snapshot_position	1200
Binlog_snapshot_gtid_executed	
SHOW MASTER STATUS;
File	Position	Binlog_Do_DB	Binlog_Ignore_DB	Executed_Gtid_Set
binlog.000002	157			
COMMIT;
SHOW STATUS LIKE 'binlog_snapshot_%';
Variable_name	Value
Binlog_snapshot_file	binlog.000002
Binlog_snapshot_position	157
Binlog_snapshot_gtid_executed	not-in-consistent-snapshot
SHOW MASTER STATUS;
File	Position	Binlog_Do_DB	Binlog_Ignore_DB	Executed_Gtid_Set
binlog.000002	157			
# Test START TRANSACTION WITH CONSISTENT SNAPSHOT FROM SESSION
DELETE FROM t1;
START TRANSACTION WITH CONSISTENT SNAPSHOT;
SHOW STATUS LIKE 'binlog_snapshot_%';
Variable_name	Value
Binlog_snapshot_file	binlog.000002
Binlog_snapshot_position	486
Binlog_snapshot_gtid_executed	
SHOW MASTER STATUS;
File	Position	Binlog_Do_DB	Binlog_Ignore_DB	Executed_Gtid_Set
binlog.000002	486			
INSERT INTO t1 VALUES (1, "first");
SELECT * FROM t1;
a	b
1	first
# Connection con3
INSERT INTO t1 VALUES (3, "third");
SELECT * FROM t1;
a	b
3	third
SHOW STATUS LIKE 'binlog_snapshot_%';
Variable_name	Value
Binlog_snapshot_file	binlog.000002
Binlog_snapshot_position	774
Binlog_snapshot_gtid_executed	not-in-consistent-snapshot
SHOW MASTER STATUS;
File	Position	Binlog_Do_DB	Binlog_Ignore_DB	Executed_Gtid_Set
binlog.000002	774			
# Connection con2
SELECT * FROM t1;
a	b
3	third
SHOW STATUS LIKE 'binlog_snapshot_%';
Variable_name	Value
Binlog_snapshot_file	binlog.000002
Binlog_snapshot_position	774
Binlog_snapshot_gtid_executed	not-in-consistent-snapshot
SHOW MASTER STATUS;
File	Position	Binlog_Do_DB	Binlog_Ignore_DB	Executed_Gtid_Set
binlog.000002	774			
START TRANSACTION WITH CONSISTENT SNAPSHOT FROM SESSION $donor_id;
SELECT * FROM t1;
a	b
1	first
SHOW STATUS LIKE 'binlog_snapshot_%';
Variable_name	Value
Binlog_snapshot_file	binlog.000002
Binlog_snapshot_position	486
Binlog_snapshot_gtid_executed	
SHOW MASTER STATUS;
File	Position	Binlog_Do_DB	Binlog_Ignore_DB	Executed_Gtid_Set
binlog.000002	774			
# Connection con3
FLUSH LOGS;
SHOW STATUS LIKE 'binlog_snapshot_%';
Variable_name	Value
Binlog_snapshot_file	binlog.000003
Binlog_snapshot_position	157
Binlog_snapshot_gtid_executed	not-in-consistent-snapshot
SHOW MASTER STATUS;
File	Position	Binlog_Do_DB	Binlog_Ignore_DB	Executed_Gtid_Set
binlog.000003	157			
# Connection con2
SHOW STATUS LIKE 'binlog_snapshot_%';
Variable_name	Value
Binlog_snapshot_file	binlog.000002
Binlog_snapshot_position	486
Binlog_snapshot_gtid_executed	
SHOW MASTER STATUS;
File	Position	Binlog_Do_DB	Binlog_Ignore_DB	Executed_Gtid_Set
binlog.000003	157			
COMMIT;
# Connection default
SHOW STATUS LIKE 'binlog_snapshot_%';
Variable_name	Value
Binlog_snapshot_file	binlog.000002
Binlog_snapshot_position	486
Binlog_snapshot_gtid_executed	
SHOW MASTER STATUS;
File	Position	Binlog_Do_DB	Binlog_Ignore_DB	Executed_Gtid_Set
binlog.000003	157			
COMMIT;
SHOW BINLOG EVENTS;
Log_name	Pos	Event_type	Server_id	End_log_pos	Info
binlog.000001	4	Format_desc	1	126	Server ver: #, Binlog ver: #
binlog.000001	126	Previous_gtids	1	157	
binlog.000001	157	Anonymous_Gtid	1	234	SET @@SESSION.GTID_NEXT= 'ANONYMOUS'
binlog.000001	234	Query	1	394	use `test`; CREATE TABLE t1 (a INT, b VARCHAR(100), PRIMARY KEY (a,b)) ENGINE=innodb /* XID */
binlog.000001	394	Anonymous_Gtid	1	471	SET @@SESSION.GTID_NEXT= 'ANONYMOUS'
binlog.000001	471	Query	1	599	use `test`; CREATE TABLE t2 (a INT PRIMARY KEY) ENGINE=myisam
binlog.000001	599	Anonymous_Gtid	1	678	SET @@SESSION.GTID_NEXT= 'ANONYMOUS'
binlog.000001	678	Query	1	753	BEGIN
binlog.000001	753	Table_map	1	801	table_id: # (test.t2)
binlog.000001	801	Write_rows	1	841	table_id: # flags: STMT_END_F
binlog.000001	841	Query	1	917	COMMIT
binlog.000001	917	Anonymous_Gtid	1	996	SET @@SESSION.GTID_NEXT= 'ANONYMOUS'
binlog.000001	996	Query	1	1071	BEGIN
binlog.000001	1071	Table_map	1	1127	table_id: # (test.t1)
binlog.000001	1127	Write_rows	1	1169	table_id: # flags: STMT_END_F
binlog.000001	1169	Xid	1	1200	COMMIT /* XID */
binlog.000001	1200	Anonymous_Gtid	1	1279	SET @@SESSION.GTID_NEXT= 'ANONYMOUS'
binlog.000001	1279	Query	1	1354	BEGIN
binlog.000001	1354	Table_map	1	1402	table_id: # (test.t2)
binlog.000001	1402	Write_rows	1	1442	table_id: # flags: STMT_END_F
binlog.000001	1442	Query	1	1518	COMMIT
binlog.000001	1518	Anonymous_Gtid	1	1597	SET @@SESSION.GTID_NEXT= 'ANONYMOUS'
binlog.000001	1597	Query	1	1672	BEGIN
binlog.000001	1672	Table_map	1	1728	table_id: # (test.t1)
binlog.000001	1728	Write_rows	1	1770	table_id: # flags: STMT_END_F
binlog.000001	1770	Xid	1	1801	COMMIT /* XID */
binlog.000001	1801	Anonymous_Gtid	1	1880	SET @@SESSION.GTID_NEXT= 'ANONYMOUS'
binlog.000001	1880	Query	1	1955	BEGIN
binlog.000001	1955	Table_map	1	2011	table_id: # (test.t1)
binlog.000001	2011	Write_rows	1	2053	table_id: # flags: STMT_END_F
binlog.000001	2053	Xid	1	2084	COMMIT /* XID */
binlog.000001	2084	Anonymous_Gtid	1	2163	SET @@SESSION.GTID_NEXT= 'ANONYMOUS'
binlog.000001	2163	Query	1	2238	BEGIN
binlog.000001	2238	Table_map	1	2294	table_id: # (test.t1)
binlog.000001	2294	Write_rows	1	2341	table_id: # flags: STMT_END_F
binlog.000001	2341	Table_map	1	2397	table_id: # (test.t1)
binlog.000001	2397	Write_rows	1	2445	table_id: # flags: STMT_END_F
binlog.000001	2445	Xid	1	2476	COMMIT /* XID */
binlog.000001	2476	Anonymous_Gtid	1	2555	SET @@SESSION.GTID_NEXT= 'ANONYMOUS'
binlog.000001	2555	Query	1	2630	BEGIN
binlog.000001	2630	Table_map	1	2686	table_id: # (test.t1)
binlog.000001	2686	Write_rows	1	2728	table_id: # flags: STMT_END_F
binlog.000001	2728	Xid	1	2759	COMMIT /* XID */
binlog.000001	2759	Rotate	1	2803	binlog.000002;pos=4
DROP TABLE t1,t2;
