RESET MASTER;
# Connection default
CREATE TABLE t1 (a INT, b VARCHAR(100), PRIMARY KEY (a,b)) ENGINE=innodb;
SHOW MASTER STATUS;
File	Position	Binlog_Do_DB	Binlog_Ignore_DB	Executed_Gtid_Set
binlog.000001	388			
SHOW STATUS LIKE 'binlog_snapshot_%';
Variable_name	Value
Binlog_snapshot_file	binlog.000001
Binlog_snapshot_position	388
BEGIN;
INSERT INTO t1 VALUES (0, "");
# Connection con1
BEGIN;
INSERT INTO t1 VALUES (1, "");
# Connection con2
CREATE TABLE t2 (a INT PRIMARY KEY) ENGINE=myisam;
BEGIN;
INSERT INTO t1 VALUES (2, "first");
INSERT INTO t2 VALUES (2);
INSERT INTO t1 VALUES (2, "second");
# Connection default
COMMIT;
SET TRANSACTION ISOLATION LEVEL REPEATABLE READ;
START TRANSACTION WITH CONSISTENT SNAPSHOT;
# Connection con3
BEGIN;
INSERT INTO t1 VALUES (3, "");
INSERT INTO t2 VALUES (3);
# Connection con4
BEGIN;
INSERT INTO t1 VALUES (4, "");
COMMIT;
# Connection default
SELECT * FROM t1 ORDER BY a,b;
a	b
0	
SHOW STATUS LIKE 'binlog_snapshot_%';
Variable_name	Value
Binlog_snapshot_file	binlog.000001
Binlog_snapshot_position	1205
SHOW MASTER STATUS;
File	Position	Binlog_Do_DB	Binlog_Ignore_DB	Executed_Gtid_Set
binlog.000001	1821			
SELECT * FROM t2 ORDER BY a;
a
2
3
# Connection con1
COMMIT;
# Connection con2
COMMIT;
# Connection con3
COMMIT;
FLUSH LOGS;
# Connection default
SELECT * FROM t1 ORDER BY a,b;
a	b
0	
SHOW STATUS LIKE 'binlog_snapshot_%';
Variable_name	Value
Binlog_snapshot_file	binlog.000001
Binlog_snapshot_position	1205
SHOW MASTER STATUS;
File	Position	Binlog_Do_DB	Binlog_Ignore_DB	Executed_Gtid_Set
binlog.000002	155			
COMMIT;
SHOW STATUS LIKE 'binlog_snapshot_%';
Variable_name	Value
Binlog_snapshot_file	binlog.000002
Binlog_snapshot_position	155
SHOW MASTER STATUS;
File	Position	Binlog_Do_DB	Binlog_Ignore_DB	Executed_Gtid_Set
binlog.000002	155			
# Test START TRANSACTION WITH CONSISTENT SNAPSHOT FROM SESSION
DELETE FROM t1;
START TRANSACTION WITH CONSISTENT SNAPSHOT;
SHOW STATUS LIKE 'binlog_snapshot_%';
Variable_name	Value
Binlog_snapshot_file	binlog.000002
Binlog_snapshot_position	438
SHOW MASTER STATUS;
File	Position	Binlog_Do_DB	Binlog_Ignore_DB	Executed_Gtid_Set
binlog.000002	438			
INSERT INTO t1 VALUES (1, "first");
SELECT * FROM t1;
a	b
1	first
# Connection con3
INSERT INTO t1 VALUES (3, "third");
SELECT * FROM t1;
a	b
3	third
SHOW STATUS LIKE 'binlog_snapshot_%';
Variable_name	Value
Binlog_snapshot_file	binlog.000002
Binlog_snapshot_position	741
SHOW MASTER STATUS;
File	Position	Binlog_Do_DB	Binlog_Ignore_DB	Executed_Gtid_Set
binlog.000002	741			
# Connection con2
SELECT * FROM t1;
a	b
3	third
SHOW STATUS LIKE 'binlog_snapshot_%';
Variable_name	Value
Binlog_snapshot_file	binlog.000002
Binlog_snapshot_position	741
SHOW MASTER STATUS;
File	Position	Binlog_Do_DB	Binlog_Ignore_DB	Executed_Gtid_Set
binlog.000002	741			
START TRANSACTION WITH CONSISTENT SNAPSHOT FROM SESSION $donor_id;
SELECT * FROM t1;
a	b
1	first
SHOW STATUS LIKE 'binlog_snapshot_%';
Variable_name	Value
Binlog_snapshot_file	binlog.000002
Binlog_snapshot_position	438
SHOW MASTER STATUS;
File	Position	Binlog_Do_DB	Binlog_Ignore_DB	Executed_Gtid_Set
binlog.000002	741			
# Connection con3
FLUSH LOGS;
SHOW STATUS LIKE 'binlog_snapshot_%';
Variable_name	Value
Binlog_snapshot_file	binlog.000003
Binlog_snapshot_position	155
SHOW MASTER STATUS;
File	Position	Binlog_Do_DB	Binlog_Ignore_DB	Executed_Gtid_Set
binlog.000003	155			
# Connection con2
SHOW STATUS LIKE 'binlog_snapshot_%';
Variable_name	Value
Binlog_snapshot_file	binlog.000002
Binlog_snapshot_position	438
SHOW MASTER STATUS;
File	Position	Binlog_Do_DB	Binlog_Ignore_DB	Executed_Gtid_Set
binlog.000003	155			
COMMIT;
# Connection default
SHOW STATUS LIKE 'binlog_snapshot_%';
Variable_name	Value
Binlog_snapshot_file	binlog.000002
Binlog_snapshot_position	438
SHOW MASTER STATUS;
File	Position	Binlog_Do_DB	Binlog_Ignore_DB	Executed_Gtid_Set
binlog.000003	155			
COMMIT;
SHOW BINLOG EVENTS;
Log_name	Pos	Event_type	Server_id	End_log_pos	Info
binlog.000001	4	Format_desc	1	124	Server ver: #, Binlog ver: #
binlog.000001	124	Previous_gtids	1	155	
binlog.000001	155	Anonymous_Gtid	1	228	SET @@SESSION.GTID_NEXT= 'ANONYMOUS'
binlog.000001	228	Query	1	388	use `test`; CREATE TABLE t1 (a INT, b VARCHAR(100), PRIMARY KEY (a,b)) ENGINE=innodb /* XID */
binlog.000001	388	Anonymous_Gtid	1	461	SET @@SESSION.GTID_NEXT= 'ANONYMOUS'
binlog.000001	461	Query	1	589	use `test`; CREATE TABLE t2 (a INT PRIMARY KEY) ENGINE=myisam
binlog.000001	589	Anonymous_Gtid	1	664	SET @@SESSION.GTID_NEXT= 'ANONYMOUS'
binlog.000001	664	Query	1	741	BEGIN
binlog.000001	741	Table_map	1	789	table_id: # (test.t2)
binlog.000001	789	Write_rows	1	829	table_id: # flags: STMT_END_F
binlog.000001	829	Query	1	907	COMMIT
binlog.000001	907	Anonymous_Gtid	1	982	SET @@SESSION.GTID_NEXT= 'ANONYMOUS'
binlog.000001	982	Query	1	1066	BEGIN
binlog.000001	1066	Query	1	1174	use `test`; INSERT INTO t1 VALUES (0, "")
binlog.000001	1174	Xid	1	1205	COMMIT /* XID */
binlog.000001	1205	Anonymous_Gtid	1	1280	SET @@SESSION.GTID_NEXT= 'ANONYMOUS'
binlog.000001	1280	Query	1	1357	BEGIN
binlog.000001	1357	Table_map	1	1405	table_id: # (test.t2)
binlog.000001	1405	Write_rows	1	1445	table_id: # flags: STMT_END_F
binlog.000001	1445	Query	1	1523	COMMIT
binlog.000001	1523	Anonymous_Gtid	1	1598	SET @@SESSION.GTID_NEXT= 'ANONYMOUS'
binlog.000001	1598	Query	1	1682	BEGIN
binlog.000001	1682	Query	1	1790	use `test`; INSERT INTO t1 VALUES (4, "")
binlog.000001	1790	Xid	1	1821	COMMIT /* XID */
binlog.000001	1821	Anonymous_Gtid	1	1896	SET @@SESSION.GTID_NEXT= 'ANONYMOUS'
binlog.000001	1896	Query	1	1980	BEGIN
binlog.000001	1980	Query	1	2088	use `test`; INSERT INTO t1 VALUES (1, "")
binlog.000001	2088	Xid	1	2119	COMMIT /* XID */
binlog.000001	2119	Anonymous_Gtid	1	2194	SET @@SESSION.GTID_NEXT= 'ANONYMOUS'
binlog.000001	2194	Query	1	2278	BEGIN
binlog.000001	2278	Query	1	2391	use `test`; INSERT INTO t1 VALUES (2, "first")
binlog.000001	2391	Query	1	2505	use `test`; INSERT INTO t1 VALUES (2, "second")
binlog.000001	2505	Xid	1	2536	COMMIT /* XID */
binlog.000001	2536	Anonymous_Gtid	1	2611	SET @@SESSION.GTID_NEXT= 'ANONYMOUS'
binlog.000001	2611	Query	1	2695	BEGIN
binlog.000001	2695	Query	1	2803	use `test`; INSERT INTO t1 VALUES (3, "")
binlog.000001	2803	Xid	1	2834	COMMIT /* XID */
binlog.000001	2834	Rotate	1	2878	binlog.000002;pos=4
DROP TABLE t1,t2;
