CALL mtr.add_suppression("Statement is unsafe because it accesses a non-transactional table after");
RESET MASTER;
# Connection default
CREATE TABLE t1 (a INT, b VARCHAR(100), PRIMARY KEY (a,b)) ENGINE=innodb;
SHOW MASTER STATUS;
File	Position	Binlog_Do_DB	Binlog_Ignore_DB	Executed_Gtid_Set
binlog.000001	394			
SHOW STATUS LIKE 'binlog_snapshot_%';
Variable_name	Value
Binlog_snapshot_file	binlog.000001
Binlog_snapshot_position	394
Binlog_snapshot_gtid_executed	not-in-consistent-snapshot
BEGIN;
INSERT INTO t1 VALUES (0, "");
# Connection con1
BEGIN;
INSERT INTO t1 VALUES (1, "");
# Connection con2
CREATE TABLE t2 (a INT PRIMARY KEY) ENGINE=myisam;
BEGIN;
INSERT INTO t1 VALUES (2, "first");
INSERT INTO t2 VALUES (2);
Warnings:
Note	1592	Unsafe statement written to the binary log using statement format since BINLOG_FORMAT = STATEMENT. Statement is unsafe because it accesses a non-transactional table after accessing a transactional table within the same transaction.
INSERT INTO t1 VALUES (2, "second");
# Connection default
COMMIT;
SET TRANSACTION ISOLATION LEVEL REPEATABLE READ;
START TRANSACTION WITH CONSISTENT SNAPSHOT;
# Connection con3
BEGIN;
INSERT INTO t1 VALUES (3, "");
INSERT INTO t2 VALUES (3);
Warnings:
Note	1592	Unsafe statement written to the binary log using statement format since BINLOG_FORMAT = STATEMENT. Statement is unsafe because it accesses a non-transactional table after accessing a transactional table within the same transaction.
# Connection con4
BEGIN;
INSERT INTO t1 VALUES (4, "");
COMMIT;
# Connection default
SELECT * FROM t1 ORDER BY a,b;
a	b
0	
SHOW STATUS LIKE 'binlog_snapshot_%';
Variable_name	Value
Binlog_snapshot_file	binlog.000001
Binlog_snapshot_position	897
Binlog_snapshot_gtid_executed	
SHOW MASTER STATUS;
File	Position	Binlog_Do_DB	Binlog_Ignore_DB	Executed_Gtid_Set
binlog.000001	1195			
SELECT * FROM t2 ORDER BY a;
a
2
3
# Connection con1
COMMIT;
# Connection con2
COMMIT;
# Connection con3
COMMIT;
FLUSH LOGS;
# Connection default
SELECT * FROM t1 ORDER BY a,b;
a	b
0	
SHOW STATUS LIKE 'binlog_snapshot_%';
Variable_name	Value
Binlog_snapshot_file	binlog.000001
Binlog_snapshot_position	897
Binlog_snapshot_gtid_executed	
SHOW MASTER STATUS;
File	Position	Binlog_Do_DB	Binlog_Ignore_DB	Executed_Gtid_Set
binlog.000002	157			
COMMIT;
SHOW STATUS LIKE 'binlog_snapshot_%';
Variable_name	Value
Binlog_snapshot_file	binlog.000002
Binlog_snapshot_position	157
Binlog_snapshot_gtid_executed	not-in-consistent-snapshot
SHOW MASTER STATUS;
File	Position	Binlog_Do_DB	Binlog_Ignore_DB	Executed_Gtid_Set
binlog.000002	157			
# Test START TRANSACTION WITH CONSISTENT SNAPSHOT FROM SESSION
DELETE FROM t1;
START TRANSACTION WITH CONSISTENT SNAPSHOT;
SHOW STATUS LIKE 'binlog_snapshot_%';
Variable_name	Value
Binlog_snapshot_file	binlog.000002
Binlog_snapshot_position	440
Binlog_snapshot_gtid_executed	
SHOW MASTER STATUS;
File	Position	Binlog_Do_DB	Binlog_Ignore_DB	Executed_Gtid_Set
binlog.000002	440			
INSERT INTO t1 VALUES (1, "first");
SELECT * FROM t1;
a	b
1	first
# Connection con3
INSERT INTO t1 VALUES (3, "third");
SELECT * FROM t1;
a	b
3	third
SHOW STATUS LIKE 'binlog_snapshot_%';
Variable_name	Value
Binlog_snapshot_file	binlog.000002
Binlog_snapshot_position	743
Binlog_snapshot_gtid_executed	not-in-consistent-snapshot
SHOW MASTER STATUS;
File	Position	Binlog_Do_DB	Binlog_Ignore_DB	Executed_Gtid_Set
binlog.000002	743			
# Connection con2
SELECT * FROM t1;
a	b
3	third
SHOW STATUS LIKE 'binlog_snapshot_%';
Variable_name	Value
Binlog_snapshot_file	binlog.000002
Binlog_snapshot_position	743
Binlog_snapshot_gtid_executed	not-in-consistent-snapshot
SHOW MASTER STATUS;
File	Position	Binlog_Do_DB	Binlog_Ignore_DB	Executed_Gtid_Set
binlog.000002	743			
START TRANSACTION WITH CONSISTENT SNAPSHOT FROM SESSION $donor_id;
SELECT * FROM t1;
a	b
1	first
SHOW STATUS LIKE 'binlog_snapshot_%';
Variable_name	Value
Binlog_snapshot_file	binlog.000002
Binlog_snapshot_position	440
Binlog_snapshot_gtid_executed	
SHOW MASTER STATUS;
File	Position	Binlog_Do_DB	Binlog_Ignore_DB	Executed_Gtid_Set
binlog.000002	743			
# Connection con3
FLUSH LOGS;
SHOW STATUS LIKE 'binlog_snapshot_%';
Variable_name	Value
Binlog_snapshot_file	binlog.000003
Binlog_snapshot_position	157
Binlog_snapshot_gtid_executed	not-in-consistent-snapshot
SHOW MASTER STATUS;
File	Position	Binlog_Do_DB	Binlog_Ignore_DB	Executed_Gtid_Set
binlog.000003	157			
# Connection con2
SHOW STATUS LIKE 'binlog_snapshot_%';
Variable_name	Value
Binlog_snapshot_file	binlog.000002
Binlog_snapshot_position	440
Binlog_snapshot_gtid_executed	
SHOW MASTER STATUS;
File	Position	Binlog_Do_DB	Binlog_Ignore_DB	Executed_Gtid_Set
binlog.000003	157			
COMMIT;
# Connection default
SHOW STATUS LIKE 'binlog_snapshot_%';
Variable_name	Value
Binlog_snapshot_file	binlog.000002
Binlog_snapshot_position	440
Binlog_snapshot_gtid_executed	
SHOW MASTER STATUS;
File	Position	Binlog_Do_DB	Binlog_Ignore_DB	Executed_Gtid_Set
binlog.000003	157			
COMMIT;
SHOW BINLOG EVENTS;
Log_name	Pos	Event_type	Server_id	End_log_pos	Info
binlog.000001	4	Format_desc	1	126	Server ver: #, Binlog ver: #
binlog.000001	126	Previous_gtids	1	157	
binlog.000001	157	Anonymous_Gtid	1	234	SET @@SESSION.GTID_NEXT= 'ANONYMOUS'
binlog.000001	234	Query	1	394	use `test`; CREATE TABLE t1 (a INT, b VARCHAR(100), PRIMARY KEY (a,b)) ENGINE=innodb /* XID */
binlog.000001	394	Anonymous_Gtid	1	471	SET @@SESSION.GTID_NEXT= 'ANONYMOUS'
binlog.000001	471	Query	1	599	use `test`; CREATE TABLE t2 (a INT PRIMARY KEY) ENGINE=myisam
binlog.000001	599	Anonymous_Gtid	1	678	SET @@SESSION.GTID_NEXT= 'ANONYMOUS'
binlog.000001	678	Query	1	760	BEGIN
binlog.000001	760	Query	1	866	use `test`; INSERT INTO t1 VALUES (0, "")
binlog.000001	866	Xid	1	897	COMMIT /* XID */
binlog.000001	897	Anonymous_Gtid	1	976	SET @@SESSION.GTID_NEXT= 'ANONYMOUS'
binlog.000001	976	Query	1	1058	BEGIN
binlog.000001	1058	Query	1	1164	use `test`; INSERT INTO t1 VALUES (4, "")
binlog.000001	1164	Xid	1	1195	COMMIT /* XID */
binlog.000001	1195	Anonymous_Gtid	1	1274	SET @@SESSION.GTID_NEXT= 'ANONYMOUS'
binlog.000001	1274	Query	1	1356	BEGIN
binlog.000001	1356	Query	1	1462	use `test`; INSERT INTO t1 VALUES (1, "")
binlog.000001	1462	Xid	1	1493	COMMIT /* XID */
binlog.000001	1493	Anonymous_Gtid	1	1572	SET @@SESSION.GTID_NEXT= 'ANONYMOUS'
binlog.000001	1572	Query	1	1654	BEGIN
binlog.000001	1654	Query	1	1765	use `test`; INSERT INTO t1 VALUES (2, "first")
binlog.000001	1765	Query	1	1867	use `test`; INSERT INTO t2 VALUES (2)
binlog.000001	1867	Query	1	1979	use `test`; INSERT INTO t1 VALUES (2, "second")
binlog.000001	1979	Xid	1	2010	COMMIT /* XID */
binlog.000001	2010	Anonymous_Gtid	1	2089	SET @@SESSION.GTID_NEXT= 'ANONYMOUS'
binlog.000001	2089	Query	1	2171	BEGIN
binlog.000001	2171	Query	1	2277	use `test`; INSERT INTO t1 VALUES (3, "")
binlog.000001	2277	Query	1	2379	use `test`; INSERT INTO t2 VALUES (3)
binlog.000001	2379	Xid	1	2410	COMMIT /* XID */
binlog.000001	2410	Rotate	1	2454	binlog.000002;pos=4
DROP TABLE t1,t2;
