RESET MASTER;
# Connection default
CREATE TABLE t1 (a INT, b VARCHAR(100), PRIMARY KEY (a,b)) ENGINE=innodb;
SHOW MASTER STATUS;
File	Position	Binlog_Do_DB	Binlog_Ignore_DB	Executed_Gtid_Set
binlog.000001	386			
SHOW STATUS LIKE 'binlog_snapshot_%';
Variable_name	Value
Binlog_snapshot_file	binlog.000001
Binlog_snapshot_position	386
BEGIN;
INSERT INTO t1 VALUES (0, "");
# Connection con1
BEGIN;
INSERT INTO t1 VALUES (1, "");
# Connection con2
CREATE TABLE t2 (a INT PRIMARY KEY) ENGINE=myisam;
BEGIN;
INSERT INTO t1 VALUES (2, "first");
INSERT INTO t2 VALUES (2);
INSERT INTO t1 VALUES (2, "second");
# Connection default
COMMIT;
SET TRANSACTION ISOLATION LEVEL REPEATABLE READ;
START TRANSACTION WITH CONSISTENT SNAPSHOT;
# Connection con3
BEGIN;
INSERT INTO t1 VALUES (3, "");
INSERT INTO t2 VALUES (3);
# Connection con4
BEGIN;
INSERT INTO t1 VALUES (4, "");
COMMIT;
# Connection default
SELECT * FROM t1 ORDER BY a,b;
a	b
0	
SHOW STATUS LIKE 'binlog_snapshot_%';
Variable_name	Value
Binlog_snapshot_file	binlog.000001
Binlog_snapshot_position	1193
SHOW MASTER STATUS;
File	Position	Binlog_Do_DB	Binlog_Ignore_DB	Executed_Gtid_Set
binlog.000001	1801			
SELECT * FROM t2 ORDER BY a;
a
2
3
# Connection con1
COMMIT;
# Connection con2
COMMIT;
# Connection con3
COMMIT;
FLUSH LOGS;
# Connection default
SELECT * FROM t1 ORDER BY a,b;
a	b
0	
SHOW STATUS LIKE 'binlog_snapshot_%';
Variable_name	Value
Binlog_snapshot_file	binlog.000001
Binlog_snapshot_position	1193
SHOW MASTER STATUS;
File	Position	Binlog_Do_DB	Binlog_Ignore_DB	Executed_Gtid_Set
binlog.000002	155			
COMMIT;
SHOW STATUS LIKE 'binlog_snapshot_%';
Variable_name	Value
Binlog_snapshot_file	binlog.000002
Binlog_snapshot_position	155
SHOW MASTER STATUS;
File	Position	Binlog_Do_DB	Binlog_Ignore_DB	Executed_Gtid_Set
binlog.000002	155			
# Test START TRANSACTION WITH CONSISTENT SNAPSHOT FROM SESSION
DELETE FROM t1;
START TRANSACTION WITH CONSISTENT SNAPSHOT;
SHOW STATUS LIKE 'binlog_snapshot_%';
Variable_name	Value
Binlog_snapshot_file	binlog.000002
Binlog_snapshot_position	434
SHOW MASTER STATUS;
File	Position	Binlog_Do_DB	Binlog_Ignore_DB	Executed_Gtid_Set
binlog.000002	434			
INSERT INTO t1 VALUES (1, "first");
SELECT * FROM t1;
a	b
1	first
# Connection con3
INSERT INTO t1 VALUES (3, "third");
SELECT * FROM t1;
a	b
3	third
SHOW STATUS LIKE 'binlog_snapshot_%';
Variable_name	Value
Binlog_snapshot_file	binlog.000002
Binlog_snapshot_position	733
SHOW MASTER STATUS;
File	Position	Binlog_Do_DB	Binlog_Ignore_DB	Executed_Gtid_Set
binlog.000002	733			
# Connection con2
SELECT * FROM t1;
a	b
3	third
SHOW STATUS LIKE 'binlog_snapshot_%';
Variable_name	Value
Binlog_snapshot_file	binlog.000002
Binlog_snapshot_position	733
SHOW MASTER STATUS;
File	Position	Binlog_Do_DB	Binlog_Ignore_DB	Executed_Gtid_Set
binlog.000002	733			
START TRANSACTION WITH CONSISTENT SNAPSHOT FROM SESSION $donor_id;
SELECT * FROM t1;
a	b
1	first
SHOW STATUS LIKE 'binlog_snapshot_%';
Variable_name	Value
Binlog_snapshot_file	binlog.000002
Binlog_snapshot_position	434
SHOW MASTER STATUS;
File	Position	Binlog_Do_DB	Binlog_Ignore_DB	Executed_Gtid_Set
binlog.000002	733			
# Connection con3
FLUSH LOGS;
SHOW STATUS LIKE 'binlog_snapshot_%';
Variable_name	Value
Binlog_snapshot_file	binlog.000003
Binlog_snapshot_position	155
SHOW MASTER STATUS;
File	Position	Binlog_Do_DB	Binlog_Ignore_DB	Executed_Gtid_Set
binlog.000003	155			
# Connection con2
SHOW STATUS LIKE 'binlog_snapshot_%';
Variable_name	Value
Binlog_snapshot_file	binlog.000002
Binlog_snapshot_position	434
SHOW MASTER STATUS;
File	Position	Binlog_Do_DB	Binlog_Ignore_DB	Executed_Gtid_Set
binlog.000003	155			
COMMIT;
# Connection default
SHOW STATUS LIKE 'binlog_snapshot_%';
Variable_name	Value
Binlog_snapshot_file	binlog.000002
Binlog_snapshot_position	434
SHOW MASTER STATUS;
File	Position	Binlog_Do_DB	Binlog_Ignore_DB	Executed_Gtid_Set
binlog.000003	155			
COMMIT;
SHOW BINLOG EVENTS;
Log_name	Pos	Event_type	Server_id	End_log_pos	Info
binlog.000001	4	Format_desc	1	124	Server ver: #, Binlog ver: #
binlog.000001	124	Previous_gtids	1	155	
binlog.000001	155	Anonymous_Gtid	1	228	SET @@SESSION.GTID_NEXT= 'ANONYMOUS'
binlog.000001	228	Query	1	386	use `test`; CREATE TABLE t1 (a INT, b VARCHAR(100), PRIMARY KEY (a,b)) ENGINE=innodb /* XID */
binlog.000001	386	Anonymous_Gtid	1	459	SET @@SESSION.GTID_NEXT= 'ANONYMOUS'
binlog.000001	459	Query	1	585	use `test`; CREATE TABLE t2 (a INT PRIMARY KEY) ENGINE=myisam
binlog.000001	585	Anonymous_Gtid	1	660	SET @@SESSION.GTID_NEXT= 'ANONYMOUS'
binlog.000001	660	Query	1	735	BEGIN
binlog.000001	735	Table_map	1	783	table_id: # (test.t2)
binlog.000001	783	Write_rows	1	823	table_id: # flags: STMT_END_F
binlog.000001	823	Query	1	899	COMMIT
binlog.000001	899	Anonymous_Gtid	1	974	SET @@SESSION.GTID_NEXT= 'ANONYMOUS'
binlog.000001	974	Query	1	1056	BEGIN
binlog.000001	1056	Query	1	1162	use `test`; INSERT INTO t1 VALUES (0, "")
binlog.000001	1162	Xid	1	1193	COMMIT /* XID */
binlog.000001	1193	Anonymous_Gtid	1	1268	SET @@SESSION.GTID_NEXT= 'ANONYMOUS'
binlog.000001	1268	Query	1	1343	BEGIN
binlog.000001	1343	Table_map	1	1391	table_id: # (test.t2)
binlog.000001	1391	Write_rows	1	1431	table_id: # flags: STMT_END_F
binlog.000001	1431	Query	1	1507	COMMIT
binlog.000001	1507	Anonymous_Gtid	1	1582	SET @@SESSION.GTID_NEXT= 'ANONYMOUS'
binlog.000001	1582	Query	1	1664	BEGIN
binlog.000001	1664	Query	1	1770	use `test`; INSERT INTO t1 VALUES (4, "")
binlog.000001	1770	Xid	1	1801	COMMIT /* XID */
binlog.000001	1801	Anonymous_Gtid	1	1876	SET @@SESSION.GTID_NEXT= 'ANONYMOUS'
binlog.000001	1876	Query	1	1958	BEGIN
binlog.000001	1958	Query	1	2064	use `test`; INSERT INTO t1 VALUES (1, "")
binlog.000001	2064	Xid	1	2095	COMMIT /* XID */
binlog.000001	2095	Anonymous_Gtid	1	2170	SET @@SESSION.GTID_NEXT= 'ANONYMOUS'
binlog.000001	2170	Query	1	2252	BEGIN
binlog.000001	2252	Query	1	2363	use `test`; INSERT INTO t1 VALUES (2, "first")
binlog.000001	2363	Query	1	2475	use `test`; INSERT INTO t1 VALUES (2, "second")
binlog.000001	2475	Xid	1	2506	COMMIT /* XID */
binlog.000001	2506	Anonymous_Gtid	1	2581	SET @@SESSION.GTID_NEXT= 'ANONYMOUS'
binlog.000001	2581	Query	1	2663	BEGIN
binlog.000001	2663	Query	1	2769	use `test`; INSERT INTO t1 VALUES (3, "")
binlog.000001	2769	Xid	1	2800	COMMIT /* XID */
binlog.000001	2800	Rotate	1	2844	binlog.000002;pos=4
DROP TABLE t1,t2;
