RESET BINARY LOGS AND GTIDS;
# Connection default
CREATE TABLE t1 (a INT, b VARCHAR(100), PRIMARY KEY (a,b)) ENGINE=innodb;
SHOW BINARY LOG STATUS;
File	Position	Binlog_Do_DB	Binlog_Ignore_DB	Executed_Gtid_Set
binlog.000001	393			
SHOW STATUS LIKE 'binlog_snapshot_%';
Variable_name	Value
Binlog_snapshot_file	binlog.000001
Binlog_snapshot_position	393
BEGIN;
INSERT INTO t1 VALUES (0, "");
# Connection con1
BEGIN;
INSERT INTO t1 VALUES (1, "");
# Connection con2
CREATE TABLE t2 (a INT PRIMARY KEY) ENGINE=myisam;
BEGIN;
INSERT INTO t1 VALUES (2, "first");
INSERT INTO t2 VALUES (2);
INSERT INTO t1 VALUES (2, "second");
# Connection default
COMMIT;
SET TRANSACTION ISOLATION LEVEL REPEATABLE READ;
START TRANSACTION WITH CONSISTENT SNAPSHOT;
# Connection con3
BEGIN;
INSERT INTO t1 VALUES (3, "");
INSERT INTO t2 VALUES (3);
# Connection con4
BEGIN;
INSERT INTO t1 VALUES (4, "");
COMMIT;
# Connection default
SELECT * FROM t1 ORDER BY a,b;
a	b
0	
SHOW STATUS LIKE 'binlog_snapshot_%';
Variable_name	Value
Binlog_snapshot_file	binlog.000001
Binlog_snapshot_position	1214
SHOW BINARY LOG STATUS;
File	Position	Binlog_Do_DB	Binlog_Ignore_DB	Executed_Gtid_Set
binlog.000001	1830			
SELECT * FROM t2 ORDER BY a;
a
2
3
# Connection con1
COMMIT;
# Connection con2
COMMIT;
# Connection con3
COMMIT;
FLUSH LOGS;
# Connection default
SELECT * FROM t1 ORDER BY a,b;
a	b
0	
SHOW STATUS LIKE 'binlog_snapshot_%';
Variable_name	Value
Binlog_snapshot_file	binlog.000001
Binlog_snapshot_position	1214
SHOW BINARY LOG STATUS;
File	Position	Binlog_Do_DB	Binlog_Ignore_DB	Executed_Gtid_Set
binlog.000002	156			
COMMIT;
SHOW STATUS LIKE 'binlog_snapshot_%';
Variable_name	Value
Binlog_snapshot_file	binlog.000002
Binlog_snapshot_position	156
SHOW BINARY LOG STATUS;
File	Position	Binlog_Do_DB	Binlog_Ignore_DB	Executed_Gtid_Set
binlog.000002	156			
# Test START TRANSACTION WITH CONSISTENT SNAPSHOT FROM SESSION
DELETE FROM t1;
START TRANSACTION WITH CONSISTENT SNAPSHOT;
SHOW STATUS LIKE 'binlog_snapshot_%';
Variable_name	Value
Binlog_snapshot_file	binlog.000002
Binlog_snapshot_position	439
SHOW BINARY LOG STATUS;
File	Position	Binlog_Do_DB	Binlog_Ignore_DB	Executed_Gtid_Set
binlog.000002	439			
INSERT INTO t1 VALUES (1, "first");
SELECT * FROM t1;
a	b
1	first
# Connection con3
INSERT INTO t1 VALUES (3, "third");
SELECT * FROM t1;
a	b
3	third
SHOW STATUS LIKE 'binlog_snapshot_%';
Variable_name	Value
Binlog_snapshot_file	binlog.000002
Binlog_snapshot_position	742
SHOW BINARY LOG STATUS;
File	Position	Binlog_Do_DB	Binlog_Ignore_DB	Executed_Gtid_Set
binlog.000002	742			
# Connection con2
SELECT * FROM t1;
a	b
3	third
SHOW STATUS LIKE 'binlog_snapshot_%';
Variable_name	Value
Binlog_snapshot_file	binlog.000002
Binlog_snapshot_position	742
SHOW BINARY LOG STATUS;
File	Position	Binlog_Do_DB	Binlog_Ignore_DB	Executed_Gtid_Set
binlog.000002	742			
START TRANSACTION WITH CONSISTENT SNAPSHOT FROM SESSION $donor_id;
SELECT * FROM t1;
a	b
1	first
SHOW STATUS LIKE 'binlog_snapshot_%';
Variable_name	Value
Binlog_snapshot_file	binlog.000002
Binlog_snapshot_position	439
SHOW BINARY LOG STATUS;
File	Position	Binlog_Do_DB	Binlog_Ignore_DB	Executed_Gtid_Set
binlog.000002	742			
# Connection con3
FLUSH LOGS;
SHOW STATUS LIKE 'binlog_snapshot_%';
Variable_name	Value
Binlog_snapshot_file	binlog.000003
Binlog_snapshot_position	156
SHOW BINARY LOG STATUS;
File	Position	Binlog_Do_DB	Binlog_Ignore_DB	Executed_Gtid_Set
binlog.000003	156			
# Connection con2
SHOW STATUS LIKE 'binlog_snapshot_%';
Variable_name	Value
Binlog_snapshot_file	binlog.000002
Binlog_snapshot_position	439
SHOW BINARY LOG STATUS;
File	Position	Binlog_Do_DB	Binlog_Ignore_DB	Executed_Gtid_Set
binlog.000003	156			
COMMIT;
# Connection default
SHOW STATUS LIKE 'binlog_snapshot_%';
Variable_name	Value
Binlog_snapshot_file	binlog.000002
Binlog_snapshot_position	439
SHOW BINARY LOG STATUS;
File	Position	Binlog_Do_DB	Binlog_Ignore_DB	Executed_Gtid_Set
binlog.000003	156			
COMMIT;
SHOW BINLOG EVENTS;
Log_name	Pos	Event_type	Server_id	End_log_pos	Info
binlog.000001	4	Format_desc	1	125	Server ver: #, Binlog ver: #
binlog.000001	125	Previous_gtids	1	156	
binlog.000001	156	Anonymous_Gtid	1	233	SET @@SESSION.GTID_NEXT= 'ANONYMOUS'
binlog.000001	233	Query	1	393	use `test`; CREATE TABLE t1 (a INT, b VARCHAR(100), PRIMARY KEY (a,b)) ENGINE=innodb /* XID */
binlog.000001	393	Anonymous_Gtid	1	470	SET @@SESSION.GTID_NEXT= 'ANONYMOUS'
binlog.000001	470	Query	1	598	use `test`; CREATE TABLE t2 (a INT PRIMARY KEY) ENGINE=myisam
binlog.000001	598	Anonymous_Gtid	1	677	SET @@SESSION.GTID_NEXT= 'ANONYMOUS'
binlog.000001	677	Query	1	752	BEGIN
binlog.000001	752	Table_map	1	800	table_id: # (test.t2)
binlog.000001	800	Write_rows	1	840	table_id: # flags: STMT_END_F
binlog.000001	840	Query	1	916	COMMIT
binlog.000001	916	Anonymous_Gtid	1	995	SET @@SESSION.GTID_NEXT= 'ANONYMOUS'
binlog.000001	995	Query	1	1077	BEGIN
binlog.000001	1077	Query	1	1183	use `test`; INSERT INTO t1 VALUES (0, "")
binlog.000001	1183	Xid	1	1214	COMMIT /* XID */
binlog.000001	1214	Anonymous_Gtid	1	1293	SET @@SESSION.GTID_NEXT= 'ANONYMOUS'
binlog.000001	1293	Query	1	1368	BEGIN
binlog.000001	1368	Table_map	1	1416	table_id: # (test.t2)
binlog.000001	1416	Write_rows	1	1456	table_id: # flags: STMT_END_F
binlog.000001	1456	Query	1	1532	COMMIT
binlog.000001	1532	Anonymous_Gtid	1	1611	SET @@SESSION.GTID_NEXT= 'ANONYMOUS'
binlog.000001	1611	Query	1	1693	BEGIN
binlog.000001	1693	Query	1	1799	use `test`; INSERT INTO t1 VALUES (4, "")
binlog.000001	1799	Xid	1	1830	COMMIT /* XID */
binlog.000001	1830	Anonymous_Gtid	1	1909	SET @@SESSION.GTID_NEXT= 'ANONYMOUS'
binlog.000001	1909	Query	1	1991	BEGIN
binlog.000001	1991	Query	1	2097	use `test`; INSERT INTO t1 VALUES (1, "")
binlog.000001	2097	Xid	1	2128	COMMIT /* XID */
binlog.000001	2128	Anonymous_Gtid	1	2207	SET @@SESSION.GTID_NEXT= 'ANONYMOUS'
binlog.000001	2207	Query	1	2289	BEGIN
binlog.000001	2289	Query	1	2400	use `test`; INSERT INTO t1 VALUES (2, "first")
binlog.000001	2400	Query	1	2512	use `test`; INSERT INTO t1 VALUES (2, "second")
binlog.000001	2512	Xid	1	2543	COMMIT /* XID */
binlog.000001	2543	Anonymous_Gtid	1	2622	SET @@SESSION.GTID_NEXT= 'ANONYMOUS'
binlog.000001	2622	Query	1	2704	BEGIN
binlog.000001	2704	Query	1	2810	use `test`; INSERT INTO t1 VALUES (3, "")
binlog.000001	2810	Xid	1	2841	COMMIT /* XID */
binlog.000001	2841	Rotate	1	2885	binlog.000002;pos=4
DROP TABLE t1,t2;
