drop table if exists t1;
set @@session.max_heap_table_size=16*1024*1024;
create table t1 (a int not null, b varchar(400), c int, primary key (a), key (c)) engine=heap comment="testing heaps" key_block_size=128;
ERROR 42000: Incorrect usage/placement of 'key_block_size'
create table t1 (a int not null, b int, c varchar(400), primary key (a), key (b)) engine=heap comment="testing heaps" key_block_size=4;
ERROR 42000: Incorrect usage/placement of 'key_block_size'
create table t1 (a int not null, b int, c varchar(400), d varchar(400), primary key (a), key (b)) engine=heap comment="testing heaps" key_block_size=24;
show table status like "t1";
Name	t1
Engine	MEMORY
Version	10
Row_format	Dynamic
Rows	0
Avg_row_length	X
Data_length	X
Max_data_length	X
Index_length	X
Data_free	X
Auto_increment	X
Create_time	X
Update_time	X
Check_time	X
Collation	latin1_swedish_ci
Checksum	NULL
Create_options	KEY_BLOCK_SIZE=24
Comment	testing heaps
insert into t1 values (1,1,'012',NULL), (2,2,'0123456789',NULL), (3,3,'012345678901234567890123456789',NULL), (4,4,NULL,'0123456789012345678901234567890123456789012345678901234567890123456789');
select * from t1;
a	b	c	d
1	1	012	NULL
2	2	0123456789	NULL
3	3	012345678901234567890123456789	NULL
4	4	NULL	0123456789012345678901234567890123456789012345678901234567890123456789
delete from t1 where a = 3;
select * from t1;
a	b	c	d
1	1	012	NULL
2	2	0123456789	NULL
4	4	NULL	0123456789012345678901234567890123456789012345678901234567890123456789
insert into t1 values (5,5,NULL,'0123'), (6,6,NULL,'0123');
select * from t1;
a	b	c	d
1	1	012	NULL
2	2	0123456789	NULL
6	6	NULL	0123
5	5	NULL	0123
4	4	NULL	0123456789012345678901234567890123456789012345678901234567890123456789
update t1 set c = '012345678901234567890123456789' where a = 2;
select * from t1;
a	b	c	d
1	1	012	NULL
2	2	012345678901234567890123456789	NULL
6	6	NULL	0123
5	5	NULL	0123
4	4	NULL	0123456789012345678901234567890123456789012345678901234567890123456789
update t1 set c = '0123456789' where a = 2;
select * from t1;
a	b	c	d
1	1	012	NULL
2	2	0123456789	NULL
6	6	NULL	0123
5	5	NULL	0123
4	4	NULL	0123456789012345678901234567890123456789012345678901234567890123456789
insert into t1 values (7,7,'0123',NULL), (8,8,'0123',NULL);
select * from t1;
a	b	c	d
1	1	012	NULL
2	2	0123456789	NULL
6	6	NULL	0123
5	5	NULL	0123
4	4	NULL	0123456789012345678901234567890123456789012345678901234567890123456789
7	7	0123	NULL
8	8	0123	NULL
show table status like "t1";
Name	t1
Engine	MEMORY
Version	10
Row_format	Dynamic
Rows	7
Avg_row_length	X
Data_length	X
Max_data_length	X
Index_length	X
Data_free	X
Auto_increment	X
Create_time	X
Update_time	X
Check_time	X
Collation	latin1_swedish_ci
Checksum	NULL
Create_options	KEY_BLOCK_SIZE=24
Comment	testing heaps
alter table t1 key_block_size = 0;
show table status like "t1";
Name	t1
Engine	MEMORY
Version	10
Row_format	Dynamic
Rows	7
Avg_row_length	X
Data_length	X
Max_data_length	X
Index_length	X
Data_free	X
Auto_increment	X
Create_time	X
Update_time	X
Check_time	X
Collation	latin1_swedish_ci
Checksum	NULL
Create_options	
Comment	testing heaps
alter table t1 row_format = dynamic;
show table status like "t1";
Name	t1
Engine	MEMORY
Version	10
Row_format	Dynamic
Rows	7
Avg_row_length	X
Data_length	X
Max_data_length	X
Index_length	X
Data_free	X
Auto_increment	X
Create_time	X
Update_time	X
Check_time	X
Collation	latin1_swedish_ci
Checksum	NULL
Create_options	row_format=DYNAMIC KEY_BLOCK_SIZE=X
Comment	testing heaps
alter table t1 key_block_size = 128, max_rows = 10001;
show table status like "t1";
Name	t1
Engine	MEMORY
Version	10
Row_format	Dynamic
Rows	7
Avg_row_length	X
Data_length	X
Max_data_length	X
Index_length	X
Data_free	X
Auto_increment	X
Create_time	X
Update_time	X
Check_time	X
Collation	latin1_swedish_ci
Checksum	NULL
Create_options	max_rows=10001 row_format=DYNAMIC KEY_BLOCK_SIZE=128
Comment	testing heaps
select * from t1;
a	b	c	d
1	1	012	NULL
2	2	0123456789	NULL
6	6	NULL	0123
5	5	NULL	0123
4	4	NULL	0123456789012345678901234567890123456789012345678901234567890123456789
7	7	0123	NULL
8	8	0123	NULL
delete from t1;
select * from t1;
a	b	c	d
call mtr.add_suppression("The table 't1' is full");
select count(*) from t1;
count(*)
10001
insert into t1 values (100000,100000,NULL,'0123'), (100000,100000,NULL,'0123');
ERROR HY000: The table 't1' is full
show table status like "t1";
Name	t1
Engine	MEMORY
Version	10
Row_format	Dynamic
Rows	10001
Avg_row_length	X
Data_length	X
Max_data_length	X
Index_length	X
Data_free	X
Auto_increment	X
Create_time	X
Update_time	X
Check_time	X
Collation	latin1_swedish_ci
Checksum	NULL
Create_options	max_rows=10001 row_format=DYNAMIC KEY_BLOCK_SIZE=128
Comment	testing heaps
select count(*) from t1;
count(*)
10001
set @@session.max_heap_table_size=default;
drop table t1;
#
# Bug 1731483: MEMORY storage engine incorrectly allows BLOB columns before indexed columns
#
CREATE TABLE t1 (a BLOB, b INT PRIMARY KEY) ENGINE=MEMORY;
ERROR 42000: The used table type doesn't support BLOB/TEXT columns
CREATE TABLE t1 (a TEXT, b INT PRIMARY KEY) ENGINE=MEMORY;
ERROR 42000: The used table type doesn't support BLOB/TEXT columns
CREATE TABLE t1 (a INT PRIMARY KEY, b BLOB, c INT, KEY c(c)) ENGINE=MEMORY;
ERROR 42000: The used table type doesn't support BLOB/TEXT columns
CREATE TABLE t1 (a INT PRIMARY KEY, b TEXT, c INT, KEY c(c)) ENGINE=MEMORY;
ERROR 42000: The used table type doesn't support BLOB/TEXT columns
CREATE TABLE t1 (a BLOB, b INT) ENGINE=MEMORY;
ALTER TABLE t1 ADD INDEX idx_b (b);
ERROR 42000: The used table type doesn't support BLOB/TEXT columns
ALTER TABLE t1 ADD PRIMARY KEY (b);
ERROR 42000: The used table type doesn't support BLOB/TEXT columns
DROP TABLE t1;
CREATE TABLE t1 (a TEXT, b INT) ENGINE=MEMORY;
ALTER TABLE t1 ADD INDEX idx_b (b);
ERROR 42000: The used table type doesn't support BLOB/TEXT columns
ALTER TABLE t1 ADD PRIMARY KEY (b);
ERROR 42000: The used table type doesn't support BLOB/TEXT columns
DROP TABLE t1;
CREATE TABLE t1 (a INT PRIMARY KEY, b BLOB, c INT) ENGINE=MEMORY;
ALTER TABLE t1 ADD INDEX c (c);
ERROR 42000: The used table type doesn't support BLOB/TEXT columns
DROP TABLE t1;
CREATE TABLE t1 (a INT PRIMARY KEY, b TEXT, c INT) ENGINE=MEMORY;
ALTER TABLE t1 ADD INDEX c (c);
ERROR 42000: The used table type doesn't support BLOB/TEXT columns
DROP TABLE t1;
CREATE TABLE t1 (a BLOB, b INT PRIMARY KEY) ENGINE=InnoDB;
ALTER TABLE t1 ENGINE=MEMORY;
ERROR 42000: The used table type doesn't support BLOB/TEXT columns
DROP TABLE t1;
CREATE TABLE t1 (a TEXT, b INT PRIMARY KEY) ENGINE=InnoDB;
ALTER TABLE t1 ENGINE=MEMORY;
ERROR 42000: The used table type doesn't support BLOB/TEXT columns
DROP TABLE t1;
CREATE TABLE t1 (a INT PRIMARY KEY, b BLOB, c INT, KEY c(c)) ENGINE=InnoDB;
ALTER TABLE t1 ENGINE=MEMORY;
ERROR 42000: The used table type doesn't support BLOB/TEXT columns
DROP TABLE t1;
CREATE TABLE t1 (a INT PRIMARY KEY, b TEXT, c INT, KEY c(c)) ENGINE=InnoDB;
ALTER TABLE t1 ENGINE=MEMORY;
ERROR 42000: The used table type doesn't support BLOB/TEXT columns
DROP TABLE t1;
CREATE TABLE t1 (a INT PRIMARY KEY, b BLOB, c TEXT) ENGINE=MEMORY;
ALTER TABLE t1 MODIFY b BLOB FIRST;
ERROR 42000: The used table type doesn't support BLOB/TEXT columns
ALTER TABLE t1 MODIFY c TEXT FIRST;
ERROR 42000: The used table type doesn't support BLOB/TEXT columns
DROP TABLE t1;
CREATE TABLE t1 (a INT, b BLOB, c INT, PRIMARY KEY(a, c)) ENGINE=MEMORY;
ERROR 42000: The used table type doesn't support BLOB/TEXT columns
CREATE TABLE t1 (a INT, b TEXT, c INT, PRIMARY KEY(c, a)) ENGINE=MEMORY;
ERROR 42000: The used table type doesn't support BLOB/TEXT columns
CREATE TABLE t1 (a INT, b TEXT, c INT) ENGINE=MEMORY;
ALTER TABLE t1 ADD PRIMARY KEY (a, c);
ERROR 42000: The used table type doesn't support BLOB/TEXT columns
ALTER TABLE t1 ADD INDEX idx (c, a);
ERROR 42000: The used table type doesn't support BLOB/TEXT columns
DROP TABLE t1;
