DROP TABLE IF EXISTS t1, t2, t3;
# Checking variables
SHOW VARIABLES LIKE 'innodb_fake_changes';
Variable_name	Value
innodb_fake_changes	OFF
SELECT VARIABLE_VALUE FROM INFORMATION_SCHEMA.SESSION_VARIABLES WHERE VARIABLE_NAME='innodb_fake_changes';
VARIABLE_VALUE
OFF
SET innodb_fake_changes=1;
SHOW VARIABLES LIKE 'innodb_fake_changes';
Variable_name	Value
innodb_fake_changes	ON
SELECT VARIABLE_VALUE FROM INFORMATION_SCHEMA.SESSION_VARIABLES WHERE VARIABLE_NAME='innodb_fake_changes';
VARIABLE_VALUE
ON
SET innodb_fake_changes=default;
SHOW VARIABLES LIKE 'innodb_fake_changes';
Variable_name	Value
innodb_fake_changes	OFF
SELECT VARIABLE_VALUE FROM INFORMATION_SCHEMA.SESSION_VARIABLES WHERE VARIABLE_NAME='innodb_fake_changes';
VARIABLE_VALUE
OFF
# Explicit COMMIT should fail when innodb_fake_changes is enabled
# DML should be fine
SET @@GLOBAL.userstat= TRUE;
CREATE TABLE t1 (a INT) ENGINE=InnoDB;
INSERT INTO t1 VALUES (1);
SET autocommit=0;
SET innodb_fake_changes=1;
BEGIN;
INSERT INTO t1 VALUES (2);
UPDATE t1 SET a=0;
DELETE FROM t1 LIMIT 1;
SELECT * FROM t1;
a
1
COMMIT;
ERROR HY000: Got error 131 during COMMIT
SET innodb_fake_changes=default;
# Verify that the fake changes to t1 did not leak through
CHECK TABLE t1;
Table	Op	Msg_type	Msg_text
test.t1	check	status	OK
should_be_1
1
should_be_0
0
should_be_0
0
should_be_0
0
should_be_0
0
should_be_0
0
should_be_0
0
DROP TABLE t1;
# DDL must result in error
CREATE TABLE t1 (a INT PRIMARY KEY) ENGINE=InnoDB;
SET autocommit=0;
SET innodb_fake_changes=1;
BEGIN;
CREATE TABLE t2 (a INT) ENGINE=InnoDB;
ERROR HY000: Can't create table 'test.t2' (errno: 131)
DROP TABLE t1;
ERROR 42S02: Unknown table 't1'
TRUNCATE TABLE t1;
ERROR HY000: Got error 131 during COMMIT
ALTER TABLE t1 ENGINE=MyISAM;
ERROR HY000: Got error 131 during COMMIT
ROLLBACK;
SET innodb_fake_changes=0;
INSERT INTO t1 VALUES (1), (2);
COMMIT;
CREATE TABLE t2 (a INT PRIMARY KEY, b INT, INDEX b_ind (b),
FOREIGN KEY (b) REFERENCES t1(a) ON DELETE CASCADE ON UPDATE CASCADE) ENGINE=InnoDB;
INSERT INTO t2 VALUES (1, 1);
INSERT INTO t2 VALUES (2, 2);
COMMIT;
SET innodb_fake_changes=1;
DELETE FROM t1 WHERE a=1;
UPDATE t1 SET a=3 WHERE a=2;
COMMIT;
ERROR HY000: Got error 131 during COMMIT
should_be_1
1
should_be_0
0
should_be_0
0
should_be_0
0
should_be_0
0
should_be_0
0
SET innodb_fake_changes=0;
DROP TABLE t2;
CREATE TABLE t3 (a INT primary key, b text) ENGINE=InnoDB;
INSERT INTO t3 VALUES (1,'');
COMMIT;
SET innodb_fake_changes=1;
UPDATE t3 set b=lpad('b',11000,'c') where a=1;
COMMIT;
ERROR HY000: Got error 131 during COMMIT
SET innodb_fake_changes=default;
# Verify that the fake changes to t3 did not leak through
CHECK TABLE t3;
Table	Op	Msg_type	Msg_text
test.t3	check	status	OK
should_be_1
1
DROP TABLE t1, t3;
SET @@GLOBAL.userstat= default;
