DROP TABLE IF EXISTS t1, t2, t3;
# Checking variables
SHOW VARIABLES LIKE 'innodb_fake_changes';
Variable_name	Value
innodb_fake_changes	OFF
SELECT VARIABLE_VALUE FROM INFORMATION_SCHEMA.SESSION_VARIABLES WHERE VARIABLE_NAME='innodb_fake_changes';
VARIABLE_VALUE
OFF
SET innodb_fake_changes=1;
SHOW VARIABLES LIKE 'innodb_fake_changes';
Variable_name	Value
innodb_fake_changes	ON
SELECT VARIABLE_VALUE FROM INFORMATION_SCHEMA.SESSION_VARIABLES WHERE VARIABLE_NAME='innodb_fake_changes';
VARIABLE_VALUE
ON
SET innodb_fake_changes=default;
SHOW VARIABLES LIKE 'innodb_fake_changes';
Variable_name	Value
innodb_fake_changes	OFF
SELECT VARIABLE_VALUE FROM INFORMATION_SCHEMA.SESSION_VARIABLES WHERE VARIABLE_NAME='innodb_fake_changes';
VARIABLE_VALUE
OFF
# Explicit COMMIT should fail when innodb_fake_changes is enabled
# DML should be fine
SET @@GLOBAL.userstat=TRUE;
CREATE TABLE t1 (a INT) ENGINE=InnoDB;
INSERT INTO t1 VALUES (1);
SELECT @@global.userstat = 1 AS should_be_1;
should_be_1
1
SELECT VARIABLE_VALUE INTO @innodb_rows_inserted_1 FROM INFORMATION_SCHEMA.GLOBAL_STATUS WHERE VARIABLE_NAME = 'Innodb_rows_inserted';
SELECT VARIABLE_VALUE INTO @innodb_rows_deleted_1 FROM INFORMATION_SCHEMA.GLOBAL_STATUS WHERE VARIABLE_NAME = 'Innodb_rows_deleted';
SELECT VARIABLE_VALUE INTO @innodb_rows_updated_1 FROM INFORMATION_SCHEMA.GLOBAL_STATUS WHERE VARIABLE_NAME = 'Innodb_rows_updated';
SELECT ROWS INTO @table_rows_estimate_1 FROM INFORMATION_SCHEMA.INNODB_TABLE_STATS WHERE TABLE_SCHEMA LIKE 'test' AND TABLE_NAME LIKE 't1';
SELECT ROWS_CHANGED INTO @table_rows_changed_1 FROM INFORMATION_SCHEMA.TABLE_STATISTICS WHERE TABLE_SCHEMA LIKE 'test' AND TABLE_NAME LIKE 't1';
SELECT ROWS_CHANGED_X_INDEXES INTO @table_rows_changed_x_indexes_1 FROM INFORMATION_SCHEMA.TABLE_STATISTICS WHERE TABLE_SCHEMA LIKE 'test' AND TABLE_NAME LIKE 't1';
SET innodb_fake_changes=1;
BEGIN;
INSERT INTO t1 VALUES (2);
UPDATE t1 SET a=0;
DELETE FROM t1 LIMIT 1;
SELECT * FROM t1;
a
1
COMMIT;
ERROR HY000: Got error 131 during COMMIT
SET innodb_fake_changes=0;
CHECK TABLE t1;
Table	Op	Msg_type	Msg_text
test.t1	check	status	OK
SELECT VARIABLE_VALUE INTO @innodb_rows_inserted_2 FROM INFORMATION_SCHEMA.GLOBAL_STATUS WHERE VARIABLE_NAME = 'Innodb_rows_inserted';
SELECT VARIABLE_VALUE INTO @innodb_rows_deleted_2 FROM INFORMATION_SCHEMA.GLOBAL_STATUS WHERE VARIABLE_NAME='Innodb_rows_deleted';
SELECT VARIABLE_VALUE INTO @innodb_rows_updated_2 FROM INFORMATION_SCHEMA.GLOBAL_STATUS WHERE VARIABLE_NAME='Innodb_rows_updated';
SELECT ROWS INTO @table_rows_estimate_2 FROM INFORMATION_SCHEMA.INNODB_TABLE_STATS WHERE TABLE_SCHEMA LIKE 'test' AND TABLE_NAME LIKE 't1';
SELECT ROWS_CHANGED INTO @table_rows_changed_2 FROM INFORMATION_SCHEMA.TABLE_STATISTICS WHERE TABLE_SCHEMA LIKE 'test' AND TABLE_NAME LIKE 't1';
SELECT ROWS_CHANGED_X_INDEXES INTO @table_rows_changed_x_indexes_2 FROM INFORMATION_SCHEMA.TABLE_STATISTICS WHERE TABLE_SCHEMA LIKE 'test' AND TABLE_NAME LIKE 't1';
should_be_1
1
SELECT @innodb_rows_inserted_2 - @innodb_rows_inserted_1 AS should_be_0;
should_be_0
0
SELECT @innodb_rows_deleted_2 - @innodb_rows_deleted_1 AS should_be_0;
should_be_0
0
SELECT @innodb_rows_updated_2 - @innodb_rows_updated_1 AS should_be_0;
should_be_0
0
SELECT @table_rows_estimate_2 - @table_rows_estimate_1 AS should_be_0;
should_be_0
0
SELECT @table_rows_changed_2 - @table_rows_changed_1 AS should_be_0;
should_be_0
0
SELECT @table_rows_changed_x_indexes_2 - @table_rows_changed_x_indexes_1 AS should_be_0;
should_be_0
0
DROP TABLE t1;
CREATE TABLE t1 (a INT PRIMARY KEY, b INT, UNIQUE KEY (b)) ENGINE=InnoDB;
INSERT INTO t1 VALUES (1,1);
SELECT @@global.userstat = 1 AS should_be_1;
should_be_1
1
SELECT VARIABLE_VALUE INTO @innodb_rows_inserted_1 FROM INFORMATION_SCHEMA.GLOBAL_STATUS WHERE VARIABLE_NAME = 'Innodb_rows_inserted';
SELECT VARIABLE_VALUE INTO @innodb_rows_deleted_1 FROM INFORMATION_SCHEMA.GLOBAL_STATUS WHERE VARIABLE_NAME = 'Innodb_rows_deleted';
SELECT VARIABLE_VALUE INTO @innodb_rows_updated_1 FROM INFORMATION_SCHEMA.GLOBAL_STATUS WHERE VARIABLE_NAME = 'Innodb_rows_updated';
SELECT ROWS INTO @table_rows_estimate_1 FROM INFORMATION_SCHEMA.INNODB_TABLE_STATS WHERE TABLE_SCHEMA LIKE 'test' AND TABLE_NAME LIKE 't1';
SELECT ROWS_CHANGED INTO @table_rows_changed_1 FROM INFORMATION_SCHEMA.TABLE_STATISTICS WHERE TABLE_SCHEMA LIKE 'test' AND TABLE_NAME LIKE 't1';
SELECT ROWS_CHANGED_X_INDEXES INTO @table_rows_changed_x_indexes_1 FROM INFORMATION_SCHEMA.TABLE_STATISTICS WHERE TABLE_SCHEMA LIKE 'test' AND TABLE_NAME LIKE 't1';
SET innodb_fake_changes=1;
SELECT * FROM t1;
a	b
1	1
INSERT INTO t1 VALUES (2,2);
ERROR HY000: Got error 131 during COMMIT
UPDATE t1 SET a=0 where b=1;
ERROR 23000: Duplicate entry '1' for key 'b'
UPDATE t1 SET b=0 where a=1;
ERROR HY000: Got error 131 during COMMIT
UPDATE t1 SET b=0 where a=2;
ERROR HY000: Got error 131 during COMMIT
DELETE FROM t1 where b=2;
ERROR HY000: Got error 131 during COMMIT
DELETE FROM t1 where b=1;
ERROR HY000: Got error 131 during COMMIT
DELETE FROM t1 where a=2;
ERROR HY000: Got error 131 during COMMIT
DELETE FROM t1 where a=1;
ERROR HY000: Got error 131 during COMMIT
REPLACE INTO t1 values (2,3);
ERROR HY000: Got error 131 during COMMIT
BEGIN;
SELECT * FROM t1;
a	b
1	1
COMMIT;
ERROR HY000: Got error 131 during COMMIT
BEGIN;
INSERT INTO t1 VALUES (2,2);
COMMIT;
ERROR HY000: Got error 131 during COMMIT
BEGIN;
UPDATE t1 SET a=0 where b=1;
ERROR 23000: Duplicate entry '1' for key 'b'
COMMIT;
ERROR HY000: Got error 131 during COMMIT
BEGIN;
UPDATE t1 SET b=0 where a=1;
COMMIT;
ERROR HY000: Got error 131 during COMMIT
BEGIN;
UPDATE t1 SET b=0 where a=2;
COMMIT;
ERROR HY000: Got error 131 during COMMIT
BEGIN;
DELETE FROM t1 where b=2;
COMMIT;
ERROR HY000: Got error 131 during COMMIT
BEGIN;
DELETE FROM t1 where b=1;
COMMIT;
ERROR HY000: Got error 131 during COMMIT
BEGIN;
DELETE FROM t1 where a=2;
COMMIT;
ERROR HY000: Got error 131 during COMMIT
BEGIN;
DELETE FROM t1 where a=1;
COMMIT;
ERROR HY000: Got error 131 during COMMIT
BEGIN;
REPLACE INTO t1 values (2,3);
COMMIT;
ERROR HY000: Got error 131 during COMMIT
INSERT INTO t1 VALUES (1,1) ON DUPLICATE KEY UPDATE b=2;
ERROR HY000: Got error 131 during COMMIT
CREATE INDEX bx ON t1(b);
ERROR HY000: Got error 131 during COMMIT
SET innodb_fake_changes=0;
CHECK TABLE t1;
Table	Op	Msg_type	Msg_text
test.t1	check	status	OK
SELECT VARIABLE_VALUE INTO @innodb_rows_inserted_2 FROM INFORMATION_SCHEMA.GLOBAL_STATUS WHERE VARIABLE_NAME = 'Innodb_rows_inserted';
SELECT VARIABLE_VALUE INTO @innodb_rows_deleted_2 FROM INFORMATION_SCHEMA.GLOBAL_STATUS WHERE VARIABLE_NAME='Innodb_rows_deleted';
SELECT VARIABLE_VALUE INTO @innodb_rows_updated_2 FROM INFORMATION_SCHEMA.GLOBAL_STATUS WHERE VARIABLE_NAME='Innodb_rows_updated';
SELECT ROWS INTO @table_rows_estimate_2 FROM INFORMATION_SCHEMA.INNODB_TABLE_STATS WHERE TABLE_SCHEMA LIKE 'test' AND TABLE_NAME LIKE 't1';
SELECT ROWS_CHANGED INTO @table_rows_changed_2 FROM INFORMATION_SCHEMA.TABLE_STATISTICS WHERE TABLE_SCHEMA LIKE 'test' AND TABLE_NAME LIKE 't1';
SELECT ROWS_CHANGED_X_INDEXES INTO @table_rows_changed_x_indexes_2 FROM INFORMATION_SCHEMA.TABLE_STATISTICS WHERE TABLE_SCHEMA LIKE 'test' AND TABLE_NAME LIKE 't1';
should_be_1
1
SELECT @innodb_rows_inserted_2 - @innodb_rows_inserted_1 AS should_be_0;
should_be_0
0
SELECT @innodb_rows_deleted_2 - @innodb_rows_deleted_1 AS should_be_0;
should_be_0
0
SELECT @innodb_rows_updated_2 - @innodb_rows_updated_1 AS should_be_0;
should_be_0
0
SELECT @table_rows_estimate_2 - @table_rows_estimate_1 AS should_be_0;
should_be_0
0
SELECT @table_rows_changed_2 - @table_rows_changed_1 AS should_be_0;
should_be_0
0
SELECT @table_rows_changed_x_indexes_2 - @table_rows_changed_x_indexes_1 AS should_be_0;
should_be_0
0
DROP TABLE t1;
CREATE TABLE t2 (a INT PRIMARY KEY, b INT) ENGINE=InnoDB;
INSERT INTO t2 VALUES (1, 1);
SELECT @@global.userstat = 1 AS should_be_1;
should_be_1
1
SELECT VARIABLE_VALUE INTO @innodb_rows_inserted_1 FROM INFORMATION_SCHEMA.GLOBAL_STATUS WHERE VARIABLE_NAME = 'Innodb_rows_inserted';
SELECT VARIABLE_VALUE INTO @innodb_rows_deleted_1 FROM INFORMATION_SCHEMA.GLOBAL_STATUS WHERE VARIABLE_NAME = 'Innodb_rows_deleted';
SELECT VARIABLE_VALUE INTO @innodb_rows_updated_1 FROM INFORMATION_SCHEMA.GLOBAL_STATUS WHERE VARIABLE_NAME = 'Innodb_rows_updated';
SELECT ROWS INTO @table_rows_estimate_1 FROM INFORMATION_SCHEMA.INNODB_TABLE_STATS WHERE TABLE_SCHEMA LIKE 'test' AND TABLE_NAME LIKE 't2';
SELECT ROWS_CHANGED INTO @table_rows_changed_1 FROM INFORMATION_SCHEMA.TABLE_STATISTICS WHERE TABLE_SCHEMA LIKE 'test' AND TABLE_NAME LIKE 't2';
SELECT ROWS_CHANGED_X_INDEXES INTO @table_rows_changed_x_indexes_1 FROM INFORMATION_SCHEMA.TABLE_STATISTICS WHERE TABLE_SCHEMA LIKE 'test' AND TABLE_NAME LIKE 't2';
SET innodb_fake_changes=1;
SELECT * FROM t2;
a	b
1	1
INSERT INTO t2 VALUES (2,2);
ERROR HY000: Got error 131 during COMMIT
UPDATE t2 SET b=0 where a=1;
ERROR HY000: Got error 131 during COMMIT
UPDATE t2 SET b=0 where a=2;
ERROR HY000: Got error 131 during COMMIT
DELETE FROM t2 where b=2;
ERROR HY000: Got error 131 during COMMIT
DELETE FROM t2 where b=1;
ERROR HY000: Got error 131 during COMMIT
DELETE FROM t2 where a=2;
ERROR HY000: Got error 131 during COMMIT
DELETE FROM t2 where a=1;
ERROR HY000: Got error 131 during COMMIT
REPLACE INTO t2 values (2,3);
ERROR HY000: Got error 131 during COMMIT
REPLACE INTO t2 VALUES (1,1);
ERROR HY000: Got error 131 during COMMIT
REPLACE INTO t2 VALUES (1,2);
ERROR HY000: Got error 131 during COMMIT
BEGIN;
SELECT * FROM t2;
a	b
1	1
COMMIT;
ERROR HY000: Got error 131 during COMMIT
BEGIN;
INSERT INTO t2 VALUES (2,2);
COMMIT;
ERROR HY000: Got error 131 during COMMIT
BEGIN;
UPDATE t2 SET b=0 where a=1;
COMMIT;
ERROR HY000: Got error 131 during COMMIT
BEGIN;
UPDATE t2 SET b=0 where a=2;
COMMIT;
ERROR HY000: Got error 131 during COMMIT
BEGIN;
DELETE FROM t2 where b=2;
COMMIT;
ERROR HY000: Got error 131 during COMMIT
BEGIN;
DELETE FROM t2 where b=1;
COMMIT;
ERROR HY000: Got error 131 during COMMIT
BEGIN;
DELETE FROM t2 where a=2;
COMMIT;
ERROR HY000: Got error 131 during COMMIT
BEGIN;
DELETE FROM t2 where a=1;
COMMIT;
ERROR HY000: Got error 131 during COMMIT
BEGIN;
REPLACE INTO t2 values (2,3);
COMMIT;
ERROR HY000: Got error 131 during COMMIT
BEGIN;
REPLACE INTO t2 VALUES (1,1);
COMMIT;
ERROR HY000: Got error 131 during COMMIT
BEGIN;
REPLACE INTO t2 VALUES (1,2);
COMMIT;
ERROR HY000: Got error 131 during COMMIT
BEGIN;
REPLACE INTO t2 VALUES (1,2);
SELECT * from t2;
a	b
1	1
REPLACE INTO t2 VALUES (1,1);
SELECT * from t2;
a	b
1	1
ROLLBACK;
BEGIN;
INSERT INTO t2 VALUES (1,1);
ERROR 23000: Duplicate entry '1' for key 'PRIMARY'
INSERT INTO t2 VALUES (1,2);
ERROR 23000: Duplicate entry '1' for key 'PRIMARY'
ROLLBACK;
INSERT INTO t2 VALUES (1,1) ON DUPLICATE KEY UPDATE b=2;
ERROR HY000: Got error 131 during COMMIT
INSERT INTO t2 VALUES (1,1) ON DUPLICATE KEY UPDATE b=b+10;
ERROR HY000: Got error 131 during COMMIT
INSERT INTO t2 VALUES (1,2) ON DUPLICATE KEY UPDATE b=b+10;
ERROR HY000: Got error 131 during COMMIT
CREATE INDEX bx ON t2(b);
ERROR HY000: Got error 131 during COMMIT
SET innodb_fake_changes=0;
CHECK TABLE t2;
Table	Op	Msg_type	Msg_text
test.t2	check	status	OK
SELECT VARIABLE_VALUE INTO @innodb_rows_inserted_2 FROM INFORMATION_SCHEMA.GLOBAL_STATUS WHERE VARIABLE_NAME = 'Innodb_rows_inserted';
SELECT VARIABLE_VALUE INTO @innodb_rows_deleted_2 FROM INFORMATION_SCHEMA.GLOBAL_STATUS WHERE VARIABLE_NAME='Innodb_rows_deleted';
SELECT VARIABLE_VALUE INTO @innodb_rows_updated_2 FROM INFORMATION_SCHEMA.GLOBAL_STATUS WHERE VARIABLE_NAME='Innodb_rows_updated';
SELECT ROWS INTO @table_rows_estimate_2 FROM INFORMATION_SCHEMA.INNODB_TABLE_STATS WHERE TABLE_SCHEMA LIKE 'test' AND TABLE_NAME LIKE 't2';
SELECT ROWS_CHANGED INTO @table_rows_changed_2 FROM INFORMATION_SCHEMA.TABLE_STATISTICS WHERE TABLE_SCHEMA LIKE 'test' AND TABLE_NAME LIKE 't2';
SELECT ROWS_CHANGED_X_INDEXES INTO @table_rows_changed_x_indexes_2 FROM INFORMATION_SCHEMA.TABLE_STATISTICS WHERE TABLE_SCHEMA LIKE 'test' AND TABLE_NAME LIKE 't2';
should_be_1
1
SELECT @innodb_rows_inserted_2 - @innodb_rows_inserted_1 AS should_be_0;
should_be_0
0
SELECT @innodb_rows_deleted_2 - @innodb_rows_deleted_1 AS should_be_0;
should_be_0
0
SELECT @innodb_rows_updated_2 - @innodb_rows_updated_1 AS should_be_0;
should_be_0
0
SELECT @table_rows_estimate_2 - @table_rows_estimate_1 AS should_be_0;
should_be_0
0
SELECT @table_rows_changed_2 - @table_rows_changed_1 AS should_be_0;
should_be_0
0
SELECT @table_rows_changed_x_indexes_2 - @table_rows_changed_x_indexes_1 AS should_be_0;
should_be_0
0
DROP TABLE t2;
CREATE TABLE t3 (a INT PRIMARY KEY, B TEXT) ENGINE=InnoDB;
INSERT INTO t3 VALUES (1, '');
SELECT @@global.userstat = 1 AS should_be_1;
should_be_1
1
SELECT VARIABLE_VALUE INTO @innodb_rows_inserted_1 FROM INFORMATION_SCHEMA.GLOBAL_STATUS WHERE VARIABLE_NAME = 'Innodb_rows_inserted';
SELECT VARIABLE_VALUE INTO @innodb_rows_deleted_1 FROM INFORMATION_SCHEMA.GLOBAL_STATUS WHERE VARIABLE_NAME = 'Innodb_rows_deleted';
SELECT VARIABLE_VALUE INTO @innodb_rows_updated_1 FROM INFORMATION_SCHEMA.GLOBAL_STATUS WHERE VARIABLE_NAME = 'Innodb_rows_updated';
SELECT ROWS INTO @table_rows_estimate_1 FROM INFORMATION_SCHEMA.INNODB_TABLE_STATS WHERE TABLE_SCHEMA LIKE 'test' AND TABLE_NAME LIKE 't3';
SELECT ROWS_CHANGED INTO @table_rows_changed_1 FROM INFORMATION_SCHEMA.TABLE_STATISTICS WHERE TABLE_SCHEMA LIKE 'test' AND TABLE_NAME LIKE 't3';
SELECT ROWS_CHANGED_X_INDEXES INTO @table_rows_changed_x_indexes_1 FROM INFORMATION_SCHEMA.TABLE_STATISTICS WHERE TABLE_SCHEMA LIKE 'test' AND TABLE_NAME LIKE 't3';
SET innodb_fake_changes=1;
SELECT * FROM t3;
a	B
1	
INSERT INTO t3 VALUES (2,lpad('a',10000, 'b'));
ERROR HY000: Got error 131 during COMMIT
UPDATE t3 SET a=0 where a=1;
ERROR HY000: Got error 131 during COMMIT
DELETE FROM t3 where a=2;
ERROR HY000: Got error 131 during COMMIT
DELETE FROM t3 where a=1;
ERROR HY000: Got error 131 during COMMIT
REPLACE INTO t3 values (2,lpad('a',9000,'q'));
ERROR HY000: Got error 131 during COMMIT
INSERT INTO t3 VALUES (1,1) ON DUPLICATE KEY UPDATE b=lpad('b',11000,'c');
ERROR HY000: Got error 131 during COMMIT
BEGIN;
SELECT * FROM t3;
a	B
1	
COMMIT;
ERROR HY000: Got error 131 during COMMIT
BEGIN;
INSERT INTO t3 VALUES (2,lpad('a',10000, 'b'));
COMMIT;
ERROR HY000: Got error 131 during COMMIT
BEGIN;
UPDATE t3 SET a=0 where a=1;
COMMIT;
ERROR HY000: Got error 131 during COMMIT
BEGIN;
DELETE FROM t3 where a=2;
COMMIT;
ERROR HY000: Got error 131 during COMMIT
BEGIN;
DELETE FROM t3 where a=1;
COMMIT;
ERROR HY000: Got error 131 during COMMIT
BEGIN;
REPLACE INTO t3 values (2,lpad('a',9000,'q'));
COMMIT;
ERROR HY000: Got error 131 during COMMIT
BEGIN;
INSERT INTO t3 VALUES (1,1) ON DUPLICATE KEY UPDATE b=lpad('b',11000,'c');
COMMIT;
ERROR HY000: Got error 131 during COMMIT
SET innodb_fake_changes=0;
CHECK TABLE t3;
Table	Op	Msg_type	Msg_text
test.t3	check	status	OK
SELECT VARIABLE_VALUE INTO @innodb_rows_inserted_2 FROM INFORMATION_SCHEMA.GLOBAL_STATUS WHERE VARIABLE_NAME = 'Innodb_rows_inserted';
SELECT VARIABLE_VALUE INTO @innodb_rows_deleted_2 FROM INFORMATION_SCHEMA.GLOBAL_STATUS WHERE VARIABLE_NAME='Innodb_rows_deleted';
SELECT VARIABLE_VALUE INTO @innodb_rows_updated_2 FROM INFORMATION_SCHEMA.GLOBAL_STATUS WHERE VARIABLE_NAME='Innodb_rows_updated';
SELECT ROWS INTO @table_rows_estimate_2 FROM INFORMATION_SCHEMA.INNODB_TABLE_STATS WHERE TABLE_SCHEMA LIKE 'test' AND TABLE_NAME LIKE 't3';
SELECT ROWS_CHANGED INTO @table_rows_changed_2 FROM INFORMATION_SCHEMA.TABLE_STATISTICS WHERE TABLE_SCHEMA LIKE 'test' AND TABLE_NAME LIKE 't3';
SELECT ROWS_CHANGED_X_INDEXES INTO @table_rows_changed_x_indexes_2 FROM INFORMATION_SCHEMA.TABLE_STATISTICS WHERE TABLE_SCHEMA LIKE 'test' AND TABLE_NAME LIKE 't3';
should_be_1
1
SELECT @innodb_rows_inserted_2 - @innodb_rows_inserted_1 AS should_be_0;
should_be_0
0
SELECT @innodb_rows_deleted_2 - @innodb_rows_deleted_1 AS should_be_0;
should_be_0
0
SELECT @innodb_rows_updated_2 - @innodb_rows_updated_1 AS should_be_0;
should_be_0
0
SELECT @table_rows_estimate_2 - @table_rows_estimate_1 AS should_be_0;
should_be_0
0
SELECT @table_rows_changed_2 - @table_rows_changed_1 AS should_be_0;
should_be_0
0
SELECT @table_rows_changed_x_indexes_2 - @table_rows_changed_x_indexes_1 AS should_be_0;
should_be_0
0
DROP TABLE t3;
# DDL must result in error
CREATE TABLE t1 (a INT PRIMARY KEY) ENGINE=InnoDB;
SELECT @@global.userstat = 1 AS should_be_1;
should_be_1
1
SELECT VARIABLE_VALUE INTO @innodb_rows_inserted_1 FROM INFORMATION_SCHEMA.GLOBAL_STATUS WHERE VARIABLE_NAME = 'Innodb_rows_inserted';
SELECT VARIABLE_VALUE INTO @innodb_rows_deleted_1 FROM INFORMATION_SCHEMA.GLOBAL_STATUS WHERE VARIABLE_NAME = 'Innodb_rows_deleted';
SELECT VARIABLE_VALUE INTO @innodb_rows_updated_1 FROM INFORMATION_SCHEMA.GLOBAL_STATUS WHERE VARIABLE_NAME = 'Innodb_rows_updated';
SELECT ROWS INTO @table_rows_estimate_1 FROM INFORMATION_SCHEMA.INNODB_TABLE_STATS WHERE TABLE_SCHEMA LIKE 'test' AND TABLE_NAME LIKE 't1';
SELECT ROWS_CHANGED INTO @table_rows_changed_1 FROM INFORMATION_SCHEMA.TABLE_STATISTICS WHERE TABLE_SCHEMA LIKE 'test' AND TABLE_NAME LIKE 't1';
SELECT ROWS_CHANGED_X_INDEXES INTO @table_rows_changed_x_indexes_1 FROM INFORMATION_SCHEMA.TABLE_STATISTICS WHERE TABLE_SCHEMA LIKE 'test' AND TABLE_NAME LIKE 't1';
SET innodb_fake_changes=1;
BEGIN;
CREATE TABLE t2 (a INT) ENGINE=InnoDB;
ERROR HY000: Can't create table 'test.t2' (errno: 131)
DROP TABLE t1;
ERROR 42S02: Unknown table 't1'
TRUNCATE TABLE t1;
ERROR HY000: Table storage engine for 't1' doesn't have this option
ALTER TABLE t1 ENGINE=MyISAM;
ERROR HY000: Got error 131 during COMMIT
ROLLBACK;
SET innodb_fake_changes=0;
CHECK TABLE t1;
Table	Op	Msg_type	Msg_text
test.t1	check	status	OK
SELECT VARIABLE_VALUE INTO @innodb_rows_inserted_2 FROM INFORMATION_SCHEMA.GLOBAL_STATUS WHERE VARIABLE_NAME = 'Innodb_rows_inserted';
SELECT VARIABLE_VALUE INTO @innodb_rows_deleted_2 FROM INFORMATION_SCHEMA.GLOBAL_STATUS WHERE VARIABLE_NAME='Innodb_rows_deleted';
SELECT VARIABLE_VALUE INTO @innodb_rows_updated_2 FROM INFORMATION_SCHEMA.GLOBAL_STATUS WHERE VARIABLE_NAME='Innodb_rows_updated';
SELECT ROWS INTO @table_rows_estimate_2 FROM INFORMATION_SCHEMA.INNODB_TABLE_STATS WHERE TABLE_SCHEMA LIKE 'test' AND TABLE_NAME LIKE 't1';
SELECT ROWS_CHANGED INTO @table_rows_changed_2 FROM INFORMATION_SCHEMA.TABLE_STATISTICS WHERE TABLE_SCHEMA LIKE 'test' AND TABLE_NAME LIKE 't1';
SELECT ROWS_CHANGED_X_INDEXES INTO @table_rows_changed_x_indexes_2 FROM INFORMATION_SCHEMA.TABLE_STATISTICS WHERE TABLE_SCHEMA LIKE 'test' AND TABLE_NAME LIKE 't1';
should_be_1
1
SELECT @innodb_rows_inserted_2 - @innodb_rows_inserted_1 AS should_be_0;
should_be_0
0
SELECT @innodb_rows_deleted_2 - @innodb_rows_deleted_1 AS should_be_0;
should_be_0
0
SELECT @innodb_rows_updated_2 - @innodb_rows_updated_1 AS should_be_0;
should_be_0
0
SELECT @table_rows_estimate_2 - @table_rows_estimate_1 AS should_be_0;
should_be_0
0
SELECT @table_rows_changed_2 - @table_rows_changed_1 AS should_be_0;
should_be_0
0
SELECT @table_rows_changed_x_indexes_2 - @table_rows_changed_x_indexes_1 AS should_be_0;
should_be_0
0
INSERT INTO t1 VALUES (1), (2);
CREATE TABLE t2 (a INT PRIMARY KEY, b INT, INDEX b_ind (b),
FOREIGN KEY (b) REFERENCES t1(a) ON DELETE CASCADE ON UPDATE CASCADE) ENGINE=InnoDB;
INSERT INTO t2 VALUES (1, 1);
INSERT INTO t2 VALUES (2, 2);
SELECT @@global.userstat = 1 AS should_be_1;
should_be_1
1
SELECT VARIABLE_VALUE INTO @innodb_rows_inserted_1 FROM INFORMATION_SCHEMA.GLOBAL_STATUS WHERE VARIABLE_NAME = 'Innodb_rows_inserted';
SELECT VARIABLE_VALUE INTO @innodb_rows_deleted_1 FROM INFORMATION_SCHEMA.GLOBAL_STATUS WHERE VARIABLE_NAME = 'Innodb_rows_deleted';
SELECT VARIABLE_VALUE INTO @innodb_rows_updated_1 FROM INFORMATION_SCHEMA.GLOBAL_STATUS WHERE VARIABLE_NAME = 'Innodb_rows_updated';
SELECT ROWS INTO @table_rows_estimate_1 FROM INFORMATION_SCHEMA.INNODB_TABLE_STATS WHERE TABLE_SCHEMA LIKE 'test' AND TABLE_NAME LIKE 't1';
SELECT ROWS_CHANGED INTO @table_rows_changed_1 FROM INFORMATION_SCHEMA.TABLE_STATISTICS WHERE TABLE_SCHEMA LIKE 'test' AND TABLE_NAME LIKE 't1';
SELECT ROWS_CHANGED_X_INDEXES INTO @table_rows_changed_x_indexes_1 FROM INFORMATION_SCHEMA.TABLE_STATISTICS WHERE TABLE_SCHEMA LIKE 'test' AND TABLE_NAME LIKE 't1';
SET innodb_fake_changes=1;
BEGIN;
DELETE FROM t1 WHERE a=1;
UPDATE t1 SET a=3 WHERE a=2;
COMMIT;
ERROR HY000: Got error 131 during COMMIT
SET innodb_fake_changes=0;
CHECK TABLE t1;
Table	Op	Msg_type	Msg_text
test.t1	check	status	OK
SELECT VARIABLE_VALUE INTO @innodb_rows_inserted_2 FROM INFORMATION_SCHEMA.GLOBAL_STATUS WHERE VARIABLE_NAME = 'Innodb_rows_inserted';
SELECT VARIABLE_VALUE INTO @innodb_rows_deleted_2 FROM INFORMATION_SCHEMA.GLOBAL_STATUS WHERE VARIABLE_NAME='Innodb_rows_deleted';
SELECT VARIABLE_VALUE INTO @innodb_rows_updated_2 FROM INFORMATION_SCHEMA.GLOBAL_STATUS WHERE VARIABLE_NAME='Innodb_rows_updated';
SELECT ROWS INTO @table_rows_estimate_2 FROM INFORMATION_SCHEMA.INNODB_TABLE_STATS WHERE TABLE_SCHEMA LIKE 'test' AND TABLE_NAME LIKE 't1';
SELECT ROWS_CHANGED INTO @table_rows_changed_2 FROM INFORMATION_SCHEMA.TABLE_STATISTICS WHERE TABLE_SCHEMA LIKE 'test' AND TABLE_NAME LIKE 't1';
SELECT ROWS_CHANGED_X_INDEXES INTO @table_rows_changed_x_indexes_2 FROM INFORMATION_SCHEMA.TABLE_STATISTICS WHERE TABLE_SCHEMA LIKE 'test' AND TABLE_NAME LIKE 't1';
should_be_1
1
SELECT @innodb_rows_inserted_2 - @innodb_rows_inserted_1 AS should_be_0;
should_be_0
0
SELECT @innodb_rows_deleted_2 - @innodb_rows_deleted_1 AS should_be_0;
should_be_0
0
SELECT @innodb_rows_updated_2 - @innodb_rows_updated_1 AS should_be_0;
should_be_0
0
SELECT @table_rows_estimate_2 - @table_rows_estimate_1 AS should_be_0;
should_be_0
0
SELECT @table_rows_changed_2 - @table_rows_changed_1 AS should_be_0;
should_be_0
0
SELECT @table_rows_changed_x_indexes_2 - @table_rows_changed_x_indexes_1 AS should_be_0;
should_be_0
0
DROP TABLE t2;
CREATE TABLE t3 (a INT primary key, b text) ENGINE=InnoDB;
INSERT INTO t3 VALUES (1,'');
SELECT @@global.userstat = 1 AS should_be_1;
should_be_1
1
SELECT VARIABLE_VALUE INTO @innodb_rows_inserted_1 FROM INFORMATION_SCHEMA.GLOBAL_STATUS WHERE VARIABLE_NAME = 'Innodb_rows_inserted';
SELECT VARIABLE_VALUE INTO @innodb_rows_deleted_1 FROM INFORMATION_SCHEMA.GLOBAL_STATUS WHERE VARIABLE_NAME = 'Innodb_rows_deleted';
SELECT VARIABLE_VALUE INTO @innodb_rows_updated_1 FROM INFORMATION_SCHEMA.GLOBAL_STATUS WHERE VARIABLE_NAME = 'Innodb_rows_updated';
SELECT ROWS INTO @table_rows_estimate_1 FROM INFORMATION_SCHEMA.INNODB_TABLE_STATS WHERE TABLE_SCHEMA LIKE 'test' AND TABLE_NAME LIKE 't3';
SELECT ROWS_CHANGED INTO @table_rows_changed_1 FROM INFORMATION_SCHEMA.TABLE_STATISTICS WHERE TABLE_SCHEMA LIKE 'test' AND TABLE_NAME LIKE 't3';
SELECT ROWS_CHANGED_X_INDEXES INTO @table_rows_changed_x_indexes_1 FROM INFORMATION_SCHEMA.TABLE_STATISTICS WHERE TABLE_SCHEMA LIKE 'test' AND TABLE_NAME LIKE 't3';
SET innodb_fake_changes=1;
BEGIN;
UPDATE t3 set b=lpad('b',11000,'c') where a=1;
COMMIT;
ERROR HY000: Got error 131 during COMMIT
SET innodb_fake_changes=0;
CHECK TABLE t3;
Table	Op	Msg_type	Msg_text
test.t3	check	status	OK
SELECT VARIABLE_VALUE INTO @innodb_rows_inserted_2 FROM INFORMATION_SCHEMA.GLOBAL_STATUS WHERE VARIABLE_NAME = 'Innodb_rows_inserted';
SELECT VARIABLE_VALUE INTO @innodb_rows_deleted_2 FROM INFORMATION_SCHEMA.GLOBAL_STATUS WHERE VARIABLE_NAME='Innodb_rows_deleted';
SELECT VARIABLE_VALUE INTO @innodb_rows_updated_2 FROM INFORMATION_SCHEMA.GLOBAL_STATUS WHERE VARIABLE_NAME='Innodb_rows_updated';
SELECT ROWS INTO @table_rows_estimate_2 FROM INFORMATION_SCHEMA.INNODB_TABLE_STATS WHERE TABLE_SCHEMA LIKE 'test' AND TABLE_NAME LIKE 't3';
SELECT ROWS_CHANGED INTO @table_rows_changed_2 FROM INFORMATION_SCHEMA.TABLE_STATISTICS WHERE TABLE_SCHEMA LIKE 'test' AND TABLE_NAME LIKE 't3';
SELECT ROWS_CHANGED_X_INDEXES INTO @table_rows_changed_x_indexes_2 FROM INFORMATION_SCHEMA.TABLE_STATISTICS WHERE TABLE_SCHEMA LIKE 'test' AND TABLE_NAME LIKE 't3';
should_be_1
1
SELECT @innodb_rows_inserted_2 - @innodb_rows_inserted_1 AS should_be_0;
should_be_0
0
SELECT @innodb_rows_deleted_2 - @innodb_rows_deleted_1 AS should_be_0;
should_be_0
0
SELECT @innodb_rows_updated_2 - @innodb_rows_updated_1 AS should_be_0;
should_be_0
0
SELECT @table_rows_estimate_2 - @table_rows_estimate_1 AS should_be_0;
should_be_0
0
SELECT @table_rows_changed_2 - @table_rows_changed_1 AS should_be_0;
should_be_0
0
SELECT @table_rows_changed_x_indexes_2 - @table_rows_changed_x_indexes_1 AS should_be_0;
should_be_0
0
DROP TABLE t1, t3;
use test;
create table t1 (a int, primary key pk(a));
alter table t1 add column b char;
create index bx on t1(b);
insert into t1 values (1, 0x41), (2, 0x41);
set innodb_fake_changes=1;
update t1 set a = upper(a), b = lower(b);
ERROR HY000: Got error 131 during COMMIT
set innodb_fake_changes=0;
drop table t1;
use test;
create table t1 (c1 int);
insert into t1 values (10);
select * from t1;
c1
10
set innodb_fake_changes = 1;
begin;
insert into t1 values (10);
select * from t1;
c1
10
set innodb_fake_changes = 0;
replace into t1(c1) values (10);
commit;
ERROR HY000: Got error 131 during COMMIT
select * from t1;
c1
10
begin;
insert into t1 values (11);
insert into t1 values (12);
set innodb_fake_changes = 1;
commit;
set innodb_fake_changes = 0;
select * from t1;
c1
10
11
12
begin;
set innodb_fake_changes = 1;
insert into t1 values (11);
insert into t1 values (12);
commit;
ERROR HY000: Got error 131 during COMMIT
set innodb_fake_changes = 0;
drop table t1;
use test;
create table t1 (i int) engine=innodb;
rename table t1 to t2;
select * from t2;
i
set innodb_fake_changes = 1;
rename table t2 to t1;
ERROR 42000: This version of MySQL doesn't yet support 'ALTER TABLE'
set innodb_fake_changes = 0;
drop table t2;
create table t1 (i int) engine=innodb;
insert into t1 values (1), (2);
set session innodb_fake_changes = 1;
select * from t1;
i
1
2
set @@session.default_storage_engine=innodb;
create table t3 select * from t1;
ERROR HY000: Can't create table 'test.t3' (errno: 131)
set @@session.default_storage_engine=myisam;
create table t2 select * from t1;
show create table t2;
Table	Create Table
t2	CREATE TABLE `t2` (
  `i` int(11) DEFAULT NULL
) ENGINE=MyISAM DEFAULT CHARSET=latin1
select * from t2;
i
1
2
drop table t2;
set session innodb_fake_changes = 0;
set @@session.default_storage_engine=InnoDB;
drop table t1;
use test;
create table t1 (i int, j int) engine=innodb;
insert into t1 values (1, 10), (2, 20), (3, 30);
select * from t1;
i	j
1	10
2	20
3	30
set session innodb_fake_changes = 1;
select * from t1;
i	j
1	10
2	20
3	30
begin;
select * from t1;
i	j
1	10
2	20
3	30
commit;
ERROR HY000: Got error 131 during COMMIT
insert into t1 select * from t1;
ERROR HY000: Got error 131 during COMMIT
select * from t1;
i	j
1	10
2	20
3	30
set session innodb_fake_changes = 0;
drop table t1;
SET @@GLOBAL.userstat= default;
