DROP TABLE IF EXISTS t1;
SET @@GLOBAL.userstat=ON;
SET @@GLOBAL.innodb_stats_transient_sample_pages=30000;
Test compressed
CREATE TABLE t1 (id INT PRIMARY KEY AUTO_INCREMENT, v VARCHAR(200), t TEXT) ENGINE=INNODB KEY_BLOCK_SIZE=8;
INSERT INTO t1 VALUES(NULL, LPAD("v", 2, "b"), LPAD("a", 100, "b"));
SELECT @@global.userstat = 1 AS should_be_1;
should_be_1
1
SELECT @@global.innodb_stats_transient_sample_pages = 30000 AS should_be_1;
should_be_1
1
ANALYZE TABLE t1;
Table	Op	Msg_type	Msg_text
test.t1	analyze	status	OK
SELECT VARIABLE_VALUE INTO @innodb_rows_inserted_1 FROM INFORMATION_SCHEMA.GLOBAL_STATUS WHERE VARIABLE_NAME = 'Innodb_rows_inserted';
SELECT VARIABLE_VALUE INTO @innodb_rows_deleted_1 FROM INFORMATION_SCHEMA.GLOBAL_STATUS WHERE VARIABLE_NAME = 'Innodb_rows_deleted';
SELECT VARIABLE_VALUE INTO @innodb_rows_updated_1 FROM INFORMATION_SCHEMA.GLOBAL_STATUS WHERE VARIABLE_NAME = 'Innodb_rows_updated';
SELECT NUM_ROWS INTO @table_rows_estimate_1 FROM INFORMATION_SCHEMA.INNODB_SYS_TABLESTATS WHERE NAME LIKE 'test/t1';
SELECT ROWS_CHANGED INTO @table_rows_changed_1 FROM INFORMATION_SCHEMA.TABLE_STATISTICS WHERE TABLE_SCHEMA LIKE 'test' AND TABLE_NAME LIKE 't1';
SELECT ROWS_CHANGED_X_INDEXES INTO @table_rows_changed_x_indexes_1 FROM INFORMATION_SCHEMA.TABLE_STATISTICS WHERE TABLE_SCHEMA LIKE 'test' AND TABLE_NAME LIKE 't1';
SELECT MODIFIED_COUNTER INTO @table_dml_counter_1 FROM INFORMATION_SCHEMA.INNODB_SYS_TABLESTATS WHERE NAME LIKE 'test/t1';
SHOW INDEXES IN t1;
Table	Non_unique	Key_name	Seq_in_index	Column_name	Collation	Cardinality	Sub_part	Packed	Null	Index_type	Comment	Index_comment
t1	0	PRIMARY	1	id	A	1	NULL	NULL		BTREE		
SET innodb_fake_changes=1;
INSERT INTO t1 VALUES(1, "foo", LPAD("a", 4600, "b")) ON DUPLICATE KEY UPDATE T = VALUES(T);
ERROR HY000: Got error 131 during COMMIT
UPDATE t1 SET T = LPAD("A", 4600, "b");
ERROR HY000: Got error 131 during COMMIT
SET innodb_fake_changes=0;
CHECK TABLE t1;
Table	Op	Msg_type	Msg_text
test.t1	check	status	OK
SELECT VARIABLE_VALUE INTO @innodb_rows_inserted_2 FROM INFORMATION_SCHEMA.GLOBAL_STATUS WHERE VARIABLE_NAME = 'Innodb_rows_inserted';
SELECT VARIABLE_VALUE INTO @innodb_rows_deleted_2 FROM INFORMATION_SCHEMA.GLOBAL_STATUS WHERE VARIABLE_NAME='Innodb_rows_deleted';
SELECT VARIABLE_VALUE INTO @innodb_rows_updated_2 FROM INFORMATION_SCHEMA.GLOBAL_STATUS WHERE VARIABLE_NAME='Innodb_rows_updated';
SELECT NUM_ROWS INTO @table_rows_estimate_2 FROM INFORMATION_SCHEMA.INNODB_SYS_TABLESTATS WHERE NAME LIKE 'test/t1';
SELECT ROWS_CHANGED INTO @table_rows_changed_2 FROM INFORMATION_SCHEMA.TABLE_STATISTICS WHERE TABLE_SCHEMA LIKE 'test' AND TABLE_NAME LIKE 't1';
SELECT ROWS_CHANGED_X_INDEXES INTO @table_rows_changed_x_indexes_2 FROM INFORMATION_SCHEMA.TABLE_STATISTICS WHERE TABLE_SCHEMA LIKE 'test' AND TABLE_NAME LIKE 't1';
SELECT MODIFIED_COUNTER INTO @table_dml_counter_2 FROM INFORMATION_SCHEMA.INNODB_SYS_TABLESTATS WHERE NAME LIKE 'test/t1';
should_be_1
1
SELECT @innodb_rows_inserted_2 - @innodb_rows_inserted_1 AS should_be_0;
should_be_0
0
SELECT @innodb_rows_deleted_2 - @innodb_rows_deleted_1 AS should_be_0;
should_be_0
0
SELECT @innodb_rows_updated_2 - @innodb_rows_updated_1 AS should_be_0;
should_be_0
0
SELECT @table_rows_estimate_2 - @table_rows_estimate_1 AS should_be_0;
should_be_0
0
SELECT @table_rows_changed_2 - @table_rows_changed_1 AS should_be_0;
should_be_0
0
SELECT @table_rows_changed_x_indexes_2 - @table_rows_changed_x_indexes_1 AS should_be_0;
should_be_0
0
SELECT @table_dml_counter_2 - @table_dml_counter_1 AS should_be_0;
should_be_0
0
SHOW INDEXES IN t1;
Table	Non_unique	Key_name	Seq_in_index	Column_name	Collation	Cardinality	Sub_part	Packed	Null	Index_type	Comment	Index_comment
t1	0	PRIMARY	1	id	A	1	NULL	NULL		BTREE		
DROP TABLE t1;
Test for uncompressed
CREATE TABLE t1 (id INT PRIMARY KEY AUTO_INCREMENT, v VARCHAR(200), t TEXT) ENGINE=INNODB;
INSERT INTO t1 VALUES(NULL, LPAD("v", 2, "b"), LPAD("a", 100, "b"));
SELECT @@global.userstat = 1 AS should_be_1;
should_be_1
1
SELECT @@global.innodb_stats_transient_sample_pages = 30000 AS should_be_1;
should_be_1
1
ANALYZE TABLE t1;
Table	Op	Msg_type	Msg_text
test.t1	analyze	status	OK
SELECT VARIABLE_VALUE INTO @innodb_rows_inserted_1 FROM INFORMATION_SCHEMA.GLOBAL_STATUS WHERE VARIABLE_NAME = 'Innodb_rows_inserted';
SELECT VARIABLE_VALUE INTO @innodb_rows_deleted_1 FROM INFORMATION_SCHEMA.GLOBAL_STATUS WHERE VARIABLE_NAME = 'Innodb_rows_deleted';
SELECT VARIABLE_VALUE INTO @innodb_rows_updated_1 FROM INFORMATION_SCHEMA.GLOBAL_STATUS WHERE VARIABLE_NAME = 'Innodb_rows_updated';
SELECT NUM_ROWS INTO @table_rows_estimate_1 FROM INFORMATION_SCHEMA.INNODB_SYS_TABLESTATS WHERE NAME LIKE 'test/t1';
SELECT ROWS_CHANGED INTO @table_rows_changed_1 FROM INFORMATION_SCHEMA.TABLE_STATISTICS WHERE TABLE_SCHEMA LIKE 'test' AND TABLE_NAME LIKE 't1';
SELECT ROWS_CHANGED_X_INDEXES INTO @table_rows_changed_x_indexes_1 FROM INFORMATION_SCHEMA.TABLE_STATISTICS WHERE TABLE_SCHEMA LIKE 'test' AND TABLE_NAME LIKE 't1';
SELECT MODIFIED_COUNTER INTO @table_dml_counter_1 FROM INFORMATION_SCHEMA.INNODB_SYS_TABLESTATS WHERE NAME LIKE 'test/t1';
SHOW INDEXES IN t1;
Table	Non_unique	Key_name	Seq_in_index	Column_name	Collation	Cardinality	Sub_part	Packed	Null	Index_type	Comment	Index_comment
t1	0	PRIMARY	1	id	A	1	NULL	NULL		BTREE		
SET innodb_fake_changes=1;
ERROR HY000: Got error 131 during COMMIT
ERROR HY000: Got error 131 during COMMIT
ERROR HY000: Got error 131 during COMMIT
ERROR HY000: Got error 131 during COMMIT
ERROR HY000: Got error 131 during COMMIT
ERROR HY000: Got error 131 during COMMIT
ERROR HY000: Got error 131 during COMMIT
ERROR HY000: Got error 131 during COMMIT
ERROR HY000: Got error 131 during COMMIT
ERROR HY000: Got error 131 during COMMIT
ERROR HY000: Got error 131 during COMMIT
ERROR HY000: Got error 131 during COMMIT
ERROR HY000: Got error 131 during COMMIT
ERROR HY000: Got error 131 during COMMIT
ERROR HY000: Got error 131 during COMMIT
ERROR HY000: Got error 131 during COMMIT
ERROR HY000: Got error 131 during COMMIT
ERROR HY000: Got error 131 during COMMIT
ERROR HY000: Got error 131 during COMMIT
ERROR HY000: Got error 131 during COMMIT
ERROR HY000: Got error 131 during COMMIT
ERROR HY000: Got error 131 during COMMIT
ERROR HY000: Got error 131 during COMMIT
ERROR HY000: Got error 131 during COMMIT
ERROR HY000: Got error 131 during COMMIT
ERROR HY000: Got error 131 during COMMIT
ERROR HY000: Got error 131 during COMMIT
ERROR HY000: Got error 131 during COMMIT
ERROR HY000: Got error 131 during COMMIT
ERROR HY000: Got error 131 during COMMIT
ERROR HY000: Got error 131 during COMMIT
ERROR HY000: Got error 131 during COMMIT
ERROR HY000: Got error 131 during COMMIT
ERROR HY000: Got error 131 during COMMIT
ERROR HY000: Got error 131 during COMMIT
ERROR HY000: Got error 131 during COMMIT
ERROR HY000: Got error 131 during COMMIT
ERROR HY000: Got error 131 during COMMIT
ERROR HY000: Got error 131 during COMMIT
ERROR HY000: Got error 131 during COMMIT
ERROR HY000: Got error 131 during COMMIT
ERROR HY000: Got error 131 during COMMIT
ERROR HY000: Got error 131 during COMMIT
ERROR HY000: Got error 131 during COMMIT
ERROR HY000: Got error 131 during COMMIT
ERROR HY000: Got error 131 during COMMIT
ERROR HY000: Got error 131 during COMMIT
ERROR HY000: Got error 131 during COMMIT
ERROR HY000: Got error 131 during COMMIT
ERROR HY000: Got error 131 during COMMIT
ERROR HY000: Got error 131 during COMMIT
ERROR HY000: Got error 131 during COMMIT
ERROR HY000: Got error 131 during COMMIT
ERROR HY000: Got error 131 during COMMIT
ERROR HY000: Got error 131 during COMMIT
ERROR HY000: Got error 131 during COMMIT
ERROR HY000: Got error 131 during COMMIT
ERROR HY000: Got error 131 during COMMIT
ERROR HY000: Got error 131 during COMMIT
ERROR HY000: Got error 131 during COMMIT
ERROR HY000: Got error 131 during COMMIT
ERROR HY000: Got error 131 during COMMIT
ERROR HY000: Got error 131 during COMMIT
ERROR HY000: Got error 131 during COMMIT
ERROR HY000: Got error 131 during COMMIT
ERROR HY000: Got error 131 during COMMIT
ERROR HY000: Got error 131 during COMMIT
ERROR HY000: Got error 131 during COMMIT
ERROR HY000: Got error 131 during COMMIT
ERROR HY000: Got error 131 during COMMIT
ERROR HY000: Got error 131 during COMMIT
ERROR HY000: Got error 131 during COMMIT
ERROR HY000: Got error 131 during COMMIT
ERROR HY000: Got error 131 during COMMIT
ERROR HY000: Got error 131 during COMMIT
ERROR HY000: Got error 131 during COMMIT
ERROR HY000: Got error 131 during COMMIT
ERROR HY000: Got error 131 during COMMIT
ERROR HY000: Got error 131 during COMMIT
ERROR HY000: Got error 131 during COMMIT
ERROR HY000: Got error 131 during COMMIT
ERROR HY000: Got error 131 during COMMIT
ERROR HY000: Got error 131 during COMMIT
ERROR HY000: Got error 131 during COMMIT
ERROR HY000: Got error 131 during COMMIT
ERROR HY000: Got error 131 during COMMIT
ERROR HY000: Got error 131 during COMMIT
ERROR HY000: Got error 131 during COMMIT
ERROR HY000: Got error 131 during COMMIT
ERROR HY000: Got error 131 during COMMIT
ERROR HY000: Got error 131 during COMMIT
ERROR HY000: Got error 131 during COMMIT
ERROR HY000: Got error 131 during COMMIT
ERROR HY000: Got error 131 during COMMIT
ERROR HY000: Got error 131 during COMMIT
ERROR HY000: Got error 131 during COMMIT
ERROR HY000: Got error 131 during COMMIT
ERROR HY000: Got error 131 during COMMIT
ERROR HY000: Got error 131 during COMMIT
ERROR HY000: Got error 131 during COMMIT
SET innodb_fake_changes=0;
CHECK TABLE t1;
Table	Op	Msg_type	Msg_text
test.t1	check	status	OK
SELECT VARIABLE_VALUE INTO @innodb_rows_inserted_2 FROM INFORMATION_SCHEMA.GLOBAL_STATUS WHERE VARIABLE_NAME = 'Innodb_rows_inserted';
SELECT VARIABLE_VALUE INTO @innodb_rows_deleted_2 FROM INFORMATION_SCHEMA.GLOBAL_STATUS WHERE VARIABLE_NAME='Innodb_rows_deleted';
SELECT VARIABLE_VALUE INTO @innodb_rows_updated_2 FROM INFORMATION_SCHEMA.GLOBAL_STATUS WHERE VARIABLE_NAME='Innodb_rows_updated';
SELECT NUM_ROWS INTO @table_rows_estimate_2 FROM INFORMATION_SCHEMA.INNODB_SYS_TABLESTATS WHERE NAME LIKE 'test/t1';
SELECT ROWS_CHANGED INTO @table_rows_changed_2 FROM INFORMATION_SCHEMA.TABLE_STATISTICS WHERE TABLE_SCHEMA LIKE 'test' AND TABLE_NAME LIKE 't1';
SELECT ROWS_CHANGED_X_INDEXES INTO @table_rows_changed_x_indexes_2 FROM INFORMATION_SCHEMA.TABLE_STATISTICS WHERE TABLE_SCHEMA LIKE 'test' AND TABLE_NAME LIKE 't1';
SELECT MODIFIED_COUNTER INTO @table_dml_counter_2 FROM INFORMATION_SCHEMA.INNODB_SYS_TABLESTATS WHERE NAME LIKE 'test/t1';
should_be_1
1
SELECT @innodb_rows_inserted_2 - @innodb_rows_inserted_1 AS should_be_0;
should_be_0
0
SELECT @innodb_rows_deleted_2 - @innodb_rows_deleted_1 AS should_be_0;
should_be_0
0
SELECT @innodb_rows_updated_2 - @innodb_rows_updated_1 AS should_be_0;
should_be_0
0
SELECT @table_rows_estimate_2 - @table_rows_estimate_1 AS should_be_0;
should_be_0
0
SELECT @table_rows_changed_2 - @table_rows_changed_1 AS should_be_0;
should_be_0
0
SELECT @table_rows_changed_x_indexes_2 - @table_rows_changed_x_indexes_1 AS should_be_0;
should_be_0
0
SELECT @table_dml_counter_2 - @table_dml_counter_1 AS should_be_0;
should_be_0
0
SHOW INDEXES IN t1;
Table	Non_unique	Key_name	Seq_in_index	Column_name	Collation	Cardinality	Sub_part	Packed	Null	Index_type	Comment	Index_comment
t1	0	PRIMARY	1	id	A	1	NULL	NULL		BTREE		
DROP TABLE t1;
CREATE TABLE t1 (id INT PRIMARY KEY AUTO_INCREMENT, v VARCHAR(200), t TEXT) ENGINE=INNODB KEY_BLOCK_SIZE=8;
INSERT INTO t1 VALUES(2, LPAD("v", 2, "b"), LPAD("a", 200, "b"));
SELECT @@global.userstat = 1 AS should_be_1;
should_be_1
1
SELECT @@global.innodb_stats_transient_sample_pages = 30000 AS should_be_1;
should_be_1
1
ANALYZE TABLE t1;
Table	Op	Msg_type	Msg_text
test.t1	analyze	status	OK
SELECT VARIABLE_VALUE INTO @innodb_rows_inserted_1 FROM INFORMATION_SCHEMA.GLOBAL_STATUS WHERE VARIABLE_NAME = 'Innodb_rows_inserted';
SELECT VARIABLE_VALUE INTO @innodb_rows_deleted_1 FROM INFORMATION_SCHEMA.GLOBAL_STATUS WHERE VARIABLE_NAME = 'Innodb_rows_deleted';
SELECT VARIABLE_VALUE INTO @innodb_rows_updated_1 FROM INFORMATION_SCHEMA.GLOBAL_STATUS WHERE VARIABLE_NAME = 'Innodb_rows_updated';
SELECT NUM_ROWS INTO @table_rows_estimate_1 FROM INFORMATION_SCHEMA.INNODB_SYS_TABLESTATS WHERE NAME LIKE 'test/t1';
SELECT ROWS_CHANGED INTO @table_rows_changed_1 FROM INFORMATION_SCHEMA.TABLE_STATISTICS WHERE TABLE_SCHEMA LIKE 'test' AND TABLE_NAME LIKE 't1';
SELECT ROWS_CHANGED_X_INDEXES INTO @table_rows_changed_x_indexes_1 FROM INFORMATION_SCHEMA.TABLE_STATISTICS WHERE TABLE_SCHEMA LIKE 'test' AND TABLE_NAME LIKE 't1';
SELECT MODIFIED_COUNTER INTO @table_dml_counter_1 FROM INFORMATION_SCHEMA.INNODB_SYS_TABLESTATS WHERE NAME LIKE 'test/t1';
SHOW INDEXES IN t1;
Table	Non_unique	Key_name	Seq_in_index	Column_name	Collation	Cardinality	Sub_part	Packed	Null	Index_type	Comment	Index_comment
t1	0	PRIMARY	1	id	A	1	NULL	NULL		BTREE		
SET innodb_fake_changes=1;
INSERT INTO t1 VALUES (3, "foo", LPAD("a", 4600, "b"));
ERROR HY000: Got error 131 during COMMIT
SET innodb_fake_changes=0;
CHECK TABLE t1;
Table	Op	Msg_type	Msg_text
test.t1	check	status	OK
SELECT VARIABLE_VALUE INTO @innodb_rows_inserted_2 FROM INFORMATION_SCHEMA.GLOBAL_STATUS WHERE VARIABLE_NAME = 'Innodb_rows_inserted';
SELECT VARIABLE_VALUE INTO @innodb_rows_deleted_2 FROM INFORMATION_SCHEMA.GLOBAL_STATUS WHERE VARIABLE_NAME='Innodb_rows_deleted';
SELECT VARIABLE_VALUE INTO @innodb_rows_updated_2 FROM INFORMATION_SCHEMA.GLOBAL_STATUS WHERE VARIABLE_NAME='Innodb_rows_updated';
SELECT NUM_ROWS INTO @table_rows_estimate_2 FROM INFORMATION_SCHEMA.INNODB_SYS_TABLESTATS WHERE NAME LIKE 'test/t1';
SELECT ROWS_CHANGED INTO @table_rows_changed_2 FROM INFORMATION_SCHEMA.TABLE_STATISTICS WHERE TABLE_SCHEMA LIKE 'test' AND TABLE_NAME LIKE 't1';
SELECT ROWS_CHANGED_X_INDEXES INTO @table_rows_changed_x_indexes_2 FROM INFORMATION_SCHEMA.TABLE_STATISTICS WHERE TABLE_SCHEMA LIKE 'test' AND TABLE_NAME LIKE 't1';
SELECT MODIFIED_COUNTER INTO @table_dml_counter_2 FROM INFORMATION_SCHEMA.INNODB_SYS_TABLESTATS WHERE NAME LIKE 'test/t1';
should_be_1
1
SELECT @innodb_rows_inserted_2 - @innodb_rows_inserted_1 AS should_be_0;
should_be_0
0
SELECT @innodb_rows_deleted_2 - @innodb_rows_deleted_1 AS should_be_0;
should_be_0
0
SELECT @innodb_rows_updated_2 - @innodb_rows_updated_1 AS should_be_0;
should_be_0
0
SELECT @table_rows_estimate_2 - @table_rows_estimate_1 AS should_be_0;
should_be_0
0
SELECT @table_rows_changed_2 - @table_rows_changed_1 AS should_be_0;
should_be_0
0
SELECT @table_rows_changed_x_indexes_2 - @table_rows_changed_x_indexes_1 AS should_be_0;
should_be_0
0
SELECT @table_dml_counter_2 - @table_dml_counter_1 AS should_be_0;
should_be_0
0
SHOW INDEXES IN t1;
Table	Non_unique	Key_name	Seq_in_index	Column_name	Collation	Cardinality	Sub_part	Packed	Null	Index_type	Comment	Index_comment
t1	0	PRIMARY	1	id	A	1	NULL	NULL		BTREE		
DROP TABLE t1;
CREATE TABLE t1 (id INT PRIMARY KEY AUTO_INCREMENT, v VARCHAR(200), t TEXT) ENGINE=INNODB;
INSERT INTO t1 VALUES(2, LPAD("v", 3, "b"), LPAD("a", 100, "b"));
SET innodb_fake_changes=1;
INSERT INTO t1 VALUES (3, "foo", LPAD("a", 4600, "b"));
ERROR HY000: Got error 131 during COMMIT
SET innodb_fake_changes=0;
CHECK TABLE t1;
Table	Op	Msg_type	Msg_text
test.t1	check	status	OK
should_be_1
1
DROP TABLE t1;
SET @@GLOBAL.userstat=default;
SET @@GLOBAL.innodb_stats_transient_sample_pages=default;
