CREATE TABLE t1 (f1 VARCHAR (32), f2 VARCHAR (128), f3 VARBINARY (128),
f4 VARBINARY (512), f5 VARBINARY (1024),
KEY (f2(1))) ENGINE=HEAP ROW_FORMAT=DYNAMIC;
INSERT IGNORE INTO t1 VALUES (2, NULL, 6, REPEAT('glugcgqk', 5), 'look'),
(REPEAT( 'kglugcgqkin', 6), 'if', 'was', NULL, NULL),
(NULL, NULL, NULL, NULL, 7);
Warnings:
Warning	1265	Data truncated for column 'f1' at row 2
SELECT * FROM t1;
f1	f2	f3	f4	f5
2	NULL	6	glugcgqkglugcgqkglugcgqkglugcgqkglugcgqk	look
kglugcgqkinkglugcgqkinkglugcgqki	if	was	NULL	NULL
NULL	NULL	NULL	NULL	7
DELETE FROM t1 WHERE f5 <=> NULL;
SELECT * FROM t1;
f1	f2	f3	f4	f5
2	NULL	6	glugcgqkglugcgqkglugcgqkglugcgqkglugcgqk	look
NULL	NULL	NULL	NULL	7
DROP TABLE t1;
