connect  con1,localhost,root,,;
SET lock_wait_timeout=1;
connection default;
CREATE TABLE t1 (id INT, id2 INT, pk INT AUTO_INCREMENT PRIMARY KEY) ENGINE=ROCKSDB;
INSERT INTO t1 (id,id2) VALUES (1,1),(1,2),(1,3);
LOCK TABLE t1 LOW_PRIORITY WRITE;
Warnings:
Warning	1287	'LOW_PRIORITY WRITE' is deprecated and will be removed in a future release. Please use WRITE instead
SELECT id2,COUNT(DISTINCT id) FROM t1 GROUP BY id2;
id2	COUNT(DISTINCT id)
1	1
2	1
3	1
UPDATE t1 SET id=-1 WHERE id=1;
connection con1;
SELECT id,id2 FROM t1;
ERROR HY000: Lock wait timeout exceeded; try restarting transaction
LOCK TABLE t1 READ;
ERROR HY000: Lock wait timeout exceeded; try restarting transaction
connection default;
LOCK TABLE t1 READ;
UPDATE t1 SET id=1 WHERE id=1;
ERROR HY000: Table 't1' was locked with a READ lock and can't be updated
connection con1;
SELECT COUNT(DISTINCT id) FROM t1;
COUNT(DISTINCT id)
1
UPDATE t1 SET id=2 WHERE id=2;
ERROR HY000: Lock wait timeout exceeded; try restarting transaction
LOCK TABLE t1 WRITE;
ERROR HY000: Lock wait timeout exceeded; try restarting transaction
LOCK TABLE t1 READ;
UNLOCK TABLES;
connection default;
CREATE TABLE t2 (a INT, b CHAR(8), PRIMARY KEY(a)) ENGINE=ROCKSDB;
ERROR HY000: Table 't2' was not locked with LOCK TABLES
UNLOCK TABLES;
CREATE TABLE t2 (id INT, id2 INT, pk INT AUTO_INCREMENT PRIMARY KEY) ENGINE=ROCKSDB;
LOCK TABLE t1 WRITE, t2 WRITE;
set @orig_tx_iso=@@session.transaction_isolation;
set session transaction_isolation='READ-COMMITTED';
INSERT INTO t2 (id,id2) SELECT id,id2 FROM t1;
set session transaction_isolation=@orig_tx_iso;
UPDATE t1 SET id=1 WHERE id=-1;
DROP TABLE t1,t2;
CREATE TABLE t1 (i1 INT, nr INT, pk INT AUTO_INCREMENT PRIMARY KEY) ENGINE=ROCKSDB;
CREATE TABLE t2 (nr INT, nm INT, pk INT AUTO_INCREMENT PRIMARY KEY) ENGINE=ROCKSDB;
INSERT INTO t2 (nr,nm) VALUES (1,3);
INSERT INTO t2 (nr,nm) VALUES (2,4);
LOCK TABLES t1 WRITE, t2 READ;
set @orig_tx_iso=@@session.transaction_isolation;
set session transaction_isolation='READ-COMMITTED';
INSERT INTO t1 (i1,nr) SELECT 1, nr FROM t2 WHERE nm=3;
INSERT INTO t1 (i1,nr) SELECT 2, nr FROM t2 WHERE nm=4;
set session transaction_isolation=@orig_tx_iso;
UNLOCK TABLES;
LOCK TABLES t1 WRITE;
INSERT INTO t1 (i1,nr) SELECT i1, nr FROM t1;
ERROR HY000: Table 't1' was not locked with LOCK TABLES
UNLOCK TABLES;
LOCK TABLES t1 WRITE, t1 AS t1_alias READ;
set @orig_tx_iso=@@session.transaction_isolation;
set session transaction_isolation='READ-COMMITTED';
INSERT INTO t1 (i1,nr) SELECT i1, nr FROM t1 AS t1_alias;
set session transaction_isolation=@orig_tx_iso;
DROP TABLE t1,t2;
ERROR HY000: Table 't2' was not locked with LOCK TABLES
UNLOCK TABLES;
DROP TABLE t1,t2;
CREATE TABLE t1 (a INT, b CHAR(8), PRIMARY KEY(a)) ENGINE=ROCKSDB;
CREATE TABLE t2 (a INT, b CHAR(8), PRIMARY KEY(b)) ENGINE=ROCKSDB;
CREATE TABLE t3 (a INT, b CHAR(8), pk INT PRIMARY KEY) ENGINE=ROCKSDB;
LOCK TABLES t1 WRITE, t2 WRITE, t3 WRITE;
DROP TABLE t2, t3, t1;
CREATE TABLE t1 (a INT, b CHAR(8), PRIMARY KEY(a)) ENGINE=ROCKSDB;
CREATE TABLE t2 (a INT, b CHAR(8), PRIMARY KEY(b)) ENGINE=ROCKSDB;
CREATE TABLE t3 (a INT, b CHAR(8), pk INT PRIMARY KEY) ENGINE=ROCKSDB;
LOCK TABLES t1 WRITE, t2 WRITE, t3 WRITE, t1 AS t4 READ;
ALTER TABLE t2 ADD COLUMN c2 INT;
DROP TABLE t1, t2, t3;
CREATE TABLE t1 (a INT, b CHAR(8), PRIMARY KEY(a)) ENGINE=ROCKSDB;
CREATE TABLE t2 (a INT, b CHAR(8), PRIMARY KEY(b)) ENGINE=ROCKSDB;
LOCK TABLE t1 READ, t2 READ;
FLUSH TABLE t1;
ERROR HY000: Table 't1' was locked with a READ lock and can't be updated
FLUSH TABLES;
ERROR HY000: Table 't2' was locked with a READ lock and can't be updated
FLUSH TABLES t1, t2 WITH READ LOCK;
ERROR HY000: Can't execute the given command because you have active locked tables or an active transaction
UNLOCK TABLES;
FLUSH TABLES t1, t2 WITH READ LOCK;
connection con1;
INSERT INTO t1 (a,b) VALUES (1,'a'),(2,'b');
ERROR HY000: Lock wait timeout exceeded; try restarting transaction
connection default;
UNLOCK TABLES;
FLUSH TABLES WITH READ LOCK;
connection con1;
INSERT INTO t1 (a,b) VALUES (1,'a'),(2,'b');
ERROR HY000: Lock wait timeout exceeded; try restarting transaction
connection default;
UNLOCK TABLES;
INSERT INTO t1 (a,b) VALUES (1,'a'),(2,'b');
FLUSH TABLES WITH READ LOCK;
DROP TABLE t1, t2;
ERROR HY000: Can't execute the query because you have a conflicting read lock
UNLOCK TABLES;
DROP TABLE t1, t2;
disconnect con1;
CREATE TABLE t1 (a INT, b CHAR(8), PRIMARY KEY(a)) ENGINE=ROCKSDB;
CREATE TABLE t2 (a INT, b CHAR(8), PRIMARY KEY(b)) ENGINE=ROCKSDB;
LOCK TABLE t1 WRITE, t2 WRITE;
SELECT a,b FROM t1;
a	b
UNLOCK TABLES;
DROP TABLE t1, t2;
