include/master-slave.inc
Warnings:
Note	####	Sending passwords in plain text without SSL/TLS is extremely insecure.
Note	####	Storing MySQL user name or password information in the master info repository is not secure and is therefore not recommended. Please consider using the USER and PASSWORD connection options for START SLAVE; see the 'START SLAVE Syntax' in the MySQL Manual for more information.
[connection master]
CREATE TABLE t1 (a INT AUTO_INCREMENT KEY) ENGINE=INNODB;
CREATE TABLE t2 (b INT AUTO_INCREMENT KEY, c INT, FOREIGN KEY(b) REFERENCES t1(a)) ENGINE=INNODB;
SET FOREIGN_KEY_CHECKS=0;
INSERT INTO t1 VALUES (10);
INSERT INTO t1 VALUES (NULL),(NULL),(NULL);
INSERT INTO t2 VALUES (5,0);
INSERT INTO t2 VALUES (NULL,LAST_INSERT_ID());
SET FOREIGN_KEY_CHECKS=1;
SELECT * FROM t1 ORDER BY a;
a
10
11
12
13
SELECT * FROM t2 ORDER BY b;
b	c
5	0
6	11
include/sync_slave_sql_with_master.inc
SELECT * FROM t1 ORDER BY a;
a
10
11
12
13
SELECT * FROM t2 ORDER BY b;
b	c
5	0
6	11
SET TIMESTAMP=1000000000;
CREATE TABLE t3 ( a INT UNIQUE );
SET FOREIGN_KEY_CHECKS=0;
INSERT INTO t3 VALUES (1),(1);
Got one of the listed errors
include/sync_slave_sql_with_master.inc
SET FOREIGN_KEY_CHECKS=0;
DROP TABLE IF EXISTS t1,t2,t3;
SET FOREIGN_KEY_CHECKS=1;
include/sync_slave_sql_with_master.inc
create table t1 (b int primary key) engine = INNODB;
create table t2 (a int primary key, b int, foreign key (b) references t1(b))
engine = INNODB;
insert into t1 set b=1;
insert into t2 set a=1, b=1;
set foreign_key_checks=0;
delete from t1;
must sync w/o a problem (could not with the buggy code)
include/sync_slave_sql_with_master.inc
select count(*) from t1 /* must be zero */;
count(*)
0
drop table t2,t1;
#
# Bug 79610: Failed DROP DATABASE due FK constraint on master breaks slave
#
SET foreign_key_checks=1;
CREATE DATABASE `db2`;
USE `db2`;
create table a1(f1 int);
CREATE TABLE `table0` (`ID` bigint(20) primary key) ENGINE=INNODB;
CREATE TABLE `table1` (`ID` bigint(20) primary key) ENGINE=INNODB;
create database db1;
use db1;
CREATE TABLE `table2` ( `ID` bigint(20) NOT NULL AUTO_INCREMENT,
`DIVISION_ID` bigint(20) DEFAULT NULL,
PRIMARY KEY (`ID`), KEY `FK_TABLE1_DIVISION_1` (`DIVISION_ID`),
CONSTRAINT `FK_TABLE1_DIVISION_1` FOREIGN KEY (`DIVISION_ID`)
REFERENCES `db2`.`table1` (`ID`) ON DELETE NO ACTION ) ENGINE=INNODB;
include/sync_slave_sql_with_master.inc
use db2;
CREATE TABLE `table2` ( `ID` bigint(20) NOT NULL AUTO_INCREMENT,
`DIVISION_ID` bigint(20) DEFAULT NULL,
PRIMARY KEY (`ID`), KEY `FK_TABLE1_DIVISION_1` (`DIVISION_ID`),
CONSTRAINT `FK_TABLE1_DIVISION_1` FOREIGN KEY (`DIVISION_ID`)
REFERENCES `db2`.`table0` (`ID`) ON DELETE NO ACTION ) ENGINE=INNODB;
DROP DATABASE db2;
ERROR 23000: Cannot delete or update a parent row: a foreign key constraint fails
# DROP DATABASE should not have deleted any tables
# master:
SHOW TABLES IN db2;
Tables_in_db2
a1
table0
table1
# slave:
SHOW TABLES IN db2;
Tables_in_db2
a1
table0
table1
table2
SET foreign_key_checks=0;
DROP DATABASE db2;
DROP DATABASE db1;
include/sync_slave_sql_with_master.inc
include/rpl_end.inc
