include/master-slave.inc
[connection master]
set global userstat=ON;
Rows_updated on slave - starting situation
select ROWS_UPDATED from information_schema.client_statistics;
ROWS_UPDATED
0
set global userstat=ON;
Rows_updated on master - starting situation
select ROWS_UPDATED from information_schema.client_statistics;
ROWS_UPDATED
0
create table t1 (m int);
3 "updates" to rows
insert into t1 values(15),(16),(17);
1 "update" to rows (4 in total)
update t1 set m=20 where m=16;
1 "update" to rows (5 in total)
delete from t1 where m=17;
create table t2 (n int);
2 "updates" to rows (7 in total)
insert into t2 values(30),(30);
2 "updates" to rows (9 in total)
update t2 set n=10 where n=30;
2 "updates" to rows (11 in total)
delete from t2 where n=10;
2 "updates" to rows (13 in total)
insert into t2 (n)
select t1.m
from t1;
Rows_updated on master - ending situation
select ROWS_UPDATED from information_schema.client_statistics;
ROWS_UPDATED
13
set global userstat=OFF;
Rows_updated on slave - ending situation
select ROWS_UPDATED from information_schema.client_statistics;
ROWS_UPDATED
0
13
set global userstat=OFF;
select * from t1 ORDER BY m;
m
15
20
drop table t1, t2;
include/rpl_end.inc
