SET GLOBAL DEBUG='+d,audit_log_filter_add_record_debug_info';
SET GLOBAL DEBUG='+d,audit_log_filter_rotate_after_audit_rules_flush';
CREATE TABLE t1 (id INT);
CREATE TABLE t2 (id INT);
#
# Field replacement for all events of "query" class
SELECT audit_log_filter_set_filter('replace_query', '{
"filter": {
"class": {
"name": "query",
"print": {
"field": {
"name": "query.str",
"print": false,
"replace": {"function": {"name": "query_digest"}}
}
}
}
}
}');
audit_log_filter_set_filter('replace_query', '{
"filter": {
"class": {
"name": "query",
"print": {
"field": {
"name": "query.str",
"print": false,
"replace": {"function": {"name": "query_digest"}}
}
}
}
}
}')
OK
SELECT audit_log_filter_set_user('%', 'replace_query');
audit_log_filter_set_user('%', 'replace_query')
OK
INSERT INTO t1 VALUES (1);
Tag <EVENT_CLASS_NAME>query</EVENT_CLASS_NAME>.*<SQLTEXT>(?:SELECT `audit_log_filter_set_user` \(\.\.\.\)|INSERT INTO `t1` VALUES \(\?\))</SQLTEXT> Ok
#
# Field replacement for all events of "parse" class
SELECT audit_log_filter_set_filter('replace_parse_query', '{
"filter": {
"class": {
"name": "parse",
"print": {
"field": {
"name": "query.str",
"print": false,
"replace": {"function": {"name": "query_digest"}}
}
}
}
}
}');
audit_log_filter_set_filter('replace_parse_query', '{
"filter": {
"class": {
"name": "parse",
"print": {
"field": {
"name": "query.str",
"print": false,
"replace": {"function": {"name": "query_digest"}}
}
}
}
}
}')
OK
SELECT audit_log_filter_set_user('%', 'replace_parse_query');
audit_log_filter_set_user('%', 'replace_parse_query')
OK
INSERT INTO t2 VALUES (1);
UPDATE t2 SET id = 2 WHERE id = 1;
SELECT * FROM t2;
id
2
DELETE FROM t2 WHERE id = 2;
Tag <EVENT_CLASS_NAME>parse</EVENT_CLASS_NAME> Ok
Tag <SQLTEXT>(?:INSERT INTO `t2` VALUES \(\?\)|UPDATE `t2` SET `id` = \? WHERE `id` = \?|SELECT \* FROM `t2`|DELETE FROM `t2` WHERE `id` = \?|\.\.\.)</SQLTEXT> Ok
#
# Field replacement for specific event subclass
SELECT audit_log_filter_set_filter('replace_query_start_end', '{
"filter": {
"class": {
"name": "query",
"event": {
"name": ["start", "status_end"],
"print": {
"field": {
"name": "query.str",
"print": false,
"replace": {"function": {"name": "query_digest"}}
}
}
}
}
}
}');
audit_log_filter_set_filter('replace_query_start_end', '{
"filter": {
"class": {
"name": "query",
"event": {
"name": ["start", "status_end"],
"print": {
"field": {
"name": "query.str",
"print": false,
"replace": {"function": {"name": "query_digest"}}
}
}

OK
SELECT audit_log_filter_set_user('%', 'replace_query_start_end');
audit_log_filter_set_user('%', 'replace_query_start_end')
OK
INSERT INTO t2 VALUES (1);
UPDATE t2 SET id = 2 WHERE id = 1;
SELECT * FROM t2;
id
2
DELETE FROM t2 WHERE id = 2;
Tag <EVENT_SUBCLASS_NAME>(?:start|status_end)</EVENT_SUBCLASS_NAME> Ok
Tag <SQLTEXT>(?:SELECT `audit_log_filter_set_user` \(\.\.\.\)|INSERT INTO `t2` VALUES \(\?\)|UPDATE `t2` SET `id` = \? WHERE `id` = \?|SELECT \* FROM `t2`|DELETE FROM `t2` WHERE `id` = \?)</SQLTEXT> Ok
#
# Replace for queries not matching provided digest
SELECT audit_log_filter_set_filter('replace_not_matching_digest', '{
"filter": {
"class": {
"name": "query",
"event": {
"name": ["start", "status_end"],
"print": {
"field": {
"name": "query.str",
"print": {
"function": {
"name": "query_digest",
"args": [{"string": {"string": "INSERT INTO `t2` VALUES (?)"}}]
}
},
"replace": {
"function": {
"name": "query_digest"
              }
}
}
}
}
}
}
}');
audit_log_filter_set_filter('replace_not_matching_digest', '{
"filter": {
"class": {
"name": "query",
"event": {
"name": ["start", "status_end"],
"print": {
"field": {
"name": "query.str",
"print": {
"function": {
"name": "query_digest",
"args": [{"string
OK
SELECT audit_log_filter_set_user('%', 'replace_not_matching_digest');
audit_log_filter_set_user('%', 'replace_not_matching_digest')
OK
INSERT INTO t2 VALUES (1);
UPDATE t2 SET id = 2 WHERE id = 1;
SELECT * FROM t2;
id
2
DELETE FROM t2 WHERE id = 2;
Tag <EVENT_SUBCLASS_NAME>(?:start|status_end)</EVENT_SUBCLASS_NAME> Ok
Tag <SQLTEXT>(?:SELECT `audit_log_filter_set_user` \(\.\.\.\)|INSERT INTO t2 VALUES \(1\)|UPDATE `t2` SET `id` = \? WHERE `id` = \?|SELECT \* FROM `t2`|DELETE FROM `t2` WHERE `id` = \?)</SQLTEXT> Ok
#
# Replace for queries matching provided digest
SELECT audit_log_filter_set_filter('replace_matching_digest', '{
"filter": {
"class": {
"name": "query",
"event": {
"name": ["start"],
"print": {
"field": {
"name": "query.str",
"print": {
"not": {
"function": {
"name": "query_digest",
"args": [{"string": {"string": "INSERT INTO `t2` VALUES (?)"}}]
}
}
},
"replace": {
"function": {
"name": "query_digest"
              }
}
}
}
}
}
}
}');
audit_log_filter_set_filter('replace_matching_digest', '{
"filter": {
"class": {
"name": "query",
"event": {
"name": ["start"],
"print": {
"field": {
"name": "query.str",
"print": {
"not": {
"function": {
"name": "query_digest",
"args": [{"string": {"stri
OK
SELECT audit_log_filter_set_user('%', 'replace_matching_digest');
audit_log_filter_set_user('%', 'replace_matching_digest')
OK
INSERT INTO t2 VALUES (1);
UPDATE t2 SET id = 2 WHERE id = 1;
SELECT * FROM t2;
id
2
DELETE FROM t2 WHERE id = 2;
Tag <EVENT_SUBCLASS_NAME>start</EVENT_SUBCLASS_NAME> Ok
Tag <SQLTEXT>(?:INSERT INTO `t2` VALUES \(\?\)|UPDATE t2 SET id = 2 WHERE id = 1|SELECT \* FROM t2|DELETE FROM t2 WHERE id = 2)</SQLTEXT> Ok
#
# Replace only for events matching specific fields
SELECT audit_log_filter_set_filter('replace_for_tables', '{
"filter": {
"class": {
"name": "query",
"event": {
"name": ["start", "status_end"],
"print": {
"field": {
"name": "query.str",
"print": false,
"replace": {
"function": {
"name": "query_digest"
              }
}
}
},
"log": {
"or": [
{
"field": {
"name": "sql_command_id",
"value": "select"
              }
},
{
"field": {
"name": "sql_command_id",
"value": "insert"
              }
}
]
}
}
}
}
}');
audit_log_filter_set_filter('replace_for_tables', '{
"filter": {
"class": {
"name": "query",
"event": {
"name": ["start", "status_end"],
"print": {
"field": {
"name": "query.str",
"print": false,
"replace": {
"function": {
"name": "query_digest"
         
OK
SELECT audit_log_filter_set_user('%', 'replace_for_tables');
audit_log_filter_set_user('%', 'replace_for_tables')
OK
INSERT INTO t1 VALUES (1);
INSERT INTO t2 VALUES (1);
DELETE FROM t1;
DELETE FROM t2;
Tag <EVENT_SUBCLASS_NAME>(?:start|status_end)</EVENT_SUBCLASS_NAME> Ok
Tag <SQLTEXT>(?:SELECT `audit_log_filter_set_user` \(\.\.\.\)|INSERT INTO `t1` VALUES \(\?\)|INSERT INTO `t2` VALUES \(\?\))</SQLTEXT> Ok
#
# Check incorrect replacement rule definitions
SELECT audit_log_filter_set_filter('incorrect_rule', '{
"filter": {
"class": {
"name": "query",
"print": {
"field": {
"name": "status",
"print": false,
"replace": {"function": {"name": "query_digest"}}
}
}
}
}
}');
audit_log_filter_set_filter('incorrect_rule', '{
"filter": {
"class": {
"name": "query",
"print": {
"field": {
"name": "status",
"print": false,
"replace": {"function": {"name": "query_digest"}}
}
}
}
}
}')
ERROR: Incorrect rule definition
SELECT audit_log_filter_set_filter('incorrect_rule', '{
"filter": {
"class": {
"name": "parse",
"print": {
"field": {
"name": "connection_id",
"print": false,
"replace": {"function": {"name": "query_digest"}}
}
}
}
}
}');
audit_log_filter_set_filter('incorrect_rule', '{
"filter": {
"class": {
"name": "parse",
"print": {
"field": {
"name": "connection_id",
"print": false,
"replace": {"function": {"name": "query_digest"}}
}
}
}
}
}')
ERROR: Incorrect rule definition
#
# Cleanup
SET GLOBAL DEBUG='-d,audit_log_filter_add_record_debug_info';
SET GLOBAL DEBUG='-d,audit_log_filter_rotate_after_audit_rules_flush';
DROP TABLE t1, t2;
