CALL mtr.add_suppression("Statement is unsafe because it accesses a non-transactional table after");
RESET BINARY LOGS AND GTIDS;
# Connection default
CREATE TABLE t1 (a INT, b VARCHAR(100), PRIMARY KEY (a,b)) ENGINE=innodb;
SHOW BINARY LOG STATUS;
File	Position	Binlog_Do_DB	Binlog_Ignore_DB	Executed_Gtid_Set
binlog.000001	395			
SHOW STATUS LIKE 'binlog_snapshot_%';
Variable_name	Value
Binlog_snapshot_file	binlog.000001
Binlog_snapshot_position	395
Binlog_snapshot_gtid_executed	not-in-consistent-snapshot
BEGIN;
INSERT INTO t1 VALUES (0, "");
# Connection con1
BEGIN;
INSERT INTO t1 VALUES (1, "");
# Connection con2
CREATE TABLE t2 (a INT PRIMARY KEY) ENGINE=myisam;
BEGIN;
INSERT INTO t1 VALUES (2, "first");
INSERT INTO t2 VALUES (2);
Warnings:
Note	1592	Unsafe statement written to the binary log using statement format since BINLOG_FORMAT = STATEMENT. Statement is unsafe because it accesses a non-transactional table after accessing a transactional table within the same transaction.
INSERT INTO t1 VALUES (2, "second");
# Connection default
COMMIT;
SET TRANSACTION ISOLATION LEVEL REPEATABLE READ;
START TRANSACTION WITH CONSISTENT SNAPSHOT;
# Connection con3
BEGIN;
INSERT INTO t1 VALUES (3, "");
INSERT INTO t2 VALUES (3);
Warnings:
Note	1592	Unsafe statement written to the binary log using statement format since BINLOG_FORMAT = STATEMENT. Statement is unsafe because it accesses a non-transactional table after accessing a transactional table within the same transaction.
# Connection con4
BEGIN;
INSERT INTO t1 VALUES (4, "");
COMMIT;
# Connection default
SELECT * FROM t1 ORDER BY a,b;
a	b
0	
SHOW STATUS LIKE 'binlog_snapshot_%';
Variable_name	Value
Binlog_snapshot_file	binlog.000001
Binlog_snapshot_position	898
Binlog_snapshot_gtid_executed	
SHOW BINARY LOG STATUS;
File	Position	Binlog_Do_DB	Binlog_Ignore_DB	Executed_Gtid_Set
binlog.000001	1196			
SELECT * FROM t2 ORDER BY a;
a
2
3
# Connection con1
COMMIT;
# Connection con2
COMMIT;
# Connection con3
COMMIT;
FLUSH LOGS;
# Connection default
SELECT * FROM t1 ORDER BY a,b;
a	b
0	
SHOW STATUS LIKE 'binlog_snapshot_%';
Variable_name	Value
Binlog_snapshot_file	binlog.000001
Binlog_snapshot_position	898
Binlog_snapshot_gtid_executed	
SHOW BINARY LOG STATUS;
File	Position	Binlog_Do_DB	Binlog_Ignore_DB	Executed_Gtid_Set
binlog.000002	158			
COMMIT;
SHOW STATUS LIKE 'binlog_snapshot_%';
Variable_name	Value
Binlog_snapshot_file	binlog.000002
Binlog_snapshot_position	158
Binlog_snapshot_gtid_executed	not-in-consistent-snapshot
SHOW BINARY LOG STATUS;
File	Position	Binlog_Do_DB	Binlog_Ignore_DB	Executed_Gtid_Set
binlog.000002	158			
# Test START TRANSACTION WITH CONSISTENT SNAPSHOT FROM SESSION
DELETE FROM t1;
START TRANSACTION WITH CONSISTENT SNAPSHOT;
SHOW STATUS LIKE 'binlog_snapshot_%';
Variable_name	Value
Binlog_snapshot_file	binlog.000002
Binlog_snapshot_position	441
Binlog_snapshot_gtid_executed	
SHOW BINARY LOG STATUS;
File	Position	Binlog_Do_DB	Binlog_Ignore_DB	Executed_Gtid_Set
binlog.000002	441			
INSERT INTO t1 VALUES (1, "first");
SELECT * FROM t1;
a	b
1	first
# Connection con3
INSERT INTO t1 VALUES (3, "third");
SELECT * FROM t1;
a	b
3	third
SHOW STATUS LIKE 'binlog_snapshot_%';
Variable_name	Value
Binlog_snapshot_file	binlog.000002
Binlog_snapshot_position	744
Binlog_snapshot_gtid_executed	not-in-consistent-snapshot
SHOW BINARY LOG STATUS;
File	Position	Binlog_Do_DB	Binlog_Ignore_DB	Executed_Gtid_Set
binlog.000002	744			
# Connection con2
SELECT * FROM t1;
a	b
3	third
SHOW STATUS LIKE 'binlog_snapshot_%';
Variable_name	Value
Binlog_snapshot_file	binlog.000002
Binlog_snapshot_position	744
Binlog_snapshot_gtid_executed	not-in-consistent-snapshot
SHOW BINARY LOG STATUS;
File	Position	Binlog_Do_DB	Binlog_Ignore_DB	Executed_Gtid_Set
binlog.000002	744			
START TRANSACTION WITH CONSISTENT SNAPSHOT FROM SESSION $donor_id;
SELECT * FROM t1;
a	b
1	first
SHOW STATUS LIKE 'binlog_snapshot_%';
Variable_name	Value
Binlog_snapshot_file	binlog.000002
Binlog_snapshot_position	441
Binlog_snapshot_gtid_executed	
SHOW BINARY LOG STATUS;
File	Position	Binlog_Do_DB	Binlog_Ignore_DB	Executed_Gtid_Set
binlog.000002	744			
# Connection con3
FLUSH LOGS;
SHOW STATUS LIKE 'binlog_snapshot_%';
Variable_name	Value
Binlog_snapshot_file	binlog.000003
Binlog_snapshot_position	158
Binlog_snapshot_gtid_executed	not-in-consistent-snapshot
SHOW BINARY LOG STATUS;
File	Position	Binlog_Do_DB	Binlog_Ignore_DB	Executed_Gtid_Set
binlog.000003	158			
# Connection con2
SHOW STATUS LIKE 'binlog_snapshot_%';
Variable_name	Value
Binlog_snapshot_file	binlog.000002
Binlog_snapshot_position	441
Binlog_snapshot_gtid_executed	
SHOW BINARY LOG STATUS;
File	Position	Binlog_Do_DB	Binlog_Ignore_DB	Executed_Gtid_Set
binlog.000003	158			
COMMIT;
# Connection default
SHOW STATUS LIKE 'binlog_snapshot_%';
Variable_name	Value
Binlog_snapshot_file	binlog.000002
Binlog_snapshot_position	441
Binlog_snapshot_gtid_executed	
SHOW BINARY LOG STATUS;
File	Position	Binlog_Do_DB	Binlog_Ignore_DB	Executed_Gtid_Set
binlog.000003	158			
COMMIT;
SHOW BINLOG EVENTS;
Log_name	Pos	Event_type	Server_id	End_log_pos	Info
binlog.000001	4	Format_desc	1	127	Server ver: #, Binlog ver: #
binlog.000001	127	Previous_gtids	1	158	
binlog.000001	158	Anonymous_Gtid	1	235	SET @@SESSION.GTID_NEXT= 'ANONYMOUS'
binlog.000001	235	Query	1	395	use `test`; CREATE TABLE t1 (a INT, b VARCHAR(100), PRIMARY KEY (a,b)) ENGINE=innodb /* XID */
binlog.000001	395	Anonymous_Gtid	1	472	SET @@SESSION.GTID_NEXT= 'ANONYMOUS'
binlog.000001	472	Query	1	600	use `test`; CREATE TABLE t2 (a INT PRIMARY KEY) ENGINE=myisam
binlog.000001	600	Anonymous_Gtid	1	679	SET @@SESSION.GTID_NEXT= 'ANONYMOUS'
binlog.000001	679	Query	1	761	BEGIN
binlog.000001	761	Query	1	867	use `test`; INSERT INTO t1 VALUES (0, "")
binlog.000001	867	Xid	1	898	COMMIT /* XID */
binlog.000001	898	Anonymous_Gtid	1	977	SET @@SESSION.GTID_NEXT= 'ANONYMOUS'
binlog.000001	977	Query	1	1059	BEGIN
binlog.000001	1059	Query	1	1165	use `test`; INSERT INTO t1 VALUES (4, "")
binlog.000001	1165	Xid	1	1196	COMMIT /* XID */
binlog.000001	1196	Anonymous_Gtid	1	1275	SET @@SESSION.GTID_NEXT= 'ANONYMOUS'
binlog.000001	1275	Query	1	1357	BEGIN
binlog.000001	1357	Query	1	1463	use `test`; INSERT INTO t1 VALUES (1, "")
binlog.000001	1463	Xid	1	1494	COMMIT /* XID */
binlog.000001	1494	Anonymous_Gtid	1	1573	SET @@SESSION.GTID_NEXT= 'ANONYMOUS'
binlog.000001	1573	Query	1	1655	BEGIN
binlog.000001	1655	Query	1	1766	use `test`; INSERT INTO t1 VALUES (2, "first")
binlog.000001	1766	Query	1	1868	use `test`; INSERT INTO t2 VALUES (2)
binlog.000001	1868	Query	1	1980	use `test`; INSERT INTO t1 VALUES (2, "second")
binlog.000001	1980	Xid	1	2011	COMMIT /* XID */
binlog.000001	2011	Anonymous_Gtid	1	2090	SET @@SESSION.GTID_NEXT= 'ANONYMOUS'
binlog.000001	2090	Query	1	2172	BEGIN
binlog.000001	2172	Query	1	2278	use `test`; INSERT INTO t1 VALUES (3, "")
binlog.000001	2278	Query	1	2380	use `test`; INSERT INTO t2 VALUES (3)
binlog.000001	2380	Xid	1	2411	COMMIT /* XID */
binlog.000001	2411	Rotate	1	2455	binlog.000002;pos=4
DROP TABLE t1,t2;
