# PS-9768: Bogus "Can't write; duplicate key in table" error for GROUP BY
#          on JSON_EXTRACT() when an indexed generated column unquotes
#          the very same expression.
#
# An indexed GC may only replace an ORDER/GROUP BY expression when it
# evaluates to the same value. JSON_UNQUOTE() in the GC expression must
# therefore not be skipped when matching, unlike for the WHERE clause.
CREATE TABLE t (
id int auto_increment,
data1 json,
data2 json,
`i` bigint GENERATED ALWAYS AS (
json_unquote(json_extract(`data1`,_utf8mb4'$.i'))
) STORED,
`a` varchar(128) GENERATED ALWAYS AS (
json_unquote(json_extract(`data2`,_utf8mb4'$.a'))
) STORED,
primary key (id),
key (a,i),
key i (i)
) ENGINE=innodb;
INSERT INTO t (data1,data2) values
(JSON_OBJECT('i', 1),JSON_OBJECT('a', "a")),
(JSON_OBJECT('i', 1),JSON_OBJECT('a', "a")),
(JSON_OBJECT('i', 1),JSON_OBJECT('a', "b"));
SET SESSION optimizer_trace="enabled=on";
#
# Case 1: the reported query. Must not fail with ER_DUP_KEY, and must
#         group on the quoted values returned by JSON_EXTRACT().
#
SELECT
JSON_EXTRACT(data2, '$.a') as `a`,
CAST(count(*) AS JSON) as `*`
FROM test.t
WHERE
i = 1
GROUP BY
JSON_EXTRACT(data2, '$.a');
a	*
"a"	2
"b"	1
# Expect 0: the GROUP BY list was not rewritten to use GC 'a'
SELECT TRACE LIKE '%resulting_GROUP_BY%' AS group_by_substituted
FROM information_schema.OPTIMIZER_TRACE;
group_by_substituted
0
#
# Case 2: ORDER BY on the same expression. JSON comparison sorts numbers
#         before strings, so 2 precedes "10", while ordering by the
#         unquoted GC would have put '10' first.
#
CREATE TABLE t2 (
data2 json,
`a` varchar(128) GENERATED ALWAYS AS (
json_unquote(json_extract(`data2`,_utf8mb4'$.a'))
) STORED,
key (a)
) ENGINE=innodb;
INSERT INTO t2 (data2) VALUES
(JSON_OBJECT('a', 2)),
(JSON_OBJECT('a', "10"));
SELECT JSON_EXTRACT(data2, '$.a') AS `a` FROM t2
ORDER BY JSON_EXTRACT(data2, '$.a');
a
2
"10"
# Expect 0: the ORDER BY list was not rewritten to use GC 'a'
SELECT TRACE LIKE '%resulting_ORDER_BY%' AS order_by_substituted
FROM information_schema.OPTIMIZER_TRACE;
order_by_substituted
0
#
# Case 3: single table DELETE ... ORDER BY uses the same code path, so
#         the JSON-ordered first row (2) has to be the one deleted.
#
DELETE FROM t2 ORDER BY JSON_EXTRACT(data2, '$.a') LIMIT 1;
SELECT JSON_EXTRACT(data2, '$.a') AS `a` FROM t2;
a
"10"
#
# Case 4: the optimization is not over-blocked. When the query unquotes
#         the value itself the GC is value preserving (its collation
#         matches the one of JSON_UNQUOTE()) and must still be used.
#
CREATE TABLE t3 (
data2 json,
`a` varchar(128) COLLATE utf8mb4_bin GENERATED ALWAYS AS (
json_unquote(json_extract(`data2`,_utf8mb4'$.a'))
) STORED,
key (a)
) ENGINE=innodb;
INSERT INTO t3 (data2) VALUES
(JSON_OBJECT('a', "a")),
(JSON_OBJECT('a', "a")),
(JSON_OBJECT('a', "b"));
SELECT JSON_UNQUOTE(JSON_EXTRACT(data2, '$.a')) AS `a`, count(*) AS `*`
FROM t3
GROUP BY JSON_UNQUOTE(JSON_EXTRACT(data2, '$.a'));
a	*
a	2
b	1
# Expect 1: the GROUP BY list was rewritten to use GC 'a'
SELECT TRACE LIKE '%resulting_GROUP_BY%' AS group_by_substituted
FROM information_schema.OPTIMIZER_TRACE;
group_by_substituted
1
#
# Case 5: WHERE clause behaviour is unchanged, the index over the
#         unquoting GC is still used for a JSON_EXTRACT() predicate.
#
# Expect 1: the condition was rewritten to use GC 'a'
SELECT JSON_UNQUOTE(JSON_EXTRACT(data2, '$.a')) AS `a` FROM t3
WHERE JSON_EXTRACT(data2, '$.a') = 'b';
a
b
SELECT TRACE LIKE '%`a` = %' AS where_substituted
FROM information_schema.OPTIMIZER_TRACE;
where_substituted
1
SET SESSION optimizer_trace="enabled=off";
DROP TABLE t, t2, t3;
