# PS-9768: Bogus "Can't write; duplicate key in table" error for GROUP BY
#          on JSON_EXTRACT() when an indexed generated column unquotes
#          the very same expression.
#
# An indexed GC may only replace an ORDER/GROUP BY expression when it
# evaluates to the same value. JSON_UNQUOTE() in the GC expression must
# therefore not be skipped when matching, unlike for the WHERE clause.
CREATE TABLE t (
id int auto_increment,
data1 json,
data2 json,
`i` bigint GENERATED ALWAYS AS (
json_unquote(json_extract(`data1`,_utf8mb4'$.i'))
) STORED,
`a` varchar(128) GENERATED ALWAYS AS (
json_unquote(json_extract(`data2`,_utf8mb4'$.a'))
) STORED,
primary key (id),
key (a,i),
key i (i)
) ENGINE=innodb;
INSERT INTO t (data1,data2) values
(JSON_OBJECT('i', 1),JSON_OBJECT('a', "a")),
(JSON_OBJECT('i', 1),JSON_OBJECT('a', "a")),
(JSON_OBJECT('i', 1),JSON_OBJECT('a', "b"));
SET SESSION optimizer_trace="enabled=on";
#
# Case 1: the reported query. Must not fail with ER_DUP_KEY, and must
#         group on the quoted values returned by JSON_EXTRACT().
#
SELECT
JSON_EXTRACT(data2, '$.a') as `a`,
CAST(count(*) AS JSON) as `*`
FROM test.t
WHERE
i = 1
GROUP BY
JSON_EXTRACT(data2, '$.a');
a	*
"a"	2
"b"	1
# Expect 0: the GROUP BY list was not rewritten to use GC 'a'
SELECT TRACE LIKE '%resulting_GROUP_BY%' AS group_by_substituted
FROM information_schema.OPTIMIZER_TRACE;
group_by_substituted
0
#
# Case 2: ORDER BY on the same expression. JSON comparison sorts numbers
#         before strings, so 2 precedes "10", while ordering by the
#         unquoted GC would have put '10' first.
#
CREATE TABLE t2 (
data2 json,
`a` varchar(128) GENERATED ALWAYS AS (
json_unquote(json_extract(`data2`,_utf8mb4'$.a'))
) STORED,
key (a)
) ENGINE=innodb;
INSERT INTO t2 (data2) VALUES
(JSON_OBJECT('a', 2)),
(JSON_OBJECT('a', "10"));
SELECT JSON_EXTRACT(data2, '$.a') AS `a` FROM t2
ORDER BY JSON_EXTRACT(data2, '$.a');
a
2
"10"
# Expect 0: the ORDER BY list was not rewritten to use GC 'a'
SELECT TRACE LIKE '%resulting_ORDER_BY%' AS order_by_substituted
FROM information_schema.OPTIMIZER_TRACE;
order_by_substituted
0
#
# Case 3: single table DELETE ... ORDER BY uses the same code path, so
#         the JSON-ordered first row (2) has to be the one deleted.
#
DELETE FROM t2 ORDER BY JSON_EXTRACT(data2, '$.a') LIMIT 1;
SELECT JSON_EXTRACT(data2, '$.a') AS `a` FROM t2;
a
"10"
#
# Case 4: the optimization is not over-blocked. When the query unquotes
#         the value itself the GC is value preserving (its collation
#         matches the one of JSON_UNQUOTE()) and must still be used.
#
CREATE TABLE t3 (
data2 json,
`a` varchar(128) COLLATE utf8mb4_bin GENERATED ALWAYS AS (
json_unquote(json_extract(`data2`,_utf8mb4'$.a'))
) STORED,
key (a)
) ENGINE=innodb;
INSERT INTO t3 (data2) VALUES
(JSON_OBJECT('a', "a")),
(JSON_OBJECT('a', "a")),
(JSON_OBJECT('a', "b"));
SELECT JSON_UNQUOTE(JSON_EXTRACT(data2, '$.a')) AS `a`, count(*) AS `*`
FROM t3
GROUP BY JSON_UNQUOTE(JSON_EXTRACT(data2, '$.a'));
a	*
a	2
b	1
# Expect 1: the GROUP BY list was rewritten to use GC 'a'
SELECT TRACE LIKE '%resulting_GROUP_BY%' AS group_by_substituted
FROM information_schema.OPTIMIZER_TRACE;
group_by_substituted
1
#
# Case 5: WHERE clause behaviour is unchanged, the index over the
#         unquoting GC is still used for a JSON_EXTRACT() predicate.
#
# Expect 1: the condition was rewritten to use GC 'a'
SELECT JSON_UNQUOTE(JSON_EXTRACT(data2, '$.a')) AS `a` FROM t3
WHERE JSON_EXTRACT(data2, '$.a') = 'b';
a
b
SELECT TRACE LIKE '%`a` = %' AS where_substituted
FROM information_schema.OPTIMIZER_TRACE;
where_substituted
1
#
# Case 6: a multi-valued index's field holds the set of values the
#         expression evaluates to, not the value itself, so it must
#         never replace a GROUP BY expression. Two distinct arrays
#         are two groups.
#
CREATE TABLE t4 (j json, INDEX mvi ((CAST(j->'$.arr' AS UNSIGNED ARRAY))));
INSERT INTO t4 VALUES ('{"arr":[1,2,3]}'), ('{"arr":[4,5,6]}');
# Warnings are off: the hypergraph optimizer notes that it does not
# support sorting of non-scalar JSON values.
SELECT j->'$.arr' AS c, count(*) AS `*` FROM t4 GROUP BY j->'$.arr';
c	*
[1, 2, 3]	1
[4, 5, 6]	1
# Expect 0: the GROUP BY list was not rewritten to use the array field
SELECT TRACE LIKE '%resulting_GROUP_BY%' AS group_by_substituted
FROM information_schema.OPTIMIZER_TRACE;
group_by_substituted
0
# The multi-valued index is still used for the predicates it supports:
# the predicand is substituted with the array field, which the trace
# prints as its expression, CAST(.. AS UNSIGNED ARRAY).
SELECT * FROM t4 WHERE 3 MEMBER OF (j->'$.arr');
j
{"arr": [1, 2, 3]}
# Expect 1
SELECT TRACE LIKE '%as unsigned array%' AS predicand_substituted
FROM information_schema.OPTIMIZER_TRACE;
predicand_substituted
1
SELECT * FROM t4 WHERE JSON_CONTAINS(j->'$.arr', '[3]');
j
{"arr": [1, 2, 3]}
# Expect 1
SELECT TRACE LIKE '%as unsigned array%' AS predicand_substituted
FROM information_schema.OPTIMIZER_TRACE;
predicand_substituted
1
SELECT * FROM t4 WHERE JSON_OVERLAPS(j->'$.arr', '[3,7]');
j
{"arr": [1, 2, 3]}
# Expect 1
SELECT TRACE LIKE '%as unsigned array%' AS predicand_substituted
FROM information_schema.OPTIMIZER_TRACE;
predicand_substituted
1
#
# Case 7: grouping and sorting follow the collation, so a GC whose
#         collation differs from the one of the expression must not
#         replace it. JSON_UNQUOTE() returns utf8mb4_bin while the
#         functional index below is utf8mb4_0900_ai_ci, hence 'a' and
#         'A' are two groups but would be merged into one.
#
CREATE TABLE t5 (data2 json, INDEX idx ((CAST(data2->>'$.a' AS CHAR(30)))));
INSERT INTO t5 VALUES (JSON_OBJECT('a','a')), (JSON_OBJECT('a','A'));
SELECT data2->>'$.a' AS c, count(*) AS `*` FROM t5 GROUP BY data2->>'$.a';
c	*
A	1
a	1
# Expect 0: the GROUP BY list was not rewritten to use the index
SELECT TRACE LIKE '%resulting_GROUP_BY%' AS group_by_substituted
FROM information_schema.OPTIMIZER_TRACE;
group_by_substituted
0
# Same for ORDER BY, utf8mb4_bin sorts 'A' before 'a'
SELECT data2->>'$.a' AS c FROM t5 ORDER BY data2->>'$.a';
c
A
a
SELECT TRACE LIKE '%resulting_ORDER_BY%' AS order_by_substituted
FROM information_schema.OPTIMIZER_TRACE;
order_by_substituted
0
# When the query asks for the same collation the index is still used
SELECT CAST(data2->>'$.a' AS CHAR(30)) AS c, count(*) AS `*` FROM t5
GROUP BY CAST(data2->>'$.a' AS CHAR(30));
c	*
a	2
# Expect 1
SELECT TRACE LIKE '%resulting_GROUP_BY%' AS group_by_substituted
FROM information_schema.OPTIMIZER_TRACE;
group_by_substituted
1
# WHERE pushdown to the functional index is unaffected: the condition
# is rewritten to the hidden field, printed as its CAST() expression.
SELECT data2 FROM t5 WHERE CAST(data2->>'$.a' AS CHAR(30)) = 'a';
data2
{"a": "A"}
{"a": "a"}
# Expect 1
SELECT TRACE LIKE '%as char(30) charset utf8mb4) = %' AS where_substituted
FROM information_schema.OPTIMIZER_TRACE;
where_substituted
1
#
# Case 8: the same collation mismatch on a plain generated column
#
CREATE TABLE t6 (
data2 json,
`a` varchar(128) GENERATED ALWAYS AS (
json_unquote(json_extract(`data2`,_utf8mb4'$.a'))
) STORED,
key (a)
) ENGINE=innodb;
INSERT INTO t6 (data2) VALUES (JSON_OBJECT('a','a')), (JSON_OBJECT('a','A'));
SELECT json_unquote(json_extract(data2,'$.a')) AS c, count(*) AS `*` FROM t6
GROUP BY json_unquote(json_extract(data2,'$.a'));
c	*
A	1
a	1
# Expect 0: the GROUP BY list was not rewritten to use GC 'a'
SELECT TRACE LIKE '%resulting_GROUP_BY%' AS group_by_substituted
FROM information_schema.OPTIMIZER_TRACE;
group_by_substituted
0
#
# Case 9: a numeric GC has no collation to compare, it must still be
#         substituted.
#
CREATE TABLE t7 (f1 int, gc int GENERATED ALWAYS AS (f1 + 1) STORED, key (gc));
INSERT INTO t7 (f1) VALUES (1),(1),(2);
SELECT f1 + 1 AS c, count(*) AS `*` FROM t7 GROUP BY f1 + 1;
c	*
2	2
3	1
# Expect 1
SELECT TRACE LIKE '%resulting_GROUP_BY%' AS group_by_substituted
FROM information_schema.OPTIMIZER_TRACE;
group_by_substituted
1
#
# Case 10: residual gap — TYPECAST is still stripped under
#          require_same_value, so a functional index CAST(.. AS UNSIGNED)
#          replaces GROUP BY on the inner expression and merges '1' and
#          '01'. If require_same_value also refused TYPECAST_FUNC, the
#          GROUP BY below would not be rewritten (substituted=0) and the
#          three distinct strings would remain three groups, matching
#          IGNORE INDEX FOR GROUP BY. Exact CAST() GROUP BY and WHERE
#          pushdown must keep working either way.
#
CREATE TABLE t8 (
data2 json,
INDEX idx ((CAST(data2->>'$.n' AS UNSIGNED)))
);
INSERT INTO t8 VALUES
(JSON_OBJECT('n','1')),
(JSON_OBJECT('n','01')),
(JSON_OBJECT('n','2'));
SELECT data2->>'$.n' AS c, count(*) AS `*` FROM t8 GROUP BY data2->>'$.n';
c	*
1	2
2	1
# Expect 1 today (TYPECAST stripped). Would be 0 if TYPECAST were gated.
SELECT TRACE LIKE '%resulting_GROUP_BY%' AS group_by_substituted
FROM information_schema.OPTIMIZER_TRACE;
group_by_substituted
1
SELECT data2->>'$.n' AS c, count(*) AS `*` FROM t8
IGNORE INDEX FOR GROUP BY (idx) GROUP BY data2->>'$.n';
c	*
01	1
1	1
2	1
SELECT CAST(data2->>'$.n' AS UNSIGNED) AS c, count(*) AS `*` FROM t8
GROUP BY CAST(data2->>'$.n' AS UNSIGNED);
c	*
1	2
2	1
# Expect 1 either way: exact CAST match
SELECT TRACE LIKE '%resulting_GROUP_BY%' AS group_by_substituted
FROM information_schema.OPTIMIZER_TRACE;
group_by_substituted
1
SELECT data2 FROM t8 WHERE CAST(data2->>'$.n' AS UNSIGNED) = 1;
data2
{"n": "01"}
{"n": "1"}
# Expect 1: WHERE pushdown unchanged
SELECT TRACE LIKE '%as unsigned%' AS where_substituted
FROM information_schema.OPTIMIZER_TRACE;
where_substituted
1
#
# Case 11: residual gap — same TYPECAST stripping with a length-
#          changing CAST and a matching collation. 'aa' and 'ab' are
#          merged into one group today. Gating TYPECAST under
#          require_same_value would leave three groups. Non-strict
#          sql_mode is required so truncated functional-index values
#          can be stored.
#
SET @old_sql_mode= @@sql_mode;
SET sql_mode='';
CREATE TABLE t9 (
data2 json,
INDEX idx (((CAST(data2->>'$.a' AS CHAR(1) CHARSET utf8mb4)) COLLATE utf8mb4_bin))
);
INSERT INTO t9 VALUES
(JSON_OBJECT('a','aa')),
(JSON_OBJECT('a','ab')),
(JSON_OBJECT('a','b'));
Warnings:
Warning	3751	Data truncated for functional index 'idx' at row 1
Warning	3751	Data truncated for functional index 'idx' at row 2
SET sql_mode= @old_sql_mode;
SELECT data2->>'$.a' AS c, count(*) AS `*` FROM t9 GROUP BY data2->>'$.a';
c	*
aa	2
b	1
# Expect 1 today (TYPECAST stripped). Would be 0 if TYPECAST were gated.
SELECT TRACE LIKE '%resulting_GROUP_BY%' AS group_by_substituted
FROM information_schema.OPTIMIZER_TRACE;
group_by_substituted
1
SELECT data2->>'$.a' AS c, count(*) AS `*` FROM t9
IGNORE INDEX FOR GROUP BY (idx) GROUP BY data2->>'$.a';
c	*
aa	1
ab	1
b	1
SELECT CAST(data2->>'$.a' AS CHAR(1) CHARSET utf8mb4) COLLATE utf8mb4_bin AS c,
count(*) AS `*` FROM t9
GROUP BY CAST(data2->>'$.a' AS CHAR(1) CHARSET utf8mb4) COLLATE utf8mb4_bin;
c	*
a	2
b	1
# Expect 1 either way: exact CAST/COLLATE match
SELECT TRACE LIKE '%resulting_GROUP_BY%' AS group_by_substituted
FROM information_schema.OPTIMIZER_TRACE;
group_by_substituted
1
SELECT data2 FROM t9
WHERE CAST(data2->>'$.a' AS CHAR(1) CHARSET utf8mb4) COLLATE utf8mb4_bin = 'a';
data2
{"a": "aa"}
{"a": "ab"}
# Expect 1: WHERE pushdown unchanged
SELECT TRACE LIKE '%collate%utf8mb4_bin% = %' AS where_substituted
FROM information_schema.OPTIMIZER_TRACE;
where_substituted
1
SET SESSION optimizer_trace="enabled=off";
DROP TABLE t, t2, t3, t4, t5, t6, t7, t8, t9;
