SET @innodb_file_per_table_orig = @@innodb_file_per_table;
SET GLOBAL innodb_file_per_table=on;
CREATE TABLE `t1` (
`a` int NOT NULL AUTO_INCREMENT,
`b` varchar(2) CHARACTER SET latin1 COLLATE latin1_german2_ci DEFAULT NULL,
`c` int DEFAULT NULL,
`d2` VARCHAR(2) GENERATED ALWAYS AS (UPPER(b)) VIRTUAL,
`d` varchar(2) CHARACTER SET latin1 COLLATE latin1_german2_ci  GENERATED ALWAYS AS (b) VIRTUAL,
PRIMARY KEY (`a`),
KEY `d` (`d`)
) ENGINE=InnoDB AUTO_INCREMENT=4096 DEFAULT CHARSET=utf8mb3 COLLATE=utf8_general_ci STATS_PERSISTENT=0;
Warnings:
Warning	1287	'utf8mb3' is deprecated and will be removed in a future release. Please use utf8mb4 instead
Warning	3778	'utf8mb3_general_ci' is a collation of the deprecated character set UTF8MB3. Please consider using UTF8MB4 with an appropriate collation instead.
INSERT INTO t1 VALUES(1,'SS',1, default,default);
SELECT HEX(d),a FROM t1 USE INDEX (d) WHERE a = 1;
HEX(d)	a
5353	1
SELECT HEX(d),a FROM t1 WHERE a = 1;
HEX(d)	a
5353	1
DELETE FROM t1 WHERE a=1;
INSERT INTO t1 VALUES(1,_latin1 0xdf,1, default, default);
SELECT HEX(d),a FROM t1 USE INDEX (d) WHERE a = 1;
HEX(d)	a
DF	1
SELECT HEX(d),a FROM t1 WHERE a = 1;
HEX(d)	a
DF	1
DROP TABLE t1;
SET GLOBAL innodb_file_per_table = @innodb_file_per_table_orig;
