<<<<<<< HEAD:mysql-test/suite/innodb/r/log_encrypt_1_mk.result
SET GLOBAL innodb_redo_log_encrypt = MASTER_KEY;
Warnings:
Warning	7013	InnoDB: Redo log cannot be encrypted if the keyring plugin is not loaded.
CREATE TABLE t1(c1 INT, c2 char(20)) ENCRYPTION="Y" ENGINE = InnoDB;
ERROR HY000: Can't find master key from keyring, please check in the server log if a keyring plugin is loaded and initialized successfully.
||||||| ea7d2e2d16a:mysql-test/suite/innodb/r/log_encrypt_1.result
SET GLOBAL innodb_redo_log_encrypt = ON;
CREATE TABLE t1(c1 INT, c2 char(20)) ENCRYPTION="Y" ENGINE = InnoDB;
ERROR HY000: Can't find master key from keyring, please check in the server log if a keyring plugin is loaded and initialized successfully.
=======
>>>>>>> mysql-8.0.20:mysql-test/suite/innodb/r/log_encrypt_1.result
CREATE TABLE t1(c1 INT, c2 char(20)) ENGINE = InnoDB;
<<<<<<< HEAD:mysql-test/suite/innodb/r/log_encrypt_1_mk.result
ALTER TABLE t1 ENCRYPTION="Y", algorithm=copy;
ERROR HY000: Can't find master key from keyring, please check in the server log if a keyring plugin is loaded and initialized successfully.
SET GLOBAL innodb_redo_log_encrypt = MASTER_KEY;
||||||| ea7d2e2d16a:mysql-test/suite/innodb/r/log_encrypt_1.result
ALTER TABLE t1 ENCRYPTION="Y", algorithm=copy;
ERROR HY000: Can't find master key from keyring, please check in the server log if a keyring plugin is loaded and initialized successfully.
# restart: --early-plugin-load=keyring_file=keyring_file.so --loose-keyring_file_data=MYSQL_TMP_DIR/mysecret_keyring_log1 --general-log --log-output=FILE --general_log_file=MYSQL_TMP_DIR/keyring_query_log --plugin-dir=KEYRING_PLUGIN_PATH 
SET GLOBAL innodb_redo_log_encrypt = ON;
=======
>>>>>>> mysql-8.0.20:mysql-test/suite/innodb/r/log_encrypt_1.result
SHOW CREATE TABLE t1;
Table	Create Table
t1	CREATE TABLE `t1` (
  `c1` int DEFAULT NULL,
  `c2` char(20) DEFAULT NULL
) ENGINE=InnoDB DEFAULT CHARSET=utf8mb4 COLLATE=utf8mb4_0900_ai_ci
INSERT INTO t1 VALUES(0, "aaaaa");
INSERT INTO t1 VALUES(1, "bbbbb");
INSERT INTO t1 VALUES(2, "ccccc");
INSERT INTO t1 VALUES(3, "ddddd");
INSERT INTO t1 VALUES(4, "eeeee");
INSERT INTO t1 VALUES(5, "fffff");
INSERT INTO t1 VALUES(6, "ggggg");
INSERT INTO t1 VALUES(7, "hhhhh");
INSERT INTO t1 VALUES(8, "iiiii");
INSERT INTO t1 VALUES(9, "jjjjj");
INSERT INTO t1 select * from t1;
INSERT INTO t1 select * from t1;
INSERT INTO t1 select * from t1;
INSERT INTO t1 select * from t1;
INSERT INTO t1 select * from t1;
INSERT INTO t1 select * from t1;
SELECT * FROM t1 ORDER BY c1 LIMIT 10;
c1	c2
0	aaaaa
0	aaaaa
0	aaaaa
0	aaaaa
0	aaaaa
0	aaaaa
0	aaaaa
0	aaaaa
0	aaaaa
0	aaaaa
<<<<<<< HEAD:mysql-test/suite/innodb/r/log_encrypt_1_mk.result
||||||| ea7d2e2d16a:mysql-test/suite/innodb/r/log_encrypt_1.result
# restart: --early-plugin-load=keyring_file=keyring_file.so --loose-keyring_file_data=MYSQL_TMP_DIR/mysecret_keyring_log1 --general-log --log-output=FILE --general_log_file=MYSQL_TMP_DIR/keyring_query_log --plugin-dir=KEYRING_PLUGIN_PATH --innodb_redo_log_encrypt=ON
=======
# restart:
>>>>>>> mysql-8.0.20:mysql-test/suite/innodb/r/log_encrypt_1.result
SELECT * FROM t1 ORDER BY c1 LIMIT 10;
c1	c2
0	aaaaa
0	aaaaa
0	aaaaa
0	aaaaa
0	aaaaa
0	aaaaa
0	aaaaa
0	aaaaa
0	aaaaa
0	aaaaa
DROP TABLE t1;
CREATE TABLE t1(c1 INT, c2 char(20)) ENGINE = InnoDB;
INSERT INTO t1 VALUES(0, "aaaaa");
INSERT INTO t1 VALUES(1, "bbbbb");
INSERT INTO t1 VALUES(2, "ccccc");
INSERT INTO t1 VALUES(3, "ddddd");
INSERT INTO t1 VALUES(4, "eeeee");
INSERT INTO t1 VALUES(5, "fffff");
INSERT INTO t1 VALUES(6, "ggggg");
INSERT INTO t1 VALUES(7, "hhhhh");
INSERT INTO t1 VALUES(8, "iiiii");
INSERT INTO t1 VALUES(9, "jjjjj");
<<<<<<< HEAD:mysql-test/suite/innodb/r/log_encrypt_1_mk.result
||||||| ea7d2e2d16a:mysql-test/suite/innodb/r/log_encrypt_1.result
# Kill the server
=======
# Kill the server
# restart:
>>>>>>> mysql-8.0.20:mysql-test/suite/innodb/r/log_encrypt_1.result
SELECT * FROM t1 ORDER BY c1 LIMIT 10;
c1	c2
0	aaaaa
1	bbbbb
2	ccccc
3	ddddd
4	eeeee
5	fffff
6	ggggg
7	hhhhh
8	iiiii
9	jjjjj
DELETE FROM t1;
START TRANSACTION;
INSERT INTO t1 VALUES(0, "aaaaa");
INSERT INTO t1 VALUES(1, "bbbbb");
INSERT INTO t1 VALUES(2, "ccccc");
INSERT INTO t1 VALUES(3, "ddddd");
INSERT INTO t1 VALUES(4, "eeeee");
INSERT INTO t1 VALUES(5, "fffff");
INSERT INTO t1 VALUES(6, "ggggg");
INSERT INTO t1 VALUES(7, "hhhhh");
INSERT INTO t1 VALUES(8, "iiiii");
INSERT INTO t1 VALUES(9, "jjjjj");
<<<<<<< HEAD:mysql-test/suite/innodb/r/log_encrypt_1_mk.result
||||||| ea7d2e2d16a:mysql-test/suite/innodb/r/log_encrypt_1.result
# restart: --early-plugin-load=keyring_file=keyring_file.so --loose-keyring_file_data=MYSQL_TMP_DIR/mysecret_keyring_log1 --general-log --log-output=FILE --general_log_file=MYSQL_TMP_DIR/keyring_query_log --plugin-dir=KEYRING_PLUGIN_PATH --innodb_redo_log_encrypt=ON
=======
# restart:
>>>>>>> mysql-8.0.20:mysql-test/suite/innodb/r/log_encrypt_1.result
SELECT * FROM t1 ORDER BY c1 LIMIT 10;
c1	c2
INSERT INTO t1 VALUES(0, "aaaaa");
INSERT INTO t1 VALUES(1, "bbbbb");
INSERT INTO t1 VALUES(2, "ccccc");
INSERT INTO t1 VALUES(3, "ddddd");
INSERT INTO t1 VALUES(4, "eeeee");
INSERT INTO t1 VALUES(5, "fffff");
INSERT INTO t1 VALUES(6, "ggggg");
INSERT INTO t1 VALUES(7, "hhhhh");
INSERT INTO t1 VALUES(8, "iiiii");
INSERT INTO t1 VALUES(9, "jjjjj");
SELECT * FROM t1 ORDER BY c1 LIMIT 10;
c1	c2
0	aaaaa
1	bbbbb
2	ccccc
3	ddddd
4	eeeee
5	fffff
6	ggggg
7	hhhhh
8	iiiii
9	jjjjj
DROP TABLE t1;
