CREATE TABLE t1(a INT AUTO_INCREMENT PRIMARY KEY) ENGINE=InnoDB;
INSERT INTO t1 VALUES ();
CREATE TABLE t2(a INT) ENGINE=InnoDB;
INSERT INTO t2 VALUE(1);
SET SESSION long_query_time=0;
SET SESSION log_slow_verbosity='microtime,innodb';
[log_start.inc] percona.slow_extended.innodb_0
SELECT SUM(a) FROM t1;
SUM(a)
1
[log_stop.inc] percona.slow_extended.innodb_0
[log_grep.inc] file: percona.slow_extended.innodb_0 pattern: ^# Schema: .+  Last_errno: \d+  Killed: \d+$
[log_grep.inc] lines:   2
[log_grep.inc] file: percona.slow_extended.innodb_0 pattern: ^#.*Rows_affected: \d+$
[log_grep.inc] lines:   2
[log_grep.inc] file: percona.slow_extended.innodb_0 pattern: ^# Bytes_sent: \d+.*$
[log_grep.inc] lines:   2
[log_grep.inc] file: percona.slow_extended.innodb_0 pattern: ^# InnoDB_trx_id: [1-9A-F][0-9A-F]*$
[log_grep.inc] lines:   1
[log_grep.inc] file: percona.slow_extended.innodb_0 pattern: ^# Bytes_sent: \d+  Tmp_tables: \d+  Tmp_disk_tables: \d+  Tmp_table_sizes: \d+$
[log_grep.inc] lines:   0
[log_grep.inc] file: percona.slow_extended.innodb_0 pattern: ^# QC_Hit: (Yes|No)  Full_scan: (Yes|No)  Full_join: (Yes|No)  Tmp_table: (Yes|No)  Tmp_table_on_disk: (Yes|No)$
[log_grep.inc] lines:   0
[log_grep.inc] file: percona.slow_extended.innodb_0 pattern: ^# Filesort: (Yes|No)  Filesort_on_disk: (Yes|No)  Merge_passes: \d+$
[log_grep.inc] lines:   0
[log_grep.inc] file: percona.slow_extended.innodb_0 pattern: ^#   InnoDB_IO_r_ops: 0  InnoDB_IO_r_bytes: 0  InnoDB_IO_r_wait: 0\.0*$
[log_grep.inc] lines:   0
[log_grep.inc] file: percona.slow_extended.innodb_0 pattern: ^#   InnoDB_IO_r_ops: [1-9]\d*  InnoDB_IO_r_bytes: [1-9]\d*  InnoDB_IO_r_wait: (0\.\d*[1-9]\d*|[1-9]\d*\.\d+)$
[log_grep.inc] lines:   1
[log_grep.inc] file: percona.slow_extended.innodb_0 pattern: ^#   InnoDB_rec_lock_wait: \d*\.\d*  InnoDB_queue_wait: \d*\.\d*$
[log_grep.inc] lines:   1
[log_grep.inc] file: percona.slow_extended.innodb_0 pattern: InnoDB_rec_lock_wait: 0\.0*
[log_grep.inc] lines:   1
[log_grep.inc] file: percona.slow_extended.innodb_0 pattern: InnoDB_rec_lock_wait: (0\.\d*[1-9]\d*|[1-9]\d*\.\d+)
[log_grep.inc] lines:   0
[log_grep.inc] file: percona.slow_extended.innodb_0 pattern: InnoDB_queue_wait: 0\.0*
[log_grep.inc] lines:   1
[log_grep.inc] file: percona.slow_extended.innodb_0 pattern: InnoDB_queue_wait: (0\.\d*[1-9]\d*|[1-9]\d*\.\d+)
[log_grep.inc] lines:   0
[log_grep.inc] file: percona.slow_extended.innodb_0 pattern: ^#   InnoDB_pages_distinct: [1-9]\d*$
[log_grep.inc] lines:   1
[log_grep.inc] file: percona.slow_extended.innodb_0 pattern: ^# No InnoDB statistics available for this query$
[log_grep.inc] lines:   1
[log_start.inc] percona.slow_extended.innodb_2
SELECT 5;
5
5
[log_stop.inc] percona.slow_extended.innodb_2
[log_grep.inc] file: percona.slow_extended.innodb_2 pattern: ^# Schema: .+  Last_errno: \d+  Killed: \d+$
[log_grep.inc] lines:   2
[log_grep.inc] file: percona.slow_extended.innodb_2 pattern: ^#.*Rows_affected: \d+$
[log_grep.inc] lines:   2
[log_grep.inc] file: percona.slow_extended.innodb_2 pattern: ^# Bytes_sent: \d+.*$
[log_grep.inc] lines:   2
[log_grep.inc] file: percona.slow_extended.innodb_2 pattern: ^# InnoDB_trx_id: [1-9A-F][0-9A-F]*$
[log_grep.inc] lines:   0
[log_grep.inc] file: percona.slow_extended.innodb_2 pattern: ^# Bytes_sent: \d+  Tmp_tables: \d+  Tmp_disk_tables: \d+  Tmp_table_sizes: \d+$
[log_grep.inc] lines:   0
[log_grep.inc] file: percona.slow_extended.innodb_2 pattern: ^# QC_Hit: (Yes|No)  Full_scan: (Yes|No)  Full_join: (Yes|No)  Tmp_table: (Yes|No)  Tmp_table_on_disk: (Yes|No)$
[log_grep.inc] lines:   0
[log_grep.inc] file: percona.slow_extended.innodb_2 pattern: ^# Filesort: (Yes|No)  Filesort_on_disk: (Yes|No)  Merge_passes: \d+$
[log_grep.inc] lines:   0
[log_grep.inc] file: percona.slow_extended.innodb_2 pattern: ^#   InnoDB_IO_r_ops: 0  InnoDB_IO_r_bytes: 0  InnoDB_IO_r_wait: 0\.0*$
[log_grep.inc] lines:   0
[log_grep.inc] file: percona.slow_extended.innodb_2 pattern: ^#   InnoDB_IO_r_ops: [1-9]\d*  InnoDB_IO_r_bytes: [1-9]\d*  InnoDB_IO_r_wait: (0\.\d*[1-9]\d*|[1-9]\d*\.\d+)$
[log_grep.inc] lines:   0
[log_grep.inc] file: percona.slow_extended.innodb_2 pattern: ^#   InnoDB_rec_lock_wait: \d*\.\d*  InnoDB_queue_wait: \d*\.\d*$
[log_grep.inc] lines:   0
[log_grep.inc] file: percona.slow_extended.innodb_2 pattern: InnoDB_rec_lock_wait: 0\.0*
[log_grep.inc] lines:   0
[log_grep.inc] file: percona.slow_extended.innodb_2 pattern: InnoDB_rec_lock_wait: (0\.\d*[1-9]\d*|[1-9]\d*\.\d+)
[log_grep.inc] lines:   0
[log_grep.inc] file: percona.slow_extended.innodb_2 pattern: InnoDB_queue_wait: 0\.0*
[log_grep.inc] lines:   0
[log_grep.inc] file: percona.slow_extended.innodb_2 pattern: InnoDB_queue_wait: (0\.\d*[1-9]\d*|[1-9]\d*\.\d+)
[log_grep.inc] lines:   0
[log_grep.inc] file: percona.slow_extended.innodb_2 pattern: ^#   InnoDB_pages_distinct: [1-9]\d*$
[log_grep.inc] lines:   0
[log_grep.inc] file: percona.slow_extended.innodb_2 pattern: ^# No InnoDB statistics available for this query$
[log_grep.inc] lines:   2
LOCK TABLE t1 WRITE;
SET SESSION long_query_time=50000;
SET SESSION long_query_time=0;
SET SESSION log_slow_verbosity='microtime,innodb';
[log_start.inc] percona.slow_extended.innodb_3
LOCK TABLE t1 WRITE;
SELECT SLEEP(2);
SLEEP(2)
0
UNLOCK TABLES;
[log_stop.inc] percona.slow_extended.innodb_3
[log_grep.inc] file: percona.slow_extended.innodb_3 pattern: ^# Schema: .+  Last_errno: \d+  Killed: \d+$
[log_grep.inc] lines:   2
[log_grep.inc] file: percona.slow_extended.innodb_3 pattern: ^#.*Rows_affected: \d+$
[log_grep.inc] lines:   2
[log_grep.inc] file: percona.slow_extended.innodb_3 pattern: ^# Bytes_sent: \d+.*$
[log_grep.inc] lines:   2
[log_grep.inc] file: percona.slow_extended.innodb_3 pattern: ^# InnoDB_trx_id: [1-9A-F][0-9A-F]*$
[log_grep.inc] lines:   0
[log_grep.inc] file: percona.slow_extended.innodb_3 pattern: ^# Bytes_sent: \d+  Tmp_tables: \d+  Tmp_disk_tables: \d+  Tmp_table_sizes: \d+$
[log_grep.inc] lines:   0
[log_grep.inc] file: percona.slow_extended.innodb_3 pattern: ^# QC_Hit: (Yes|No)  Full_scan: (Yes|No)  Full_join: (Yes|No)  Tmp_table: (Yes|No)  Tmp_table_on_disk: (Yes|No)$
[log_grep.inc] lines:   0
[log_grep.inc] file: percona.slow_extended.innodb_3 pattern: ^# Filesort: (Yes|No)  Filesort_on_disk: (Yes|No)  Merge_passes: \d+$
[log_grep.inc] lines:   0
[log_grep.inc] file: percona.slow_extended.innodb_3 pattern: ^#   InnoDB_IO_r_ops: 0  InnoDB_IO_r_bytes: 0  InnoDB_IO_r_wait: 0\.0*$
[log_grep.inc] lines:   0
[log_grep.inc] file: percona.slow_extended.innodb_3 pattern: ^#   InnoDB_IO_r_ops: [1-9]\d*  InnoDB_IO_r_bytes: [1-9]\d*  InnoDB_IO_r_wait: (0\.\d*[1-9]\d*|[1-9]\d*\.\d+)$
[log_grep.inc] lines:   0
[log_grep.inc] file: percona.slow_extended.innodb_3 pattern: ^#   InnoDB_rec_lock_wait: \d*\.\d*  InnoDB_queue_wait: \d*\.\d*$
[log_grep.inc] lines:   0
[log_grep.inc] file: percona.slow_extended.innodb_3 pattern: InnoDB_rec_lock_wait: 0\.0*
[log_grep.inc] lines:   0
[log_grep.inc] file: percona.slow_extended.innodb_3 pattern: InnoDB_rec_lock_wait: (0\.\d*[1-9]\d*|[1-9]\d*\.\d+)
[log_grep.inc] lines:   0
[log_grep.inc] file: percona.slow_extended.innodb_3 pattern: InnoDB_queue_wait: 0\.0*
[log_grep.inc] lines:   0
[log_grep.inc] file: percona.slow_extended.innodb_3 pattern: InnoDB_queue_wait: (0\.\d*[1-9]\d*|[1-9]\d*\.\d+)
[log_grep.inc] lines:   0
[log_grep.inc] file: percona.slow_extended.innodb_3 pattern: ^#   InnoDB_pages_distinct: [1-9]\d*$
[log_grep.inc] lines:   0
[log_grep.inc] file: percona.slow_extended.innodb_3 pattern: ^# No InnoDB statistics available for this query$
[log_grep.inc] lines:   2
UNLOCK TABLES;
BEGIN;
SELECT * FROM t2 FOR UPDATE;
a
1
[log_start.inc] percona.slow_extended.innodb_4
DELETE FROM t2 WHERE a=2;
SELECT SLEEP(2);
SLEEP(2)
0
COMMIT;
[log_stop.inc] percona.slow_extended.innodb_4
[log_grep.inc] file: percona.slow_extended.innodb_4 pattern: ^# Schema: .+  Last_errno: \d+  Killed: \d+$
[log_grep.inc] lines:   2
[log_grep.inc] file: percona.slow_extended.innodb_4 pattern: ^#.*Rows_affected: \d+$
[log_grep.inc] lines:   2
[log_grep.inc] file: percona.slow_extended.innodb_4 pattern: ^# Bytes_sent: \d+.*$
[log_grep.inc] lines:   2
[log_grep.inc] file: percona.slow_extended.innodb_4 pattern: ^# InnoDB_trx_id: [1-9A-F][0-9A-F]*$
[log_grep.inc] lines:   1
[log_grep.inc] file: percona.slow_extended.innodb_4 pattern: ^# Bytes_sent: \d+  Tmp_tables: \d+  Tmp_disk_tables: \d+  Tmp_table_sizes: \d+$
[log_grep.inc] lines:   0
[log_grep.inc] file: percona.slow_extended.innodb_4 pattern: ^# QC_Hit: (Yes|No)  Full_scan: (Yes|No)  Full_join: (Yes|No)  Tmp_table: (Yes|No)  Tmp_table_on_disk: (Yes|No)$
[log_grep.inc] lines:   0
[log_grep.inc] file: percona.slow_extended.innodb_4 pattern: ^# Filesort: (Yes|No)  Filesort_on_disk: (Yes|No)  Merge_passes: \d+$
[log_grep.inc] lines:   0
[log_grep.inc] file: percona.slow_extended.innodb_4 pattern: ^#   InnoDB_IO_r_ops: 0  InnoDB_IO_r_bytes: 0  InnoDB_IO_r_wait: 0\.0*$
[log_grep.inc] lines:   1
[log_grep.inc] file: percona.slow_extended.innodb_4 pattern: ^#   InnoDB_IO_r_ops: [1-9]\d*  InnoDB_IO_r_bytes: [1-9]\d*  InnoDB_IO_r_wait: (0\.\d*[1-9]\d*|[1-9]\d*\.\d+)$
[log_grep.inc] lines:   0
[log_grep.inc] file: percona.slow_extended.innodb_4 pattern: ^#   InnoDB_rec_lock_wait: \d*\.\d*  InnoDB_queue_wait: \d*\.\d*$
[log_grep.inc] lines:   1
[log_grep.inc] file: percona.slow_extended.innodb_4 pattern: InnoDB_rec_lock_wait: 0\.0*
[log_grep.inc] lines:   0
[log_grep.inc] file: percona.slow_extended.innodb_4 pattern: InnoDB_rec_lock_wait: (0\.\d*[1-9]\d*|[1-9]\d*\.\d+)
[log_grep.inc] lines:   1
[log_grep.inc] file: percona.slow_extended.innodb_4 pattern: InnoDB_queue_wait: 0\.0*
[log_grep.inc] lines:   1
[log_grep.inc] file: percona.slow_extended.innodb_4 pattern: InnoDB_queue_wait: (0\.\d*[1-9]\d*|[1-9]\d*\.\d+)
[log_grep.inc] lines:   0
[log_grep.inc] file: percona.slow_extended.innodb_4 pattern: ^#   InnoDB_pages_distinct: [1-9]\d*$
[log_grep.inc] lines:   1
[log_grep.inc] file: percona.slow_extended.innodb_4 pattern: ^# No InnoDB statistics available for this query$
[log_grep.inc] lines:   1
SET SESSION long_query_time=0;
#
# PS-4788: Setting log_slow_verbosity and enabling the slow_query_log could lead to a server crash
#
SET @saved_slow_query_log = @@GLOBAL.slow_query_log;
SET SESSION log_slow_verbosity='microtime,innodb,query_plan';
SET @@GLOBAL.slow_query_log=1;
SELECT * FROM INFORMATION_SCHEMA.TABLES;
SET GLOBAL slow_query_log = @saved_slow_query_log;
DROP TABLE t1, t2;
