# restart:<hidden args>
SET @innodb_lock_wait_timeout_saved = @@GLOBAL.innodb_lock_wait_timeout;
SET @innodb_print_lock_wait_timeout_info_saved =
@@GLOBAL.innodb_print_lock_wait_timeout_info;
SET GLOBAL innodb_lock_wait_timeout = 1;
SET GLOBAL innodb_print_lock_wait_timeout_info = true;
CREATE TABLE t (i INT) ENGINE = InnoDB;
INSERT INTO t (i) VALUES(1);
START TRANSACTION;
SELECT * FROM t WHERE i = 1 LOCK IN SHARE MODE;
i
1
START TRANSACTION;
DELETE FROM t WHERE i = 1;
ERROR HY000: Lock wait timeout exceeded; try restarting transaction
COMMIT;
DELETE FROM t WHERE i = 1;
COMMIT;
Grepping the error log for lock wait timeout info
Pattern "Lock wait timeout info:" found
DROP TABLE t;
#
# Test for PS-5134 : handle_fatal_signal (sig=11) in thd_get_thread_id
#
CREATE TABLE t5134(c0 INT UNSIGNED AUTO_INCREMENT PRIMARY KEY) ENGINE=INNODB;
BEGIN;
SELECT database_name, table_name FROM mysql.innodb_table_stats WHERE table_name='t5134' FOR UPDATE;
database_name	table_name
test	t5134
INSERT INTO t5134 VALUES (), ();
Grepping the error log for lock wait timeout info
Pattern "Requested thread id: <background>" found
ROLLBACK;
DROP TABLE t5134;
SET GLOBAL innodb_lock_wait_timeout = @innodb_lock_wait_timeout_saved;
SET GLOBAL innodb_print_lock_wait_timeout_info =
@innodb_print_lock_wait_timeout_info_saved;
