SELECT audit_log_filter_set_filter('log_connect', '{
"filter": {
"class": {
"name": "connection",
"event": {
"name": "connect"
      }
}
}
}');
audit_log_filter_set_filter('log_connect', '{
"filter": {
"class": {
"name": "connection",
"event": {
"name": "connect"
      }
}
}
}')
OK
SELECT audit_log_filter_set_user('%', 'log_connect');
audit_log_filter_set_user('%', 'log_connect')
OK
Tag <CONNECTION_ATTRIBUTES> Ok
Tag <NAME>_client_name</NAME> Ok
Tag <NAME>_client_version</NAME> Ok
Tag <NAME>_platform</NAME> Ok
#
# Cleanup
DELETE FROM mysql.audit_log_user;
DELETE FROM mysql.audit_log_filter;
SELECT audit_log_filter_flush();
audit_log_filter_flush()
OK
