SELECT audit_log_filter_set_filter('log_table_access', '{"filter": {"class": {"name": "table_access"}}}');
audit_log_filter_set_filter('log_table_access', '{"filter": {"class": {"name": "table_access"}}}')
OK
SELECT audit_log_filter_set_user('%', 'log_table_access');
audit_log_filter_set_user('%', 'log_table_access')
OK
Escape rules Ok
#
# Cleanup
DELETE FROM mysql.audit_log_user;
DELETE FROM mysql.audit_log_filter;
SELECT audit_log_filter_flush();
audit_log_filter_flush()
OK
DROP TABLE a;
