SELECT audit_log_filter_set_filter('log_all', '{"filter": {"log": true}}');
audit_log_filter_set_filter('log_all', '{"filter": {"log": true}}')
OK
SELECT audit_log_filter_set_user('%', 'log_all');
audit_log_filter_set_user('%', 'log_all')
OK
# restart: --audit_log_filter_format=OLD
# restart: --audit_log_filter_format=JSON
# restart: --audit_log_filter_format=NEW
File format Ok
File format Ok
File format Ok
#
# Cleanup
DELETE FROM mysql.audit_log_user;
DELETE FROM mysql.audit_log_filter;
SELECT audit_log_filter_flush();
audit_log_filter_flush()
OK
