SELECT audit_log_filter_set_filter('log_general', '{"filter": {"class": {"name": "general"}}}');
audit_log_filter_set_filter('log_general', '{"filter": {"class": {"name": "general"}}}')
OK
SELECT audit_log_filter_set_user('%', 'log_general');
audit_log_filter_set_user('%', 'log_general')
OK
SELECT audit_log_rotate();
audit_log_rotate()
<file_name>
SELECT audit_log_rotate();
audit_log_rotate()
<file_name>
Rotated files Ok
#
# Cleanup
DELETE FROM mysql.audit_log_user;
DELETE FROM mysql.audit_log_filter;
SELECT audit_log_filter_flush();
audit_log_filter_flush()
OK
