SELECT audit_log_filter_set_filter('log_general', '{"filter": {"class": {"name": "general"}}}');
audit_log_filter_set_filter('log_general', '{"filter": {"class": {"name": "general"}}}')
OK
SELECT audit_log_filter_set_user('%', 'log_general');
audit_log_filter_set_user('%', 'log_general')
OK
Audit_log_filter_events counter updated
Audit_log_filter_events_filtered counter updated
Audit_log_filter_events_written counter updated
#
# Cleanup
DELETE FROM mysql.audit_log_user;
DELETE FROM mysql.audit_log_filter;
SELECT audit_log_filter_flush();
audit_log_filter_flush()
OK
