SELECT audit_log_filter_set_filter('log_general', '{"filter": {"class": {"name": "general"}}}');
audit_log_filter_set_filter('log_general', '{"filter": {"class": {"name": "general"}}}')
OK
SELECT audit_log_filter_set_user('%', 'log_general');
audit_log_filter_set_user('%', 'log_general')
OK
# restart: --audit_log_filter_buffer_size=4096
SHOW GLOBAL STATUS LIKE 'Audit_log_filter_events_lost';
Variable_name	Value
Audit_log_filter_events_lost	0
SHOW GLOBAL STATUS LIKE 'Audit_log_filter_event_max_drop_size';
Variable_name	Value
Audit_log_filter_event_max_drop_size	0
SHOW GLOBAL STATUS LIKE 'Audit_log_filter_events_lost';
Variable_name	Value
Audit_log_filter_events_lost	0
SHOW GLOBAL STATUS LIKE 'Audit_log_filter_event_max_drop_size';
Variable_name	Value
Audit_log_filter_event_max_drop_size	0
# restart: --audit_log_filter_buffer_size=4096 --audit_log_filter_strategy=PERFORMANCE
SHOW GLOBAL STATUS LIKE 'Audit_log_filter_events_lost';
Variable_name	Value
Audit_log_filter_events_lost	0
SHOW GLOBAL STATUS LIKE 'Audit_log_filter_event_max_drop_size';
Variable_name	Value
Audit_log_filter_event_max_drop_size	0
SHOW GLOBAL STATUS LIKE 'Audit_log_filter_events_lost';
Variable_name	Value
Audit_log_filter_events_lost	3
SHOW GLOBAL STATUS LIKE 'Audit_log_filter_event_max_drop_size';
Variable_name	Value
Audit_log_filter_event_max_drop_size	4406
#
# Cleanup
DELETE FROM mysql.audit_log_user;
DELETE FROM mysql.audit_log_filter;
SELECT audit_log_filter_flush();
audit_log_filter_flush()
OK
