SET DEFAULT_STORAGE_ENGINE='tokudb';
*** Bug #22169 ***
DROP TABLE IF EXISTS t1;
create table t1 (a varchar(10), b varchar(255), c varchar(10), d varchar(300), e varchar(10), f varchar(20), primary key (c), clustering key (b), clustering key (d,a));
insert into t1 values ("1","10","100","1000","10000","100000");
insert into t1 values ("2","20","200","2000","20000","200000");
insert into t1 values ("3","30","300","3000","30000","300000");
insert into t1 values ("4","40","400","4000","40000","400000");
insert into t1 values ("5","50","500","5000","50000","500000");
explain select * from t1 where c > "0";
id	select_type	table	partitions	type	possible_keys	key	key_len	ref	rows	filtered	Extra
1	SIMPLE	t1	NULL	range	PRIMARY	NULL	12	NULL;	5	100.00	Using where
Warnings:
Note	1003	/* select#1 */ select `test`.`t1`.`a` AS `a`,`test`.`t1`.`b` AS `b`,`test`.`t1`.`c` AS `c`,`test`.`t1`.`d` AS `d`,`test`.`t1`.`e` AS `e`,`test`.`t1`.`f` AS `f` from `test`.`t1` where (`test`.`t1`.`c` > '0')
select * from t1;
a	b	c	d	e	f
1	10	100	1000	10000	100000
2	20	200	2000	20000	200000
3	30	300	3000	30000	300000
4	40	400	4000	40000	400000
5	50	500	5000	50000	500000
explain select * from t1 where b > "0";
id	select_type	table	partitions	type	possible_keys	key	key_len	ref	rows	filtered	Extra
1	SIMPLE	t1	NULL	range	b	NULL	258	NULL;	5	100.00	Using where
Warnings:
Note	1003	/* select#1 */ select `test`.`t1`.`a` AS `a`,`test`.`t1`.`b` AS `b`,`test`.`t1`.`c` AS `c`,`test`.`t1`.`d` AS `d`,`test`.`t1`.`e` AS `e`,`test`.`t1`.`f` AS `f` from `test`.`t1` where (`test`.`t1`.`b` > '0')
select * from t1 where b > "0";
a	b	c	d	e	f
1	10	100	1000	10000	100000
2	20	200	2000	20000	200000
3	30	300	3000	30000	300000
4	40	400	4000	40000	400000
5	50	500	5000	50000	500000
explain select * from t1 where d > "0";
id	select_type	table	partitions	type	possible_keys	key	key_len	ref	rows	filtered	Extra
1	SIMPLE	t1	NULL	range	d	NULL	303	NULL;	5	100.00	Using where
Warnings:
Note	1003	/* select#1 */ select `test`.`t1`.`a` AS `a`,`test`.`t1`.`b` AS `b`,`test`.`t1`.`c` AS `c`,`test`.`t1`.`d` AS `d`,`test`.`t1`.`e` AS `e`,`test`.`t1`.`f` AS `f` from `test`.`t1` where (`test`.`t1`.`d` > '0')
select * from t1 where d > "0";
a	b	c	d	e	f
1	10	100	1000	10000	100000
2	20	200	2000	20000	200000
3	30	300	3000	30000	300000
4	40	400	4000	40000	400000
5	50	500	5000	50000	500000
explain select a from t1 where d > "0";
id	select_type	table	partitions	type	possible_keys	key	key_len	ref	rows	filtered	Extra
1	SIMPLE	t1	NULL	index	d	NULL	316	NULL;	5	100.00	Using where; Using index
Warnings:
Note	1003	/* select#1 */ select `test`.`t1`.`a` AS `a` from `test`.`t1` where (`test`.`t1`.`d` > '0')
select a from t1 where d > "0";
a
1
2
3
4
5
select e,f from t1 where c > "0";
e	f
10000	100000
20000	200000
30000	300000
40000	400000
50000	500000
select e,f from t1 where b > "0";
e	f
10000	100000
20000	200000
30000	300000
40000	400000
50000	500000
select e,f from t1 where d > "0";
e	f
10000	100000
20000	200000
30000	300000
40000	400000
50000	500000
update t1 set a = a+1, b = b+10;
explain select * from t1 where c > "0";
id	select_type	table	partitions	type	possible_keys	key	key_len	ref	rows	filtered	Extra
1	SIMPLE	t1	NULL	range	PRIMARY	NULL	12	NULL;	5	100.00	Using where
Warnings:
Note	1003	/* select#1 */ select `test`.`t1`.`a` AS `a`,`test`.`t1`.`b` AS `b`,`test`.`t1`.`c` AS `c`,`test`.`t1`.`d` AS `d`,`test`.`t1`.`e` AS `e`,`test`.`t1`.`f` AS `f` from `test`.`t1` where (`test`.`t1`.`c` > '0')
select * from t1 where c > "0";
a	b	c	d	e	f
2	20	100	1000	10000	100000
3	30	200	2000	20000	200000
4	40	300	3000	30000	300000
5	50	400	4000	40000	400000
6	60	500	5000	50000	500000
explain select * from t1 where b > "0";
id	select_type	table	partitions	type	possible_keys	key	key_len	ref	rows	filtered	Extra
1	SIMPLE	t1	NULL	range	b	NULL	258	NULL;	10	100.00	Using where
Warnings:
Note	1003	/* select#1 */ select `test`.`t1`.`a` AS `a`,`test`.`t1`.`b` AS `b`,`test`.`t1`.`c` AS `c`,`test`.`t1`.`d` AS `d`,`test`.`t1`.`e` AS `e`,`test`.`t1`.`f` AS `f` from `test`.`t1` where (`test`.`t1`.`b` > '0')
select * from t1 where b > "0";
a	b	c	d	e	f
2	20	100	1000	10000	100000
3	30	200	2000	20000	200000
4	40	300	3000	30000	300000
5	50	400	4000	40000	400000
6	60	500	5000	50000	500000
explain select * from t1 where d > "0";
id	select_type	table	partitions	type	possible_keys	key	key_len	ref	rows	filtered	Extra
1	SIMPLE	t1	NULL	range	d	NULL	303	NULL;	10	100.00	Using where
Warnings:
Note	1003	/* select#1 */ select `test`.`t1`.`a` AS `a`,`test`.`t1`.`b` AS `b`,`test`.`t1`.`c` AS `c`,`test`.`t1`.`d` AS `d`,`test`.`t1`.`e` AS `e`,`test`.`t1`.`f` AS `f` from `test`.`t1` where (`test`.`t1`.`d` > '0')
select * from t1 where d > "0";
a	b	c	d	e	f
2	20	100	1000	10000	100000
3	30	200	2000	20000	200000
4	40	300	3000	30000	300000
5	50	400	4000	40000	400000
6	60	500	5000	50000	500000
explain select a from t1 where d > "0";
id	select_type	table	partitions	type	possible_keys	key	key_len	ref	rows	filtered	Extra
1	SIMPLE	t1	NULL	index	d	NULL	316	NULL;	5	100.00	Using where; Using index
Warnings:
Note	1003	/* select#1 */ select `test`.`t1`.`a` AS `a` from `test`.`t1` where (`test`.`t1`.`d` > '0')
select a from t1 where d > "0";
a
2
3
4
5
6
select e,f from t1 where c > "0";
e	f
10000	100000
20000	200000
30000	300000
40000	400000
50000	500000
select e,f from t1 where b > "0";
e	f
10000	100000
20000	200000
30000	300000
40000	400000
50000	500000
select e,f from t1 where d > "0";
e	f
10000	100000
20000	200000
30000	300000
40000	400000
50000	500000
delete from t1 where b > 35;
explain select * from t1 where c > "0";
id	select_type	table	partitions	type	possible_keys	key	key_len	ref	rows	filtered	Extra
1	SIMPLE	t1	NULL	range	PRIMARY	NULL	12	NULL;	5	100.00	Using where
Warnings:
Note	1003	/* select#1 */ select `test`.`t1`.`a` AS `a`,`test`.`t1`.`b` AS `b`,`test`.`t1`.`c` AS `c`,`test`.`t1`.`d` AS `d`,`test`.`t1`.`e` AS `e`,`test`.`t1`.`f` AS `f` from `test`.`t1` where (`test`.`t1`.`c` > '0')
select * from t1 where c > "0";
a	b	c	d	e	f
2	20	100	1000	10000	100000
3	30	200	2000	20000	200000
explain select * from t1 where b > "0";
id	select_type	table	partitions	type	possible_keys	key	key_len	ref	rows	filtered	Extra
1	SIMPLE	t1	NULL	range	b	NULL	258	NULL;	10	100.00	Using where
Warnings:
Note	1003	/* select#1 */ select `test`.`t1`.`a` AS `a`,`test`.`t1`.`b` AS `b`,`test`.`t1`.`c` AS `c`,`test`.`t1`.`d` AS `d`,`test`.`t1`.`e` AS `e`,`test`.`t1`.`f` AS `f` from `test`.`t1` where (`test`.`t1`.`b` > '0')
select * from t1 where b > "0";
a	b	c	d	e	f
2	20	100	1000	10000	100000
3	30	200	2000	20000	200000
explain select * from t1 where d > "0";
id	select_type	table	partitions	type	possible_keys	key	key_len	ref	rows	filtered	Extra
1	SIMPLE	t1	NULL	range	d	NULL	303	NULL;	10	100.00	Using where
Warnings:
Note	1003	/* select#1 */ select `test`.`t1`.`a` AS `a`,`test`.`t1`.`b` AS `b`,`test`.`t1`.`c` AS `c`,`test`.`t1`.`d` AS `d`,`test`.`t1`.`e` AS `e`,`test`.`t1`.`f` AS `f` from `test`.`t1` where (`test`.`t1`.`d` > '0')
select * from t1 where d > "0";
a	b	c	d	e	f
2	20	100	1000	10000	100000
3	30	200	2000	20000	200000
explain select a from t1 where d > "0";
id	select_type	table	partitions	type	possible_keys	key	key_len	ref	rows	filtered	Extra
1	SIMPLE	t1	NULL	index	d	NULL	316	NULL;	2	100.00	Using where; Using index
Warnings:
Note	1003	/* select#1 */ select `test`.`t1`.`a` AS `a` from `test`.`t1` where (`test`.`t1`.`d` > '0')
select a from t1 where d > "0";
a
2
3
select e,f from t1 where c > "0";
e	f
10000	100000
20000	200000
select e,f from t1 where b > "0";
e	f
10000	100000
20000	200000
select e,f from t1 where d > "0";
e	f
10000	100000
20000	200000
alter table t1 drop index b, drop index d;
alter table t1 add clustering key d(d,a), add clustering key b(b);
explain select * from t1 where c > "0";
id	select_type	table	partitions	type	possible_keys	key	key_len	ref	rows	filtered	Extra
1	SIMPLE	t1	NULL	range	PRIMARY	NULL	12	NULL;	2	100.00	Using where
Warnings:
Note	1003	/* select#1 */ select `test`.`t1`.`a` AS `a`,`test`.`t1`.`b` AS `b`,`test`.`t1`.`c` AS `c`,`test`.`t1`.`d` AS `d`,`test`.`t1`.`e` AS `e`,`test`.`t1`.`f` AS `f` from `test`.`t1` where (`test`.`t1`.`c` > '0')
select * from t1 where c > "0";
a	b	c	d	e	f
2	20	100	1000	10000	100000
3	30	200	2000	20000	200000
explain select * from t1 where b > "0";
id	select_type	table	partitions	type	possible_keys	key	key_len	ref	rows	filtered	Extra
1	SIMPLE	t1	NULL	range	b	NULL	258	NULL;	2	100.00	Using where
Warnings:
Note	1003	/* select#1 */ select `test`.`t1`.`a` AS `a`,`test`.`t1`.`b` AS `b`,`test`.`t1`.`c` AS `c`,`test`.`t1`.`d` AS `d`,`test`.`t1`.`e` AS `e`,`test`.`t1`.`f` AS `f` from `test`.`t1` where (`test`.`t1`.`b` > '0')
select * from t1 where b > "0";
a	b	c	d	e	f
2	20	100	1000	10000	100000
3	30	200	2000	20000	200000
explain select * from t1 where d > "0";
id	select_type	table	partitions	type	possible_keys	key	key_len	ref	rows	filtered	Extra
1	SIMPLE	t1	NULL	range	d	NULL	303	NULL;	2	100.00	Using where
Warnings:
Note	1003	/* select#1 */ select `test`.`t1`.`a` AS `a`,`test`.`t1`.`b` AS `b`,`test`.`t1`.`c` AS `c`,`test`.`t1`.`d` AS `d`,`test`.`t1`.`e` AS `e`,`test`.`t1`.`f` AS `f` from `test`.`t1` where (`test`.`t1`.`d` > '0')
select * from t1 where d > "0";
a	b	c	d	e	f
2	20	100	1000	10000	100000
3	30	200	2000	20000	200000
explain select a from t1 where d > "0";
id	select_type	table	partitions	type	possible_keys	key	key_len	ref	rows	filtered	Extra
1	SIMPLE	t1	NULL	index	d	NULL	316	NULL;	2	100.00	Using where; Using index
Warnings:
Note	1003	/* select#1 */ select `test`.`t1`.`a` AS `a` from `test`.`t1` where (`test`.`t1`.`d` > '0')
select a from t1 where d > "0";
a
2
3
select e,f from t1 where c > "0";
e	f
10000	100000
20000	200000
select e,f from t1 where b > "0";
e	f
10000	100000
20000	200000
select e,f from t1 where d > "0";
e	f
10000	100000
20000	200000
DROP TABLE t1;
