CREATE TABLE t1 (a int) ENGINE=TOKUDB;
INSERT t1 VALUES(10);
INSERT INTo t1 SELECT * from t1;
INSERT INTo t1 SELECT * from t1;
UPDATE t1 SET a=13;
SELECT * from t1;
a
13
13
13
13
DELETE FROM t1;
1
SELECT SLEEP(2);
SLEEP(2)
0
1
DROP TABLE t1;
