SET NAMES latin1;
SET collation_connection='ucs2_general50_ci';
drop table if exists t1;
create table t1 as select repeat(' ', 64) as s1;
select collation(s1) from t1;
collation(s1)
ucs2_general50_ci
delete from t1;
insert into t1 values ('a'),('ae'),(_latin1 0xE4);
insert into t1 values ('o'),('oe'),(_latin1 0xF6);
insert into t1 values ('s'),('ss'),(_latin1 0xDF);
insert into t1 values ('u'),('ue'),(_latin1 0xFC);
select s1, hex(s1) from t1 order by s1, binary s1;
s1	hex(s1)
a	0061
ä	00E4
ae	00610065
o	006F
ö	00F6
oe	006F0065
s	0073
ss	00730073
u	0075
ü	00FC
ue	00750065
ß	00DF
select group_concat(s1 order by binary s1) from t1 group by s1;
group_concat(s1 order by binary s1)
a,ä
ae
o,ö
oe
s
ss
u,ü
ue
ß
drop table t1;
