DROP TABLE IF EXISTS t1, t2;
CREATE TABLE t1(a INT) ENGINE=InnoDB;
INSERT INTO t1 VALUE(1);
CREATE TABLE t2(a INT) ENGINE=InnoDB;
INSERT INTO t2 VALUE(1);
SET SESSION min_examined_row_limit=0;
SET SESSION long_query_time=0;
SET @old_log_slow_verbosity := @@log_slow_verbosity;
SET SESSION log_slow_verbosity='microtime,innodb';
[log_start.inc] percona.slow_extended.innodb_0
INSERT INTO t1 VALUES(2);
INSERT INTO t2 VALUES(2);
INSERT INTO t1 VALUES(3);
SELECT 5;
5
5
[log_stop.inc] percona.slow_extended.innodb_0
LOCK TABLE t1 WRITE;
[log_start.inc] percona.slow_extended.innodb_3
LOCK TABLE t1 WRITE;
SELECT SLEEP(5);
SLEEP(5)
0
UNLOCK TABLES;
[log_stop.inc] percona.slow_extended.innodb_3
UNLOCK TABLES;
BEGIN;
SELECT * FROM t2 FOR UPDATE;
a
1
2
[log_start.inc] percona.slow_extended.innodb_4
DELETE FROM t2 WHERE a=2;
SELECT SLEEP(5);
SLEEP(5)
0
COMMIT;
[log_stop.inc] percona.slow_extended.innodb_4
SET SESSION min_examined_row_limit=default;
SET SESSION long_query_time=default;
SET SESSION log_slow_verbosity=@old_log_slow_verbosity;
DROP TABLE t1, t2;
