SET GLOBAL innodb_encryption_threads=4;
create table innodb_normal(c1 bigint not null, b char(200)) engine=innodb;
create table innodb_compact(c1 bigint not null, b char(200)) engine=innodb row_format=compact;
create table innodb_dynamic(c1 bigint not null, b char(200)) engine=innodb row_format=dynamic;
create table innodb_compressed(c1 bigint not null, b char(200)) engine=innodb row_format=compressed;
create table innodb_redundant(c1 bigint not null, b char(200)) engine=innodb row_format=redundant;
show warnings;
Level	Code	Message
show create table innodb_normal;
Table	Create Table
innodb_normal	CREATE TABLE `innodb_normal` (
  `c1` bigint(20) NOT NULL,
  `b` char(200) DEFAULT NULL
) ENGINE=InnoDB DEFAULT CHARSET=utf8mb4 COLLATE=utf8mb4_0900_ai_ci ENCRYPTION_KEY_ID=0
show create table innodb_compact;
Table	Create Table
innodb_compact	CREATE TABLE `innodb_compact` (
  `c1` bigint(20) NOT NULL,
  `b` char(200) DEFAULT NULL
) ENGINE=InnoDB DEFAULT CHARSET=utf8mb4 COLLATE=utf8mb4_0900_ai_ci ROW_FORMAT=COMPACT ENCRYPTION_KEY_ID=0
show create table innodb_dynamic;
Table	Create Table
innodb_dynamic	CREATE TABLE `innodb_dynamic` (
  `c1` bigint(20) NOT NULL,
  `b` char(200) DEFAULT NULL
) ENGINE=InnoDB DEFAULT CHARSET=utf8mb4 COLLATE=utf8mb4_0900_ai_ci ROW_FORMAT=DYNAMIC ENCRYPTION_KEY_ID=0
show create table innodb_compressed;
Table	Create Table
innodb_compressed	CREATE TABLE `innodb_compressed` (
  `c1` bigint(20) NOT NULL,
  `b` char(200) DEFAULT NULL
) ENGINE=InnoDB DEFAULT CHARSET=utf8mb4 COLLATE=utf8mb4_0900_ai_ci ROW_FORMAT=COMPRESSED ENCRYPTION_KEY_ID=0
show create table innodb_redundant;
Table	Create Table
innodb_redundant	CREATE TABLE `innodb_redundant` (
  `c1` bigint(20) NOT NULL,
  `b` char(200) DEFAULT NULL
) ENGINE=InnoDB DEFAULT CHARSET=utf8mb4 COLLATE=utf8mb4_0900_ai_ci ROW_FORMAT=REDUNDANT ENCRYPTION_KEY_ID=0
create procedure innodb_insert_proc (repeat_count int)
begin
declare current_num int;
set current_num = 0;
while current_num < repeat_count do
insert into innodb_normal values(current_num, substring(MD5(RAND()), -64));
set current_num = current_num + 1;
end while;
end//
commit;
set autocommit=0;
call innodb_insert_proc(2000);
commit;
set autocommit=1;
insert into innodb_compact select * from innodb_normal;
insert into innodb_dynamic select * from innodb_normal;
insert into innodb_compressed select * from innodb_normal;
insert into innodb_redundant select * from innodb_normal;
update innodb_normal set c1 = c1 + 1;
update innodb_compact set c1 = c1 + 1;
update innodb_dynamic set c1 = c1 + 1;
update innodb_compressed set c1 = c1 + 1;
update innodb_redundant set c1 = c1 + 1;
select count(*) from innodb_normal;
count(*)
2000
select count(*) from innodb_compact where c1 < 1500000;
count(*)
2000
select count(*) from innodb_dynamic where c1 < 1500000;
count(*)
2000
select count(*) from innodb_compressed where c1 < 1500000;
count(*)
2000
select count(*) from innodb_redundant where c1 < 1500000;
count(*)
2000
select count(*) from innodb_compact t1, innodb_normal t2 where
t1.c1 = t2.c1 and t1.b = t2.b;
count(*)
2000
select count(*) from innodb_dynamic t1, innodb_normal t2 where
t1.c1 = t2.c1 and t1.b = t2.b;
count(*)
2000
select count(*) from innodb_compressed t1, innodb_normal t2 where
t1.c1 = t2.c1 and t1.b = t2.b;
count(*)
2000
select count(*) from innodb_redundant t1, innodb_normal t2 where
t1.c1 = t2.c1 and t1.b = t2.b;
count(*)
2000
include/assert.inc [Some pages should have been encrypted by now]
# restart:--innodb-encryption-threads=4
update innodb_normal set c1 = c1 + 1;
update innodb_compact set c1 = c1 + 1;
update innodb_dynamic set c1 = c1 + 1;
update innodb_compressed set c1 = c1 + 1;
update innodb_redundant set c1 = c1 + 1;
select count(*) from innodb_normal;
count(*)
2000
select count(*) from innodb_compact where c1 < 1500000;
count(*)
2000
select count(*) from innodb_dynamic where c1 < 1500000;
count(*)
2000
select count(*) from innodb_compressed where c1 < 1500000;
count(*)
2000
select count(*) from innodb_redundant where c1 < 1500000;
count(*)
2000
select count(*) from innodb_compact t1, innodb_normal t2 where
t1.c1 = t2.c1 and t1.b = t2.b;
count(*)
2000
select count(*) from innodb_dynamic t1, innodb_normal t2 where
t1.c1 = t2.c1 and t1.b = t2.b;
count(*)
2000
select count(*) from innodb_compressed t1, innodb_normal t2 where
t1.c1 = t2.c1 and t1.b = t2.b;
count(*)
2000
select count(*) from innodb_redundant t1, innodb_normal t2 where
t1.c1 = t2.c1 and t1.b = t2.b;
count(*)
2000
include/assert.inc [There should be some pages decrypted]
drop procedure innodb_insert_proc;
drop table innodb_normal;
drop table innodb_compact;
drop table innodb_dynamic;
drop table innodb_compressed;
drop table innodb_redundant;
SET GLOBAL default_table_encryption = ONLINE_FROM_KEYRING_TO_UNENCRYPTED;
SET GLOBAL innodb_encryption_threads=0;
SET GLOBAL default_table_encryption = ONLINE_TO_KEYRING;
